A1: Simon Collins & Random Day
A2: Season Two: an average joe kind of publishing company
A4: FORMAT | B4: GENRE | C4: ROYALTY RATE (% of net sales) | D4: ADVANCE | E4: LIST PRICE | F4: PP&B PER UNIT (12% of list price) | G4: UNITS PRINTED | H4: PRINTING COST (PP&B x units printed) | I4: MARKETING (capped) | J4: UNITS SOLD | K4: NET SALES (55% average discount) | L4: ROYALTIES EARNED (rate x net sales) | M4: ROYALTIES PAID (after advance) | N4: OVERHEAD (capped) | O4: NET PROFIT (or LOSS) | P4: PROFIT MARGIN
A5: Hardcover | B5: LITERARY FICTION | C5: 0.12 | D5: 250000 | E5: 29.95 | F5: =E5*0.12 -> 3.5939999999999999 | G5: 193200 | H5: =G5*F5 -> 694360.8 | I5: 104166.66666666669 | J5: 193200 | K5: =E5*J5*0.45 -> 2603853 | L5: =C5*K5 -> 312462.36 | M5: =IF((C5*K5)-D5<=0,0,(C5*K5)-D5) -> 62462.36 | N5: 416666.66666666674 | O5: =K5-D5-H5-I5-M5-N5 -> 1076196.5066666666 | P5: =O5/K5 -> 0.41330924083143966
A6: Hardcover | B6: LITERARY FICTION | C6: 0.12 | D6: 75000 | E6: 21.95 | F6: =E6*0.12 -> 2.6339999999999999 | G6: 79100 | H6: =G6*F6 -> 208349.4 | I6: 31250 | J6: 31640 | K6: =E6*J6*0.45 -> 312524.1 | L6: =C6*K6 -> 37502.892 | M6: =IF((C6*K6)-D6<=0,0,(C6*K6)-D6) -> 0 | N6: 125000 | O6: =K6-D6-H6-I6-M6-N6 -> -127075.3 | P6: =O6/K6 -> -0.40660960226747295
A7: Hardcover | B7: LITERARY FICTION | C7: 0.12 | D7: 25000 | E7: 29.95 | F7: =E7*0.12 -> 3.5939999999999999 | G7: 19300 | H7: =G7*F7 -> 69364.2 | I7: 10416.666666666668 | J7: 19300 | K7: =E7*J7*0.45 -> 260115.75 | L7: =C7*K7 -> 31213.89 | M7: =IF((C7*K7)-D7<=0,0,(C7*K7)-D7) -> 6213.89 | N7: 41666.666666666672 | O7: =K7-D7-H7-I7-M7-N7 -> 107454.32666666668 | P7: =O7/K7 -> 0.41310196197910615
A8: Hardcover | B8: LITERARY FICTION | C8: 0.12 | D8: 5000 | E8: 29.95 | F8: =E8*0.12 -> 3.5939999999999999 | G8: 3900 | H8: =G8*F8 -> 14016.6 | I8: 2083.3333333333335 | J8: 1560 | K8: =E8*J8*0.45 -> 21024.9 | L8: =C8*K8 -> 2522.9880000000003 | M8: =IF((C8*K8)-D8<=0,0,(C8*K8)-D8) -> 0 | N8: 8333.3333333333339 | O8: =K8-D8-H8-I8-M8-N8 -> -8408.3666666666668 | P8: =O8/K8 -> -0.39992421684130086
A9: PBR: Trade Paper | B9: LITERARY FICTION | C9: 0.12 | D9: 25000 | E9: 14.95 | F9: =E9*0.12 -> 1.7939999999999998 | G9: 38700 | H9: =G9*F9 -> 69427.8 | I9: 10416.666666666668 | J9: 30960 | K9: =E9*J9*0.45 -> 208283.4 | L9: =C9*K9 -> 24994.007999999998 | M9: =IF((C9*K9)-D9<=0,0,(C9*K9)-D9) -> 0 | N9: 41666.666666666672 | O9: =K9-D9-H9-I9-M9-N9 -> 61772.266666666663 | P9: =O9/K9 -> 0.29657796380636509
A10: PBR: Trade Paper | B10: LITERARY FICTION | C10: 0.12 | D10: 10000 | E10: 14.95 | F10: =E10*0.12 -> 1.7939999999999998 | G10: 15500 | H10: =G10*F10 -> 27807 | I10: 4166.666666666667 | J10: 6200 | K10: =E10*J10*0.45 -> 41710.5 | L10: =C10*K10 -> 5005.26 | M10: =IF((C10*K10)-D10<=0,0,(C10*K10)-D10) -> 0 | N10: 16666.666666666668 | O10: =K10-D10-H10-I10-M10-N10 -> -16929.833333333332 | P10: =O10/K10 -> -0.40588900476698508
A11: PBR: Trade Paper | B11: LITERARY FICTION | C11: 0.12 | D11: 10000 | E11: 14.95 | F11: =E11*0.12 -> 1.7939999999999998 | G11: 15500 | H11: =G11*F11 -> 27807 | I11: 4166.666666666667 | J11: 12400 | K11: =E11*J11*0.45 -> 83421 | L11: =C11*K11 -> 10010.52 | M11: =IF((C11*K11)-D11<=0,0,(C11*K11)-D11) -> 10.520000000000437 | N11: 16666.666666666668 | O11: =K11-D11-H11-I11-M11-N11 -> 24770.146666666671 | P11: =O11/K11 -> 0.29692939028142401
A12: Trade Paper Original | B12: LITERARY FICTION | C12: 0.12 | D12: 25000 | E12: 16.95 | F12: =E12*0.12 -> 2.0339999999999998 | G12: 34100 | H12: =G12*F12 -> 69359.4 | I12: 10416.666666666668 | J12: 13640 | K12: =E12*J12*0.45 -> 104039.1 | L12: =C12*K12 -> 12484.692000000001 | M12: =IF((C12*K12)-D12<=0,0,(C12*K12)-D12) -> 0 | N12: 41666.666666666672 | O12: =K12-D12-H12-I12-M12-N12 -> -42403.633333333331 | P12: =O12/K12 -> -0.4075740114373666
A13: Trade Paper Original | B13: LITERARY FICTION | C13: 0.12 | D13: 10000 | E13: 16.95 | F13: =E13*0.12 -> 2.0339999999999998 | G13: 13700 | H13: =G13*F13 -> 27865.8 | I13: 4166.666666666667 | J13: 10960 | K13: =E13*J13*0.45 -> 83597.4 | L13: =C13*K13 -> 10031.688 | M13: =IF((C13*K13)-D13<=0,0,(C13*K13)-D13) -> 31.688000000000102 | N13: 16666.666666666668 | O13: =K13-D13-H13-I13-M13-N13 -> 24866.578666666679 | P13: =O13/K13 -> 0.29745636427289218
A14: Trade Paper Original | B14: LITERARY FICTION | C14: 0.12 | D14: 5000 | E14: 16.95 | F14: =E14*0.12 -> 2.0339999999999998 | G14: 6800 | H14: =G14*F14 -> 13831.2 | I14: 2083.3333333333335 | J14: 1700 | K14: =E14*J14*0.45 -> 12966.75 | L14: =C14*K14 -> 1556.01 | M14: =IF((C14*K14)-D14<=0,0,(C14*K14)-D14) -> 0 | N14: 8333.3333333333339 | O14: =K14-D14-H14-I14-M14-N14 -> -16281.116666666667 | P14: =O14/K14 -> -1.2556050410987076
A15: Hardcover | B15: HORROR | C15: 0.12 | D15: 100000 | E15: 29.95 | F15: =E15*0.12 -> 3.5939999999999999 | G15: 77300 | H15: =G15*F15 -> 277816.2 | I15: 41666.666666666672 | J15: 61840 | K15: =E15*J15*0.45 -> 833448.6 | L15: =C15*K15 -> 100013.83199999999 | M15: =IF((C15*K15)-D15<=0,0,(C15*K15)-D15) -> 13.831999999994878 | N15: 166666.66666666669 | O15: =K15-D15-H15-I15-M15-N15 -> 247285.2346666666 | P15: =O15/K15 -> 0.29670124188422248
A16: Hardcover | B16: HORROR | C16: 0.12 | D16: 75000 | E16: 29.95 | F16: =E16*0.12 -> 3.5939999999999999 | G16: 58000 | H16: =G16*F16 -> 208452 | I16: 31250 | J16: 46400 | K16: =E16*J16*0.45 -> 625356 | L16: =C16*K16 -> 75042.720000000001 | M16: =IF((C16*K16)-D16<=0,0,(C16*K16)-D16) -> 42.720000000001164 | N16: 125000 | O16: =K16-D16-H16-I16-M16-N16 -> 185611.28 | P16: =O16/K16 -> 0.29680898560180125
A17: Hardcover | B17: HORROR | C17: 0.12 | D17: 25000 | E17: 24.95 | F17: =E17*0.12 -> 2.9939999999999998 | G17: 23200 | H17: =G17*F17 -> 69460.800000000003 | I17: 10416.666666666668 | J17: 9280 | K17: =E17*J17*0.45 -> 104191.2 | L17: =C17*K17 -> 12502.944 | M17: =IF((C17*K17)-D17<=0,0,(C17*K17)-D17) -> 0 | N17: 41666.666666666672 | O17: =K17-D17-H17-I17-M17-N17 -> -42352.933333333334 | P17: =O17/K17 -> -0.40649242290455756
A18: PBR: Mass Market | B18: HORROR | C18: 0.12 | D18: 75000 | E18: 7.95 | F18: =E18*0.12 -> 0.95399999999999996 | G18: 218400 | H18: =G18*F18 -> 208353.6 | I18: 31250 | J18: 174720 | K18: =E18*J18*0.45 -> 625060.8 | L18: =C18*K18 -> 75007.296000000002 | M18: =IF((C18*K18)-D18<=0,0,(C18*K18)-D18) -> 7.2960000000020955 | N18: 125000 | O18: =K18-D18-H18-I18-M18-N18 -> 185449.9040000001 | P18: =O18/K18 -> 0.29669098430104734
A19: PBR: Mass Market | B19: HORROR | C19: 0.12 | D19: 25000 | E19: 7.95 | F19: =E19*0.12 -> 0.95399999999999996 | G19: 72800 | H19: =G19*F19 -> 69451.199999999997 | I19: 10416.666666666668 | J19: 58240 | K19: =E19*J19*0.45 -> 208353.6 | L19: =C19*K19 -> 25002.432000000001 | M19: =IF((C19*K19)-D19<=0,0,(C19*K19)-D19) -> 2.4320000000006985 | N19: 41666.666666666672 | O19: =K19-D19-H19-I19-M19-N19 -> 61816.634666666665 | P19: =O19/K19 -> 0.29669098430104718
A20: PBR: Trade Paper | B20: HORROR | C20: 0.12 | D20: 25000 | E20: 15.95 | F20: =E20*0.12 -> 1.9139999999999999 | G20: 36300 | H20: =G20*F20 -> 69478.2 | I20: 10416.666666666668 | J20: 14520 | K20: =E20*J20*0.45 -> 104217.3 | L20: =C20*K20 -> 12506.075999999999 | M20: =IF((C20*K20)-D20<=0,0,(C20*K20)-D20) -> 0 | N20: 41666.666666666672 | O20: =K20-D20-H20-I20-M20-N20 -> -42344.233333333337 | P20: =O20/K20 -> -0.40630714222430764
A21: PBR: Trade Paper | B21: HORROR | C21: 0.12 | D21: 10000 | E21: 14.95 | F21: =E21*0.12 -> 1.7939999999999998 | G21: 15500 | H21: =G21*F21 -> 27807 | I21: 4166.666666666667 | J21: 6200 | K21: =E21*J21*0.45 -> 41710.5 | L21: =C21*K21 -> 5005.26 | M21: =IF((C21*K21)-D21<=0,0,(C21*K21)-D21) -> 0 | N21: 16666.666666666668 | O21: =K21-D21-H21-I21-M21-N21 -> -16929.833333333332 | P21: =O21/K21 -> -0.40588900476698508
A22: Trade Paper Original | B22: HORROR | C22: 0.12 | D22: 10000 | E22: 16.95 | F22: =E22*0.12 -> 2.0339999999999998 | G22: 13700 | H22: =G22*F22 -> 27865.8 | I22: 4166.666666666667 | J22: 5480 | K22: =E22*J22*0.45 -> 41798.7 | L22: =C22*K22 -> 5015.8440000000001 | M22: =IF((C22*K22)-D22<=0,0,(C22*K22)-D22) -> 0 | N22: 16666.666666666668 | O22: =K22-D22-H22-I22-M22-N22 -> -16900.433333333327 | P22: =O22/K22 -> -0.40432916175223932
A23: Hardcover | B23: MYSTERY/SUSPENSE | C23: 0.12 | D23: 1000000 | E23: 29.95 | F23: =E23*0.12 -> 3.5939999999999999 | G23: 772900 | H23: =G23*F23 -> 2777802.6 | I23: 416666.66666666674 | J23: 309160 | K23: =E23*J23*0.45 -> 4166703.9 | L23: =C23*K23 -> 500004.46799999999 | M23: =IF((C23*K23)-D23<=0,0,(C23*K23)-D23) -> 0 | N23: 1666666.666666667 | O23: =K23-D23-H23-I23-M23-N23 -> -1694432.0333333339 | P23: =O23/K23 -> -0.40666005408575684
A24: Hardcover | B24: MYSTERY/SUSPENSE | C24: 0.12 | D24: 250000 | E24: 27.95 | F24: =E24*0.12 -> 3.3539999999999996 | G24: 207100 | H24: =G24*F24 -> 694613.4 | I24: 104166.66666666669 | J24: 186390 | K24: =E24*J24*0.45 -> 2344320.2250000001 | L24: =C24*K24 -> 281318.42700000003 | M24: =IF((C24*K24)-D24<=0,0,(C24*K24)-D24) -> 31318.427000000025 | N24: 416666.66666666674 | O24: =K24-D24-H24-I24-M24-N24 -> 847555.06466666679 | P24: =O24/K24 -> 0.36153553410847133
A25: Hardcover | B25: MYSTERY/SUSPENSE | C25: 0.12 | D25: 75000 | E25: 24.95 | F25: =E25*0.12 -> 2.9939999999999998 | G25: 69600 | H25: =G25*F25 -> 208382.4 | I25: 31250 | J25: 62640 | K25: =E25*J25*0.45 -> 703290.6 | L25: =C25*K25 -> 84394.871999999988 | M25: =IF((C25*K25)-D25<=0,0,(C25*K25)-D25) -> 9394.8719999999885 | N25: 125000 | O25: =K25-D25-H25-I25-M25-N25 -> 254263.32799999998 | P25: =O25/K25 -> 0.3615338069355683
A26: Hardcover | B26: MYSTERY/SUSPENSE | C26: 0.12 | D26: 50000 | E26: 21.95 | F26: =E26*0.12 -> 2.6339999999999999 | G26: 52700 | H26: =G26*F26 -> 138811.8 | I26: 20833.333333333332 | J26: 15810 | K26: =E26*J26*0.45 -> 156163.27499999999 | L26: =C26*K26 -> 18739.592999999997 | M26: =IF((C26*K26)-D26<=0,0,(C26*K26)-D26) -> 0 | N26: 83333.333333333328 | O26: =K26-D26-H26-I26-M26-N26 -> -136815.19166666665 | P26: =O26/K26 -> -0.87610349915283636
A27: Hardcover | B27: MYSTERY/SUSPENSE | C27: 0.12 | D27: 25000 | E27: 29.95 | F27: =E27*0.12 -> 3.5939999999999999 | G27: 19300 | H27: =G27*F27 -> 69364.2 | I27: 10416.666666666668 | J27: 7720 | K27: =E27*J27*0.45 -> 104046.3 | L27: =C27*K27 -> 12485.556 | M27: =IF((C27*K27)-D27<=0,0,(C27*K27)-D27) -> 0 | N27: 41666.666666666672 | O27: =K27-D27-H27-I27-M27-N27 -> -42401.233333333337 | P27: =O27/K27 -> -0.40752274067730748
A28: Hardcover | B28: MYSTERY/SUSPENSE | C28: 0.12 | D28: 25000 | E28: 24.95 | F28: =E28*0.12 -> 2.9939999999999998 | G28: 23200 | H28: =G28*F28 -> 69460.800000000003 | I28: 10416.666666666668 | J28: 18560 | K28: =E28*J28*0.45 -> 208382.4 | L28: =C28*K28 -> 25005.887999999999 | M28: =IF((C28*K28)-D28<=0,0,(C28*K28)-D28) -> 5.8879999999990105 | N28: 41666.666666666672 | O28: =K28-D28-H28-I28-M28-N28 -> 61832.378666666671 | P28: =O28/K28 -> 0.2967255328025144
A29: PBR: Mass Market | B29: MYSTERY/SUSPENSE | C29: 0.12 | D29: 100000 | E29: 7.95 | F29: =E29*0.12 -> 0.95399999999999996 | G29: 291200 | H29: =G29*F29 -> 277804.79999999999 | I29: 41666.666666666672 | J29: 116480 | K29: =E29*J29*0.45 -> 416707.2 | L29: =C29*K29 -> 50004.864000000001 | M29: =IF((C29*K29)-D29<=0,0,(C29*K29)-D29) -> 0 | N29: 166666.66666666669 | O29: =K29-D29-H29-I29-M29-N29 -> -169430.93333333335 | P29: =O29/K29 -> -0.40659468646890035
A30: PBR: Mass Market | B30: MYSTERY/SUSPENSE | C30: 0.12 | D30: 100000 | E30: 7.95 | F30: =E30*0.12 -> 0.95399999999999996 | G30: 291200 | H30: =G30*F30 -> 277804.79999999999 | I30: 41666.666666666672 | J30: 232960 | K30: =E30*J30*0.45 -> 833414.4 | L30: =C30*K30 -> 100009.728 | M30: =IF((C30*K30)-D30<=0,0,(C30*K30)-D30) -> 9.728000000002794 | N30: 166666.66666666669 | O30: =K30-D30-H30-I30-M30-N30 -> 247266.53866666666 | P30: =O30/K30 -> 0.29669098430104718
A31: PBR: Trade Paper | B31: MYSTERY/SUSPENSE | C31: 0.12 | D31: 50000 | E31: 14.95 | F31: =E31*0.12 -> 1.7939999999999998 | G31: 77400 | H31: =G31*F31 -> 138855.6 | I31: 20833.333333333336 | J31: 61920 | K31: =E31*J31*0.45 -> 416566.8 | L31: =C31*K31 -> 49988.015999999996 | M31: =IF((C31*K31)-D31<=0,0,(C31*K31)-D31) -> 0 | N31: 83333.333333333343 | O31: =K31-D31-H31-I31-M31-N31 -> 123544.53333333333 | P31: =O31/K31 -> 0.29657796380636509
A32: Trade Paper Original | B32: MYSTERY/SUSPENSE | C32: 0.12 | D32: 25000 | E32: 16.95 | F32: =E32*0.12 -> 2.0339999999999998 | G32: 34100 | H32: =G32*F32 -> 69359.4 | I32: 10416.666666666668 | J32: 10230 | K32: =E32*J32*0.45 -> 78029.324999999997 | L32: =C32*K32 -> 9363.5189999999984 | M32: =IF((C32*K32)-D32<=0,0,(C32*K32)-D32) -> 0 | N32: 41666.666666666672 | O32: =K32-D32-H32-I32-M32-N32 -> -68413.40833333334 | P32: =O32/K32 -> -0.87676534858315569
A33: Hardcover | B33: SF/FANTASY | C33: 0.12 | D33: 100000 | E33: 27.95 | F33: =E33*0.12 -> 3.3539999999999996 | G33: 82800 | H33: =G33*F33 -> 277711.2 | I33: 41666.666666666664 | J33: 74520 | K33: =E33*J33*0.45 -> 937275.3 | L33: =C33*K33 -> 112473.03600000001 | M33: =IF((C33*K33)-D33<=0,0,(C33*K33)-D33) -> 12473.036000000007 | N33: 166666.66666666666 | O33: =K33-D33-H33-I33-M33-N33 -> 338757.73066666676 | P33: =O33/K33 -> 0.36142820649030943
A34: Hardcover | B34: SF/FANTASY | C34: 0.12 | D34: 75000 | E34: 29.95 | F34: =E34*0.12 -> 3.5939999999999999 | G34: 58000 | H34: =G34*F34 -> 208452 | I34: 31250 | J34: 58000 | K34: =E34*J34*0.45 -> 781695 | L34: =C34*K34 -> 93803.4 | M34: =IF((C34*K34)-D34<=0,0,(C34*K34)-D34) -> 18803.4 | N34: 125000 | O34: =K34-D34-H34-I34-M34-N34 -> 323189.6 | P34: =O34/K34 -> 0.41344718848144096
A35: Hardcover | B35: SF/FANTASY | C35: 0.12 | D35: 50000 | E35: 29.95 | F35: =E35*0.12 -> 3.5939999999999999 | G35: 38600 | H35: =G35*F35 -> 138728.4 | I35: 20833.333333333336 | J35: 9650 | K35: =E35*J35*0.45 -> 130057.875 | L35: =C35*K35 -> 15606.945 | M35: =IF((C35*K35)-D35<=0,0,(C35*K35)-D35) -> 0 | N35: 83333.333333333343 | O35: =K35-D35-H35-I35-M35-N35 -> -162837.19166666668 | P35: =O35/K35 -> -1.252036385083692
A36: Hardcover | B36: SF/FANTASY | C36: 0.12 | D36: 10000 | E36: 21.95 | F36: =E36*0.12 -> 2.6339999999999999 | G36: 10500 | H36: =G36*F36 -> 27657 | I36: 4166.666666666667 | J36: 4200 | K36: =E36*J36*0.45 -> 41485.5 | L36: =C36*K36 -> 4978.26 | M36: =IF((C36*K36)-D36<=0,0,(C36*K36)-D36) -> 0 | N36: 16666.666666666668 | O36: =K36-D36-H36-I36-M36-N36 -> -17004.833333333336 | P36: =O36/K36 -> -0.40989823753681009
A37: PBR: Mass Market | B37: SF/FANTASY | C37: 0.12 | D37: 75000 | E37: 7.95 | F37: =E37*0.12 -> 0.95399999999999996 | G37: 218400 | H37: =G37*F37 -> 208353.6 | I37: 31250 | J37: 174720 | K37: =E37*J37*0.45 -> 625060.8 | L37: =C37*K37 -> 75007.296000000002 | M37: =IF((C37*K37)-D37<=0,0,(C37*K37)-D37) -> 7.2960000000020955 | N37: 125000 | O37: =K37-D37-H37-I37-M37-N37 -> 185449.9040000001 | P37: =O37/K37 -> 0.29669098430104734
A38: PBR: Trade Paper | B38: SF/FANTASY | C38: 0.12 | D38: 50000 | E38: 14.95 | F38: =E38*0.12 -> 1.7939999999999998 | G38: 77400 | H38: =G38*F38 -> 138855.6 | I38: 20833.333333333336 | J38: 23220 | K38: =E38*J38*0.45 -> 156212.55 | L38: =C38*K38 -> 18745.506000000001 | M38: =IF((C38*K38)-D38<=0,0,(C38*K38)-D38) -> 0 | N38: 83333.333333333343 | O38: =K38-D38-H38-I38-M38-N38 -> -136809.71666666665 | P38: =O38/K38 -> -0.87579209651635948
A39: PBR: Trade Paper | B39: SF/FANTASY | C39: 0.12 | D39: 10000 | E39: 15.95 | F39: =E39*0.12 -> 1.9139999999999999 | G39: 14500 | H39: =G39*F39 -> 27753 | I39: 4166.666666666667 | J39: 5800 | K39: =E39*J39*0.45 -> 41629.5 | L39: =C39*K39 -> 4995.54 | M39: =IF((C39*K39)-D39<=0,0,(C39*K39)-D39) -> 0 | N39: 16666.666666666668 | O39: =K39-D39-H39-I39-M39-N39 -> -16956.833333333336 | P39: =O39/K39 -> -0.40732733598369752
A40: Trade Paper Original | B40: SF/FANTASY | C40: 0.12 | D40: 10000 | E40: 16.95 | F40: =E40*0.12 -> 2.0339999999999998 | G40: 13700 | H40: =G40*F40 -> 27865.8 | I40: 4166.666666666667 | J40: 10960 | K40: =E40*J40*0.45 -> 83597.4 | L40: =C40*K40 -> 10031.688 | M40: =IF((C40*K40)-D40<=0,0,(C40*K40)-D40) -> 31.688000000000102 | N40: 16666.666666666668 | O40: =K40-D40-H40-I40-M40-N40 -> 24866.578666666679 | P40: =O40/K40 -> 0.29745636427289218
A41: Hardcover | B41: THRILLER | C41: 0.12 | D41: 500000 | E41: 27.95 | F41: =E41*0.12 -> 3.3539999999999996 | G41: 414100 | H41: =G41*F41 -> 1388891.4 | I41: 208333.33333333337 | J41: 331280 | K41: =E41*J41*0.45 -> 4166674.2 | L41: =C41*K41 -> 500000.90399999998 | M41: =IF((C41*K41)-D41<=0,0,(C41*K41)-D41) -> 0.90399999998044223 | N41: 833333.33333333349 | O41: =K41-D41-H41-I41-M41-N41 -> 1236115.2293333332 | P41: =O41/K41 -> 0.29666711866584938
A42: Hardcover | B42: THRILLER | C42: 0.12 | D42: 250000 | E42: 27.95 | F42: =E42*0.12 -> 3.3539999999999996 | G42: 207100 | H42: =G42*F42 -> 694613.4 | I42: 104166.66666666669 | J42: 51775 | K42: =E42*J42*0.45 -> 651200.0625 | L42: =C42*K42 -> 78144.007499999992 | M42: =IF((C42*K42)-D42<=0,0,(C42*K42)-D42) -> 0 | N42: 416666.66666666674 | O42: =K42-D42-H42-I42-M42-N42 -> -814246.6708333334 | P42: =O42/K42 -> -1.2503786742700649
A43: Hardcover | B43: THRILLER | C43: 0.12 | D43: 250000 | E43: 21.95 | F43: =E43*0.12 -> 2.6339999999999999 | G43: 263600 | H43: =G43*F43 -> 694322.4 | I43: 104166.66666666669 | J43: 210880 | K43: =E43*J43*0.45 -> 2082967.2 | L43: =C43*K43 -> 249956.06399999998 | M43: =IF((C43*K43)-D43<=0,0,(C43*K43)-D43) -> 0 | N43: 416666.66666666674 | O43: =K43-D43-H43-I43-M43-N43 -> 617811.46666666633 | P43: =O43/K43 -> 0.29660162995685496
A44: Hardcover | B44: THRILLER | C44: 0.12 | D44: 25000 | E44: 29.95 | F44: =E44*0.12 -> 3.5939999999999999 | G44: 19300 | H44: =G44*F44 -> 69364.2 | I44: 10416.666666666668 | J44: 7720 | K44: =E44*J44*0.45 -> 104046.3 | L44: =C44*K44 -> 12485.556 | M44: =IF((C44*K44)-D44<=0,0,(C44*K44)-D44) -> 0 | N44: 41666.666666666672 | O44: =K44-D44-H44-I44-M44-N44 -> -42401.233333333337 | P44: =O44/K44 -> -0.40752274067730748
A45: PBR: Mass Market | B45: THRILLER | C45: 0.12 | D45: 75000 | E45: 7.95 | F45: =E45*0.12 -> 0.95399999999999996 | G45: 218400 | H45: =G45*F45 -> 208353.6 | I45: 31250 | J45: 87360 | K45: =E45*J45*0.45 -> 312530.4 | L45: =C45*K45 -> 37503.648000000001 | M45: =IF((C45*K45)-D45<=0,0,(C45*K45)-D45) -> 0 | N45: 125000 | O45: =K45-D45-H45-I45-M45-N45 -> -127073.2 | P45: =O45/K45 -> -0.40659468646890012
A46: PBR: Mass Market | B46: THRILLER | C46: 0.12 | D46: 75000 | E46: 7.95 | F46: =E46*0.12 -> 0.95399999999999996 | G46: 218400 | H46: =G46*F46 -> 208353.6 | I46: 31250 | J46: 174720 | K46: =E46*J46*0.45 -> 625060.8 | L46: =C46*K46 -> 75007.296000000002 | M46: =IF((C46*K46)-D46<=0,0,(C46*K46)-D46) -> 7.2960000000020955 | N46: 125000 | O46: =K46-D46-H46-I46-M46-N46 -> 185449.9040000001 | P46: =O46/K46 -> 0.29669098430104734
A47: PBR: Mass Market | B47: THRILLER | C47: 0.12 | D47: 25000 | E47: 7.95 | F47: =E47*0.12 -> 0.95399999999999996 | G47: 72800 | H47: =G47*F47 -> 69451.199999999997 | I47: 10416.666666666668 | J47: 29120 | K47: =E47*J47*0.45 -> 104176.8 | L47: =C47*K47 -> 12501.216 | M47: =IF((C47*K47)-D47<=0,0,(C47*K47)-D47) -> 0 | N47: 41666.666666666672 | O47: =K47-D47-H47-I47-M47-N47 -> -42357.733333333337 | P47: =O47/K47 -> -0.40659468646890035
A48: PBR: Trade Paper | B48: THRILLER | C48: 0.12 | D48: 50000 | E48: 14.95 | F48: =E48*0.12 -> 1.7939999999999998 | G48: 77400 | H48: =G48*F48 -> 138855.6 | I48: 20833.333333333336 | J48: 61920 | K48: =E48*J48*0.45 -> 416566.8 | L48: =C48*K48 -> 49988.015999999996 | M48: =IF((C48*K48)-D48<=0,0,(C48*K48)-D48) -> 0 | N48: 83333.333333333343 | O48: =K48-D48-H48-I48-M48-N48 -> 123544.53333333333 | P48: =O48/K48 -> 0.29657796380636509
A49: PBR: Trade Paper | B49: THRILLER | C49: 0.12 | D49: 10000 | E49: 15.95 | F49: =E49*0.12 -> 1.9139999999999999 | G49: 14500 | H49: =G49*F49 -> 27753 | I49: 4166.666666666667 | J49: 5800 | K49: =E49*J49*0.45 -> 41629.5 | L49: =C49*K49 -> 4995.54 | M49: =IF((C49*K49)-D49<=0,0,(C49*K49)-D49) -> 0 | N49: 16666.666666666668 | O49: =K49-D49-H49-I49-M49-N49 -> -16956.833333333336 | P49: =O49/K49 -> -0.40732733598369752
A50: Trade Paper Original | B50: THRILLER | C50: 0.12 | D50: 5000 | E50: 16.95 | F50: =E50*0.12 -> 2.0339999999999998 | G50: 6800 | H50: =G50*F50 -> 13831.2 | I50: 2083.3333333333335 | J50: 5440 | K50: =E50*J50*0.45 -> 41493.599999999999 | L50: =C50*K50 -> 4979.232 | M50: =IF((C50*K50)-D50<=0,0,(C50*K50)-D50) -> 0 | N50: 8333.3333333333339 | O50: =K50-D50-H50-I50-M50-N50 -> 12245.733333333335 | P50: =O50/K50 -> 0.29512342465665392
A51: Hardcover | B51: WOMEN'S FICTION | C51: 0.12 | D51: 50000 | E51: 29.95 | F51: =E51*0.12 -> 3.5939999999999999 | G51: 38600 | H51: =G51*F51 -> 138728.4 | I51: 20833.333333333336 | J51: 15440 | K51: =E51*J51*0.45 -> 208092.6 | L51: =C51*K51 -> 24971.112000000001 | M51: =IF((C51*K51)-D51<=0,0,(C51*K51)-D51) -> 0 | N51: 83333.333333333343 | O51: =K51-D51-H51-I51-M51-N51 -> -84802.466666666674 | P51: =O51/K51 -> -0.40752274067730748
A52: Hardcover | B52: WOMEN'S FICTION | C52: 0.12 | D52: 25000 | E52: 21.95 | F52: =E52*0.12 -> 2.6339999999999999 | G52: 26400 | H52: =G52*F52 -> 69537.600000000006 | I52: 10416.666666666666 | J52: 21120 | K52: =E52*J52*0.45 -> 208612.8 | L52: =C52*K52 -> 25033.536 | M52: =IF((C52*K52)-D52<=0,0,(C52*K52)-D52) -> 33.536000000000058 | N52: 41666.666666666664 | O52: =K52-D52-H52-I52-M52-N52 -> 61958.330666666698 | P52: =O52/K52 -> 0.29700157740400729
A53: Hardcover | B53: WOMEN'S FICTION | C53: 0.12 | D53: 10000 | E53: 24.95 | F53: =E53*0.12 -> 2.9939999999999998 | G53: 9300 | H53: =G53*F53 -> 27844.2 | I53: 4166.666666666667 | J53: 3720 | K53: =E53*J53*0.45 -> 41766.3 | L53: =C53*K53 -> 5011.9560000000001 | M53: =IF((C53*K53)-D53<=0,0,(C53*K53)-D53) -> 0 | N53: 16666.666666666668 | O53: =K53-D53-H53-I53-M53-N53 -> -16911.23333333333 | P53: =O53/K53 -> -0.40490139977286305
A54: Hardcover | B54: WOMEN'S FICTION | C54: 0.12 | D54: 10000 | E54: 21.95 | F54: =E54*0.12 -> 2.6339999999999999 | G54: 10500 | H54: =G54*F54 -> 27657 | I54: 4166.666666666667 | J54: 4200 | K54: =E54*J54*0.45 -> 41485.5 | L54: =C54*K54 -> 4978.26 | M54: =IF((C54*K54)-D54<=0,0,(C54*K54)-D54) -> 0 | N54: 16666.666666666668 | O54: =K54-D54-H54-I54-M54-N54 -> -17004.833333333336 | P54: =O54/K54 -> -0.40989823753681009
A55: PBR: Trade Paper | B55: WOMEN'S FICTION | C55: 0.12 | D55: 25000 | E55: 15.95 | F55: =E55*0.12 -> 1.9139999999999999 | G55: 36300 | H55: =G55*F55 -> 69478.2 | I55: 10416.666666666668 | J55: 14520 | K55: =E55*J55*0.45 -> 104217.3 | L55: =C55*K55 -> 12506.075999999999 | M55: =IF((C55*K55)-D55<=0,0,(C55*K55)-D55) -> 0 | N55: 41666.666666666672 | O55: =K55-D55-H55-I55-M55-N55 -> -42344.233333333337 | P55: =O55/K55 -> -0.40630714222430764
A56: PBR: Trade Paper | B56: WOMEN'S FICTION | C56: 0.12 | D56: 10000 | E56: 15.95 | F56: =E56*0.12 -> 1.9139999999999999 | G56: 14500 | H56: =G56*F56 -> 27753 | I56: 4166.666666666667 | J56: 11600 | K56: =E56*J56*0.45 -> 83259 | L56: =C56*K56 -> 9991.08 | M56: =IF((C56*K56)-D56<=0,0,(C56*K56)-D56) -> 0 | N56: 16666.666666666668 | O56: =K56-D56-H56-I56-M56-N56 -> 24672.666666666668 | P56: =O56/K56 -> 0.29633633200815129
A57: Trade Paper Original | B57: WOMEN'S FICTION | C57: 0.12 | D57: 25000 | E57: 16.95 | F57: =E57*0.12 -> 2.0339999999999998 | G57: 34100 | H57: =G57*F57 -> 69359.4 | I57: 10416.666666666668 | J57: 27280 | K57: =E57*J57*0.45 -> 208078.2 | L57: =C57*K57 -> 24969.384000000002 | M57: =IF((C57*K57)-D57<=0,0,(C57*K57)-D57) -> 0 | N57: 41666.666666666672 | O57: =K57-D57-H57-I57-M57-N57 -> 61635.466666666674 | P57: =O57/K57 -> 0.2962129942813167
A59: TOTALS | D59: =SUM(D5:D57) -> 4285000 | G59: =SUM(G5:G57) -> 4969700 | H59: =SUM(H5:H57) -> 11902657.799999995 | I59: =SUM(I5:I57) -> 1785416.6666666674 | J59: =SUM(J5:J57) -> 3145075 | K59: =SUM(K5:K57) -> 27982168.312500007 | L59: =SUM(L5:L57) -> 3357860.1974999998 | M59: =SUM(M5:M57) -> 140870.80899999995 | N59: =SUM(N5:N57) -> 7141666.6666666698 | O59: =SUM(O5:O57) -> 2726556.3701666654 | P59: =O59/K59 -> 9.7439066898496074E-2
P60: PROFIT
A61: PP&B = paper, printing, & binding | P61: MARGIN
A62: PBR = paperback reprint of last year's hardcover frontlist