A1: Simon Collins & Random Day
A2: Season Three: a win some, lose some publishing company
A4: FORMAT | B4: GENRE | C4: ROYALTY RATE (% of net sales) | D4: ADVANCE | E4: LIST PRICE | F4: PP&B PER UNIT (12% of list price) | G4: UNITS PRINTED | H4: PRINTING COST (PP&B x units printed) | I4: MARKETING (capped) | J4: UNITS SOLD | K4: NET SALES 55% average discount) | L4: ROYALTIES EARNED (rate x net sales) | M4: ROYALTIES PAID (after advance) | N4: OVERHEAD (capped) | O4: NET PROFIT (or LOSS) | P4: PROFIT MARGIN
A5: Hardcover: FCF-C | B5: THRILLER | C5: 0.12 | D5: 500000 | E5: 29.95 | F5: 3.5939999999999999 | G5: 750000 | H5: 2695500 | I5: 208333.33333333337 | J5: 675000 | K5: 9097312.5 | L5: 1091677.5 | M5: 591677.5 | N5: 833333.33333333349 | O5: 4268468.333333334 | P5: 0.46920102319595308
A6: Hardcover: LPG | B6: THRILLER | C6: 0.12 | D6: 25000 | E6: 29.95 | F6: 3.5939999999999999 | G6: 1000000 | H6: 3594000 | I6: 10416.666666666668 | J6: 950000 | K6: 12803625 | L6: 1536435 | M6: 1511435 | N6: 41666.666666666672 | O6: 7621106.666666667 | P6: 0.5952303872275756
A7: Hardcover | B7: THRILLER | C7: 0.12 | D7: 500000 | E7: 29.95 | F7: 3.5939999999999999 | G7: 386400 | H7: 1388721.6 | I7: 208333.33333333337 | J7: 216400 | K7: 2916531 | L7: 349983.72 | M7: 0 | N7: 833333.33333333349 | O7: -13857.266666666721 | P7: -4.7512838597178362E-3
A8: Hardcover | B8: THRILLER | C8: 0.12 | D8: 500000 | E8: 27.95 | F8: 3.3539999999999996 | G8: 414100 | H8: 1388891.4 | I8: 208333.33333333337 | J8: 331300 | K8: 4166925.75 | L8: 500031.09 | M8: 31.089999999967404 | N8: 833333.33333333349 | O8: 1236336.5933333333 | P8: 0.29670233344890612
A9: Hardcover | B9: THRILLER | C9: 0.12 | D9: 250000 | E9: 27.95 | F9: 3.3539999999999996 | G9: 207100 | H9: 694613.4 | I9: 104166.66666666669 | J9: 51800 | K9: 651514.5 | L9: 78181.74 | M9: 0 | N9: 416666.66666666674 | O9: -813932.2333333334 | P9: -1.2492925841763052
A10: Hardcover | B10: THRILLER | C10: 0.12 | D10: 250000 | E10: 21.95 | F10: 2.6339999999999999 | G10: 263600 | H10: 694322.4 | I10: 104166.66666666669 | J10: 210900 | K10: 2083164.75 | L10: 249979.77 | M10: 0 | N10: 416666.66666666674 | O10: 618009.0166666666 | P10: 0.29666833440161977
A11: Hardcover | B11: THRILLER | C11: 0.12 | D11: 100000 | E11: 24.95 | F11: 2.9939999999999998 | G11: 92800 | H11: 277843.20000000001 | I11: 41666.666666666672 | J11: 52000 | K11: 583830 | L11: 70059.6 | M11: 0 | N11: 166666.66666666669 | O11: -2346.5333333333256 | P11: -4.0192065041764306E-3
A12: Hardcover | B12: THRILLER | C12: 0.12 | D12: 100000 | E12: 21.95 | F12: 2.6339999999999999 | G12: 105500 | H12: 277887 | I12: 41666.666666666664 | J12: 59100 | K12: 583760.25 | L12: 70051.23 | M12: 0 | N12: 166666.66666666666 | O12: -2460.0833333333139 | P12: -4.2142015208012432E-3
A13: Hardcover | B13: THRILLER | C13: 0.12 | D13: 100000 | E13: 21.95 | F13: 2.6339999999999999 | G13: 105500 | H13: 277887 | I13: 41666.666666666664 | J13: 60000 | K13: 592650 | L13: 71118 | M13: 0 | N13: 166666.66666666666 | O13: 6429.6666666666861 | P13: 1.0849011502010775E-2
A14: Hardcover | B14: THRILLER | C14: 0.12 | D14: 75000 | E14: 29.95 | F14: 3.5939999999999999 | G14: 58000 | H14: 208452 | I14: 31250 | J14: 32500 | K14: 438018.75 | L14: 52562.25 | M14: 0 | N14: 125000 | O14: -1683.25 | P14: -3.842872023172524E-3
A15: Hardcover | B15: THRILLER | C15: 0.12 | D15: 50000 | E15: 29.95 | F15: 3.5939999999999999 | G15: 38600 | H15: 138728.4 | I15: 20833.333333333336 | J15: 21600 | K15: 291114 | L15: 34933.68 | M15: 0 | N15: 83333.333333333343 | O15: -1781.0666666666802 | P15: -6.1181072248901814E-3
A16: Hardcover | B16: THRILLER | C16: 0.12 | D16: 50000 | E16: 24.95 | F16: 2.9939999999999998 | G16: 46400 | H16: 138921.60000000001 | I16: 20833.333333333336 | J16: 26000 | K16: 291915 | L16: 35029.8 | M16: 0 | N16: 83333.333333333343 | O16: -1173.2666666666628 | P16: -4.0192065041764306E-3
A17: Hardcover | B17: THRILLER | C17: 0.12 | D17: 50000 | E17: 24.95 | F17: 2.9939999999999998 | G17: 46400 | H17: 138921.60000000001 | I17: 20833.333333333336 | J17: 27000 | K17: 303142.5 | L17: 36377.1 | M17: 0 | N17: 83333.333333333343 | O17: 10054.233333333337 | P17: 3.3166690033015291E-2
A18: Hardcover | B18: THRILLER | C18: 0.12 | D18: 50000 | E18: 24.95 | F18: 2.9939999999999998 | G18: 46400 | H18: 138921.60000000001 | I18: 20833.333333333336 | J18: 26000 | K18: 291915 | L18: 35029.8 | M18: 0 | N18: 83333.333333333343 | O18: -1173.2666666666628 | P18: -4.0192065041764306E-3
A19: Hardcover | B19: THRILLER | C19: 0.12 | D19: 25000 | E19: 27.95 | F19: 3.3539999999999996 | G19: 20700 | H19: 69427.8 | I19: 10416.666666666666 | J19: 11600 | K19: 145899 | L19: 17507.88 | M19: 0 | N19: 41666.666666666664 | O19: -612.13333333331684 | P19: -4.1955964971200407E-3
A20: Hardcover | B20: THRILLER | C20: 0.12 | D20: 25000 | E20: 27.95 | F20: 3.3539999999999996 | G20: 20700 | H20: 69427.8 | I20: 10416.666666666666 | J20: 11600 | K20: 145899 | L20: 17507.88 | M20: 0 | N20: 41666.666666666664 | O20: -612.13333333331684 | P20: -4.1955964971200407E-3
A21: Hardcover | B21: THRILLER | C21: 0.12 | D21: 10000 | E21: 29.95 | F21: 3.5939999999999999 | G21: 7700 | H21: 27673.8 | I21: 4166.666666666667 | J21: 4300 | K21: 57953.25 | L21: 6954.39 | M21: 0 | N21: 16666.666666666668 | O21: -553.88333333333503 | P21: -9.557416250742367E-3
A22: Hardcover | B22: THRILLER | C22: 0.12 | D22: 10000 | E22: 29.95 | F22: 3.5939999999999999 | G22: 7700 | H22: 27673.8 | I22: 4166.666666666667 | J22: 4500 | K22: 60648.75 | L22: 7277.85 | M22: 0 | N22: 16666.666666666668 | O22: 2141.616666666665 | P22: 3.5311802249290626E-2
A23: Hardcover | B23: THRILLER | C23: 0.12 | D23: 10000 | E23: 21.95 | F23: 2.6339999999999999 | G23: 10500 | H23: 27657 | I23: 4166.666666666667 | J23: 5900 | K23: 58277.25 | L23: 6993.27 | M23: 0 | N23: 16666.666666666668 | O23: -213.08333333333576 | P23: -3.6563724838309247E-3
A24: Hardcover | B24: THRILLER | C24: 0.12 | D24: 10000 | E24: 21.95 | F24: 2.6339999999999999 | G24: 10500 | H24: 27657 | I24: 4166.666666666667 | J24: 6000 | K24: 59265 | L24: 7111.8 | M24: 0 | N24: 16666.666666666668 | O24: 774.66666666666424 | P24: 1.3071233724232923E-2
A25: Hardcover | B25: THRILLER | C25: 0.12 | D25: 10000 | E25: 21.95 | F25: 2.6339999999999999 | G25: 10500 | H25: 27657 | I25: 4166.666666666667 | J25: 6100 | K25: 60252.75 | L25: 7230.33 | M25: 0 | N25: 16666.666666666668 | O25: 1762.4166666666642 | P25: 2.9250393827114352E-2
A26: Hardcover | B26: THRILLER | C26: 0.12 | D26: 5000 | E26: 21.95 | F26: 2.6339999999999999 | G26: 5300 | H26: 13960.2 | I26: 2083.3333333333335 | J26: 3000 | K26: 29632.5 | L26: 3555.9 | M26: 0 | N26: 8333.3333333333339 | O26: 255.63333333333321 | P26: 8.6267892797885163E-3
A27: PBR: Mass Market | B27: THRILLER | C27: 0.12 | D27: 100000 | E27: 7.95 | F27: 0.95399999999999996 | G27: 291200 | H27: 277804.79999999999 | I27: 41666.666666666672 | J27: 163100 | K27: 583490.25 | L27: 70018.83 | M27: 0 | N27: 166666.66666666669 | O27: -2647.8833333333605 | P27: -4.5380078473176893E-3
A28: PBR: Mass Market | B28: THRILLER | C28: 0.12 | D28: 100000 | E28: 7.95 | F28: 0.95399999999999996 | G28: 291200 | H28: 277804.79999999999 | I28: 41666.666666666672 | J28: 163100 | K28: 583490.25 | L28: 70018.83 | M28: 0 | N28: 166666.66666666669 | O28: -2647.8833333333605 | P28: -4.5380078473176893E-3
A29: PBR: Mass Market | B29: THRILLER | C29: 0.12 | D29: 75000 | E29: 7.95 | F29: 0.95399999999999996 | G29: 218400 | H29: 208353.6 | I29: 31250 | J29: 87400 | K29: 312673.5 | L29: 37520.82 | M29: 0 | N29: 125000 | O29: -126930.1 | P29: -0.40595093604031035
A30: PBR: Mass Market | B30: THRILLER | C30: 0.12 | D30: 75000 | E30: 7.95 | F30: 0.95399999999999996 | G30: 218400 | H30: 208353.6 | I30: 31250 | J30: 174700 | K30: 624989.25 | L30: 74998.71 | M30: 0 | N30: 125000 | O30: 185385.65 | P30: 0.29662214190084074
A31: PBR: Mass Market | B31: THRILLER | C31: 0.12 | D31: 50000 | E31: 7.95 | F31: 0.95399999999999996 | G31: 145600 | H31: 138902.39999999999 | I31: 20833.333333333336 | J31: 81600 | K31: 291924 | L31: 35030.879999999997 | M31: 0 | N31: 83333.333333333343 | O31: -1145.0666666666802 | P31: -3.9224821072151661E-3
A32: PBR: Mass Market | B32: THRILLER | C32: 0.12 | D32: 50000 | E32: 7.95 | F32: 0.95399999999999996 | G32: 145600 | H32: 138902.39999999999 | I32: 20833.333333333336 | J32: 82000 | K32: 293355 | L32: 35202.6 | M32: 0 | N32: 83333.333333333343 | O32: 285.93333333331975 | P32: 9.747007323322246E-4
A33: PBR: Mass Market | B33: THRILLER | C33: 0.12 | D33: 25000 | E33: 7.95 | F33: 0.95399999999999996 | G33: 72800 | H33: 69451.199999999997 | I33: 10416.666666666668 | J33: 29100 | K33: 104105.25 | L33: 12492.63 | M33: 0 | N33: 41666.666666666672 | O33: -42429.28333333334 | P33: -0.40756141821217795
A34: PBR: Mass Market | B34: THRILLER | C34: 0.12 | D34: 25000 | E34: 7.95 | F34: 0.95399999999999996 | G34: 72800 | H34: 69451.199999999997 | I34: 10416.666666666668 | J34: 40800 | K34: 145962 | L34: 17515.44 | M34: 0 | N34: 41666.666666666672 | O34: -572.53333333334012 | P34: -3.9224821072151661E-3
A35: PBR: Mass Market | B35: THRILLER | C35: 0.12 | D35: 25000 | E35: 7.95 | F35: 0.95399999999999996 | G35: 72800 | H35: 69451.199999999997 | I35: 10416.666666666668 | J35: 41000 | K35: 146677.5 | L35: 17601.3 | M35: 0 | N35: 41666.666666666672 | O35: 142.96666666665988 | P35: 9.747007323322246E-4
A36: PBR: Mass Market | B36: THRILLER | C36: 0.12 | D36: 25000 | E36: 7.95 | F36: 0.95399999999999996 | G36: 72800 | H36: 69451.199999999997 | I36: 10416.666666666668 | J36: 40800 | K36: 145962 | L36: 17515.44 | M36: 0 | N36: 41666.666666666672 | O36: -572.53333333334012 | P36: -3.9224821072151661E-3
A37: PBR: Trade Paper | B37: THRILLER | C37: 0.12 | D37: 75000 | E37: 15.95 | F37: 1.9139999999999999 | G37: 108900 | H37: 208434.6 | I37: 31250 | J37: 61000 | K37: 437827.5 | L37: 52539.3 | M37: 0 | N37: 125000 | O37: -1857.1000000000058 | P37: -4.2416248408334465E-3
A38: PBR: Trade Paper | B38: THRILLER | C38: 0.12 | D38: 50000 | E38: 14.95 | F38: 1.7939999999999998 | G38: 77400 | H38: 138855.6 | I38: 20833.333333333336 | J38: 62000 | K38: 417105 | L38: 50052.6 | M38: 52.599999999998545 | N38: 83333.333333333343 | O38: 124030.13333333333 | P38: 0.29735949780830567
A39: PBR: Trade Paper | B39: THRILLER | C39: 0.12 | D39: 10000 | E39: 15.95 | F39: 1.9139999999999999 | G39: 14500 | H39: 27753 | I39: 4166.666666666667 | J39: 5800 | K39: 41629.5 | L39: 4995.54 | M39: 0 | N39: 16666.666666666668 | O39: -16956.833333333336 | P39: -0.40732733598369752
A40: PBR: Trade Paper | B40: THRILLER | C40: 0.12 | D40: 10000 | E40: 15.95 | F40: 1.9139999999999999 | G40: 14500 | H40: 27753 | I40: 4166.666666666667 | J40: 8100 | K40: 58137.75 | L40: 6976.53 | M40: 0 | N40: 16666.666666666668 | O40: -448.58333333333576 | P40: -7.7158702105488393E-3
A41: PBR: Trade Paper | B41: THRILLER | C41: 0.12 | D41: 10000 | E41: 14.95 | F41: 1.7939999999999998 | G41: 15500 | H41: 27807 | I41: 4166.666666666667 | J41: 8700 | K41: 58529.25 | L41: 7023.51 | M41: 0 | N41: 16666.666666666668 | O41: -111.08333333333212 | P41: -1.8979114431388088E-3
A42: Trade Paper Original | B42: THRILLER | C42: 0.12 | D42: 5000 | E42: 16.95 | F42: 2.0339999999999998 | G42: 6800 | H42: 13831.2 | I42: 2083.3333333333335 | J42: 5400 | K42: 41188.5 | L42: 4942.62 | M42: 0 | N42: 8333.3333333333339 | O42: 11940.633333333337 | P42: 0.28990211669114768
A43: Trade Paper Original | B43: THRILLER | C43: 0.12 | D43: 5000 | E43: 16.95 | F43: 2.0339999999999998 | G43: 6800 | H43: 13831.2 | I43: 2083.3333333333335 | J43: 3800 | K43: 28984.5 | L43: 3478.14 | M43: 0 | N43: 8333.3333333333339 | O43: -263.36666666666679 | P43: -9.0864657546849796E-3
A44: Trade Paper Original | B44: THRILLER | C44: 0.12 | D44: 5000 | E44: 16.95 | F44: 2.0339999999999998 | G44: 6800 | H44: 13831.2 | I44: 2083.3333333333335 | J44: 3800 | K44: 28984.5 | L44: 3478.14 | M44: 0 | N44: 8333.3333333333339 | O44: -263.36666666666679 | P44: -9.0864657546849796E-3
D45: 3425000 | G45: 5507200 | H45: 14344768.799999997 | I45: 1427083.3333333342 | J45: 3854800 | K45: 40058262 | L45: 4806991.44 | M45: 2103196.19 | N45: 5708333.3333333367 | O45: 13049880.343333328 | P45: 0.32577250464169732
A48: Hardcover: JFF | B48: LITERARY FICTION | C48: 0.12 | D48: 500000 | E48: 27.95 | F48: 3.3539999999999996 | G48: 386400 | H48: 1295985.6 | I48: 607493.25 | J48: 96600 | K48: 1214986.5 | L48: 145798.38 | M48: 0 | N48: 416666.66666666674 | O48: -1605159.0166666666 | P48: -1.321133211493845
A49: Hardcover: AUO | B49: LITERARY FICTION | C49: 0.12 | D49: 50000 | E49: 27.95 | F49: 3.3539999999999996 | G49: 41400 | H49: 138855.6 | I49: 20833.333333333332 | J49: 6210 | K49: 78106.275000000009 | L49: 9372.7530000000006 | M49: 0 | N49: 83333.333333333328 | O49: -214915.99166666664 | P49: -2.751584193032719
A50: Hardcover | B50: LITERARY FICTION | C50: 0.12 | D50: 250000 | E50: 29.95 | F50: 3.5939999999999999 | G50: 193200 | H50: 694360.8 | I50: 104166.66666666669 | J50: 193200 | K50: 2603853 | L50: 312462.36 | M50: 62462.36 | N50: 416666.66666666674 | O50: 1076196.5066666666 | P50: 0.41330924083143966
A51: Hardcover | B51: LITERARY FICTION | C51: 0.12 | D51: 100000 | E51: 27.95 | F51: 3.3539999999999996 | G51: 82800 | H51: 277711.2 | I51: 41666.666666666664 | J51: 47000 | K51: 591142.5 | L51: 70937.1 | M51: 0 | N51: 166666.66666666666 | O51: 5097.9666666667326 | P51: 8.6239217560346824E-3
A52: Hardcover | B52: LITERARY FICTION | C52: 0.12 | D52: 75000 | E52: 21.95 | F52: 2.6339999999999999 | G52: 79100 | H52: 208349.4 | I52: 31250 | J52: 31600 | K52: 312129 | L52: 37455.48 | M52: 0 | N52: 125000 | O52: -127470.39999999999 | P52: -0.408390120751356
A53: Hardcover | B53: LITERARY FICTION | C53: 0.12 | D53: 25000 | E53: 29.95 | F53: 3.5939999999999999 | G53: 19300 | H53: 69364.2 | I53: 10416.666666666668 | J53: 19300 | K53: 260115.75 | L53: 31213.89 | M53: 6213.89 | N53: 41666.666666666672 | O53: 107454.32666666668 | P53: 0.41310196197910615
A54: Hardcover | B54: LITERARY FICTION | C54: 0.12 | D54: 25000 | E54: 27.95 | F54: 3.3539999999999996 | G54: 20700 | H54: 69427.8 | I54: 10416.666666666666 | J54: 11600 | K54: 145899 | L54: 17507.88 | M54: 0 | N54: 41666.666666666664 | O54: -612.13333333331684 | P54: -4.1955964971200407E-3
A55: Hardcover | B55: LITERARY FICTION | C55: 0.12 | D55: 25000 | E55: 27.95 | F55: 3.3539999999999996 | G55: 20700 | H55: 69427.8 | I55: 10416.666666666666 | J55: 12000 | K55: 150930 | L55: 18111.6 | M55: 0 | N55: 41666.666666666664 | O55: 4418.8666666666832 | P55: 2.927759005278396E-2
A56: Hardcover | B56: LITERARY FICTION | C56: 0.12 | D56: 10000 | E56: 27.95 | F56: 3.3539999999999996 | G56: 8300 | H56: 27838.2 | I56: 4166.666666666667 | J56: 4800 | K56: 60372 | L56: 7244.64 | M56: 0 | N56: 16666.666666666668 | O56: 1700.4666666666672 | P56: 2.8166478941672748E-2
A57: Hardcover | B57: LITERARY FICTION | C57: 0.12 | D57: 10000 | E57: 27.95 | F57: 3.3539999999999996 | G57: 8300 | H57: 27838.2 | I57: 4166.666666666667 | J57: 4600 | K57: 57856.5 | L57: 6942.78 | M57: 0 | N57: 16666.666666666668 | O57: -815.03333333333285 | P57: -1.4087152408689307E-2
A58: Hardcover | B58: LITERARY FICTION | C58: 0.12 | D58: 10000 | E58: 27.95 | F58: 3.3539999999999996 | G58: 8300 | H58: 27838.2 | I58: 4166.666666666667 | J58: 4700 | K58: 59114.25 | L58: 7093.71 | M58: 0 | N58: 16666.666666666668 | O58: 442.71666666666715 | P58: 7.4891699829849343E-3
A59: Hardcover | B59: LITERARY FICTION | C59: 0.12 | D59: 5000 | E59: 29.95 | F59: 3.5939999999999999 | G59: 3900 | H59: 14016.6 | I59: 2083.3333333333335 | J59: 1600 | K59: 21564 | L59: 2587.68 | M59: 0 | N59: 8333.3333333333339 | O59: -7869.2666666666682 | P59: -0.36492611142026843
A60: Hardcover | B60: LITERARY FICTION | C60: 0.12 | D60: 5000 | E60: 29.95 | F60: 3.5939999999999999 | G60: 3900 | H60: 14016.6 | I60: 2083.3333333333335 | J60: 2200 | K60: 29650.5 | L60: 3558.06 | M60: 0 | N60: 8333.3333333333339 | O60: 217.23333333333176 | P60: 7.3264644216229661E-3
A61: Hardcover | B61: LITERARY FICTION | C61: 0.12 | D61: 5000 | E61: 27.95 | F61: 3.3539999999999996 | G61: 4100 | H61: 13751.4 | I61: 2083.3333333333335 | J61: 2300 | K61: 28928.25 | L61: 3471.39 | M61: 0 | N61: 8333.3333333333339 | O61: -239.8166666666657 | P61: -8.2900509594139183E-3
A62: PBR: Trade Paper | B62: LITERARY FICTION | C62: 0.12 | D62: 50000 | E62: 14.95 | F62: 1.7939999999999998 | G62: 77400 | H62: 138855.6 | I62: 20833.333333333336 | J62: 43300 | K62: 291300.75 | L62: 34956.09 | M62: 0 | N62: 83333.333333333343 | O62: -1721.5166666666628 | P62: -5.9097570695120514E-3
A63: PBR: Trade Paper | B63: LITERARY FICTION | C63: 0.12 | D63: 25000 | E63: 14.95 | F63: 1.7939999999999998 | G63: 38700 | H63: 69427.8 | I63: 10416.666666666668 | J63: 30960 | K63: 208283.4 | L63: 24994.007999999998 | M63: 0 | N63: 41666.666666666672 | O63: 61772.266666666663 | P63: 0.29657796380636509
A64: PBR: Trade Paper | B64: LITERARY FICTION | C64: 0.12 | D64: 10000 | E64: 15.95 | F64: 1.9139999999999999 | G64: 14500 | H64: 27753 | I64: 4166.666666666667 | J64: 8100 | K64: 58137.75 | L64: 6976.53 | M64: 0 | N64: 16666.666666666668 | O64: -448.58333333333576 | P64: -7.7158702105488393E-3
A65: PBR: Trade Paper | B65: LITERARY FICTION | C65: 0.12 | D65: 10000 | E65: 15.95 | F65: 1.9139999999999999 | G65: 14500 | H65: 27753 | I65: 4166.666666666667 | J65: 8100 | K65: 58137.75 | L65: 6976.53 | M65: 0 | N65: 16666.666666666668 | O65: -448.58333333333576 | P65: -7.7158702105488393E-3
A66: PBR: Trade Paper | B66: LITERARY FICTION | C66: 0.12 | D66: 10000 | E66: 14.95 | F66: 1.7939999999999998 | G66: 15500 | H66: 27807 | I66: 4166.666666666667 | J66: 6200 | K66: 41710.5 | L66: 5005.26 | M66: 0 | N66: 16666.666666666668 | O66: -16929.833333333332 | P66: -0.40588900476698508
A67: PBR: Trade Paper | B67: LITERARY FICTION | C67: 0.12 | D67: 10000 | E67: 14.95 | F67: 1.7939999999999998 | G67: 15500 | H67: 27807 | I67: 4166.666666666667 | J67: 12400 | K67: 83421 | L67: 10010.52 | M67: 10.520000000000437 | N67: 16666.666666666668 | O67: 24770.146666666671 | P67: 0.29692939028142401
A68: PBR: Trade Paper | B68: LITERARY FICTION | C68: 0.12 | D68: 10000 | E68: 14.95 | F68: 1.7939999999999998 | G68: 15500 | H68: 27807 | I68: 4166.666666666667 | J68: 8800 | K68: 59202 | L68: 7104.24 | M68: 0 | N68: 16666.666666666668 | O68: 561.66666666666788 | P68: 9.4872920959877694E-3
A69: PBR: Trade Paper | B69: LITERARY FICTION | C69: 0.12 | D69: 10000 | E69: 14.95 | F69: 1.7939999999999998 | G69: 15500 | H69: 27807 | I69: 4166.666666666667 | J69: 8700 | K69: 58529.25 | L69: 7023.51 | M69: 0 | N69: 16666.666666666668 | O69: -111.08333333333212 | P69: -1.8979114431388088E-3
A70: PBR: Trade Paper | B70: LITERARY FICTION | C70: 0.12 | D70: 10000 | E70: 14.95 | F70: 1.7939999999999998 | G70: 15500 | H70: 27807 | I70: 4166.666666666667 | J70: 8900 | K70: 59874.75 | L70: 7184.97 | M70: 0 | N70: 16666.666666666668 | O70: 1234.4166666666679 | P70: 2.0616648364572176E-2
A71: PBR: Trade Paper | B71: LITERARY FICTION | C71: 0.12 | D71: 10000 | E71: 14.95 | F71: 1.7939999999999998 | G71: 15500 | H71: 27807 | I71: 4166.666666666667 | J71: 8700 | K71: 58529.25 | L71: 7023.51 | M71: 0 | N71: 16666.666666666668 | O71: -111.08333333333212 | P71: -1.8979114431388088E-3
A72: PBR: Trade Paper | B72: LITERARY FICTION | C72: 0.12 | D72: 10000 | E72: 14.95 | F72: 1.7939999999999998 | G72: 15500 | H72: 27807 | I72: 4166.666666666667 | J72: 8700 | K72: 58529.25 | L72: 7023.51 | M72: 0 | N72: 16666.666666666668 | O72: -111.08333333333212 | P72: -1.8979114431388088E-3
A73: Trade Paper Original | B73: LITERARY FICTION | C73: 0.12 | D73: 25000 | E73: 16.95 | F73: 2.0339999999999998 | G73: 34100 | H73: 69359.4 | I73: 10416.666666666668 | J73: 13600 | K73: 103734 | L73: 12448.08 | M73: 0 | N73: 41666.666666666672 | O73: -42708.733333333337 | P73: -0.41171393500041775
A74: Trade Paper Original | B74: LITERARY FICTION | C74: 0.12 | D74: 25000 | E74: 16.95 | F74: 2.0339999999999998 | G74: 34100 | H74: 69359.4 | I74: 10416.666666666668 | J74: 19100 | K74: 145685.25 | L74: 17482.23 | M74: 0 | N74: 41666.666666666672 | O74: -757.48333333333721 | P74: -5.1994510997739113E-3
A75: Trade Paper Original | B75: LITERARY FICTION | C75: 0.12 | D75: 10000 | E75: 16.95 | F75: 2.0339999999999998 | G75: 13700 | H75: 27865.8 | I75: 4166.666666666667 | J75: 10900 | K75: 83139.75 | L75: 9976.77 | M75: 0 | N75: 16666.666666666668 | O75: 24440.616666666672 | P75: 0.29397029299061728
A76: Trade Paper Original | B76: LITERARY FICTION | C76: 0.12 | D76: 10000 | E76: 16.95 | F76: 2.0339999999999998 | G76: 13700 | H76: 27865.8 | I76: 4166.666666666667 | J76: 7800 | K76: 59494.5 | L76: 7139.34 | M76: 0 | N76: 16666.666666666668 | O76: 795.36666666666861 | P76: 1.3368742768939458E-2
A77: Trade Paper Original | B77: LITERARY FICTION | C77: 0.12 | D77: 5000 | E77: 16.95 | F77: 2.0339999999999998 | G77: 6800 | H77: 13831.2 | I77: 2083.3333333333335 | J77: 3900 | K77: 29747.25 | L77: 3569.67 | M77: 0 | N77: 8333.3333333333339 | O77: 499.38333333333321 | P77: 1.6787546187742839E-2
A78: Trade Paper Original | B78: LITERARY FICTION | C78: 0.12 | D78: 5000 | E78: 16.95 | F78: 2.0339999999999998 | G78: 6800 | H78: 13831.2 | I78: 2083.3333333333335 | J78: 3800 | K78: 28984.5 | L78: 3478.14 | M78: 0 | N78: 8333.3333333333339 | O78: -263.36666666666679 | P78: -9.0864657546849796E-3
A79: Trade Paper Original | B79: LITERARY FICTION | C79: 0.12 | D79: 5000 | E79: 16.95 | F79: 2.0339999999999998 | G79: 6800 | H79: 13831.2 | I79: 2083.3333333333335 | J79: 1700 | K79: 12966.75 | L79: 1556.01 | M79: 0 | N79: 8333.3333333333339 | O79: -16281.116666666667 | P79: -1.2556050410987076
A80: Trade Paper Original | B80: LITERARY FICTION | C80: 0.12 | D80: 5000 | E80: 16.95 | F80: 2.0339999999999998 | G80: 6800 | H80: 13831.2 | I80: 2083.3333333333335 | J80: 3800 | K80: 28984.5 | L80: 3478.14 | M80: 0 | N80: 8333.3333333333339 | O80: -263.36666666666679 | P80: -9.0864657546849796E-3
A81: Trade Paper Original | B81: LITERARY FICTION | C81: 0.12 | D81: 5000 | E81: 16.95 | F81: 2.0339999999999998 | G81: 6800 | H81: 13831.2 | I81: 2083.3333333333335 | J81: 3900 | K81: 29747.25 | L81: 3569.67 | M81: 0 | N81: 8333.3333333333339 | O81: 499.38333333333321 | P81: 1.6787546187742839E-2
A82: Trade Paper Original | B82: LITERARY FICTION | C82: 0.12 | D82: 5000 | E82: 16.95 | F82: 2.0339999999999998 | G82: 6800 | H82: 13831.2 | I82: 2083.3333333333335 | J82: 3800 | K82: 28984.5 | L82: 3478.14 | M82: 0 | N82: 8333.3333333333339 | O82: -263.36666666666679 | P82: -9.0864657546849796E-3
A83: Trade Paper Original | B83: LITERARY FICTION | C83: 0.12 | D83: 5000 | E83: 16.95 | F83: 2.0339999999999998 | G83: 6800 | H83: 13831.2 | I83: 2083.3333333333335 | J83: 3800 | K83: 28984.5 | L83: 3478.14 | M83: 0 | N83: 8333.3333333333339 | O83: -263.36666666666679 | P83: -9.0864657546849796E-3
A84: Trade Paper Original | B84: LITERARY FICTION | C84: 0.12 | D84: 5000 | E84: 16.95 | F84: 2.0339999999999998 | G84: 6800 | H84: 13831.2 | I84: 2083.3333333333335 | J84: 4000 | K84: 30510 | L84: 3661.2 | M84: 0 | N84: 8333.3333333333339 | O84: 1262.1333333333332 | P84: 4.1367857533049272E-2
A85: Trade Paper Original | B85: LITERARY FICTION | C85: 0.12 | D85: 5000 | E85: 16.95 | F85: 2.0339999999999998 | G85: 6800 | H85: 13831.2 | I85: 2083.3333333333335 | J85: 3900 | K85: 29747.25 | L85: 3569.67 | M85: 0 | N85: 8333.3333333333339 | O85: 499.38333333333321 | P85: 1.6787546187742839E-2
A86: Trade Paper Original | B86: LITERARY FICTION | C86: 0.12 | D86: 5000 | E86: 16.95 | F86: 2.0339999999999998 | G86: 6800 | H86: 13831.2 | I86: 2083.3333333333335 | J86: 3800 | K86: 28984.5 | L86: 3478.14 | M86: 0 | N86: 8333.3333333333339 | O86: -263.36666666666679 | P86: -9.0864657546849796E-3
A87: Trade Paper Original | B87: LITERARY FICTION | C87: 0.12 | D87: 5000 | E87: 16.95 | F87: 2.0339999999999998 | G87: 6800 | H87: 13831.2 | I87: 2083.3333333333335 | J87: 3900 | K87: 29747.25 | L87: 3569.67 | M87: 0 | N87: 8333.3333333333339 | O87: 499.38333333333321 | P87: 1.6787546187742839E-2
D88: 1385000 | G88: 1304400 | H88: 3753813.6 | I88: 976243.25 | J88: 682270 | K88: 7349744.9250000007 | L88: 881969.39100000029 | M88: 68686.77 | N88: 1891666.6666666672 | O88: -725665.36166666728 | P88: -9.873340763137671E-2
B91: THRILLER | D91: 3425000 | G91: 5507200 | H91: 14344768.799999997 | I91: 1427083.3333333342 | J91: 3854800 | K91: 40058262 | L91: 4806991.44 | M91: 2103196.19 | N91: 5708333.3333333367 | O91: 13049880.343333328 | P91: 0.32577250464169732
B92: LITERARY FICTION | D92: 1385000 | G92: 1304400 | H92: 3753813.6 | I92: 976243.25 | J92: 682270 | K92: 7349744.9250000007 | L92: 881969.39100000029 | M92: 68686.77 | N92: 1891666.6666666672 | O92: -725665.36166666728 | P92: -9.873340763137671E-2
D93: =D91+D92 -> 4810000 | G93: =G91+G92 -> 6811600 | H93: =H91+H92 -> 18098582.399999999 | I93: =I91+I92 -> 2403326.583333334 | J93: =J91+J92 -> 4537070 | K93: =K91+K92 -> 47408006.924999997 | L93: =L91+L92 -> 5688960.8310000002 | M93: =M91+M92 -> 2171882.96 | N93: =N91+N92 -> 7600000.0000000037 | O93: =O91+O92 -> 12324214.981666662 | P93: =O93/K93 -> 0.25996062228820777
P94: PROFIT
P95: MARGIN