A1: Simon Collins & Random Day
A2: an ideal publishing company with the perfect publishing program
A4: FORMAT | B4: GENRE | C4: ROYALTY RATE (% of net sales) | D4: ADVANCE | E4: LIST PRICE | F4: PP&B PER UNIT (12% of list price) | G4: UNITS PRINTED | H4: PRINTING COST (PP&B x units printed) | I4: MARKETING (5% of net sales) | J4: UNITS SOLD | K4: NET SALES (55% average discount) | L4: ROYALTIES EARNED (rate x net sales) | M4: ROYALTIES PAID (after advance) | N4: OVERHEAD (20% of net sales) | O4: NET PROFIT (or LOSS) | P4: PROFIT MARGIN
A5: Hardcover | B5: LITERARY FICTION | C5: 0.12 | D5: 250000 | E5: 29.95 | F5: =E5*0.12 -> 3.5939999999999999 | G5: =J5*1.25 -> 193223.2733568293 | H5: =G5*F5 -> 694444.4444444445 | I5: =0.05*K5 -> 104166.66666666669 | J5: =D5/C5/0.45/E5 -> 154578.61868546344 | K5: =E5*J5*0.45 -> 2083333.3333333335 | L5: =C5*K5 -> 250000 | M5: =IF((C5*K5)-D5<=0,0,(C5*K5)-D5) -> 0 | N5: =K5*0.2 -> 416666.66666666674 | O5: =K5-D5-H5-I5-M5-N5 -> 618055.5555555555 | P5: =O5/K5 -> 0.29666666666666663
A6: Hardcover | B6: LITERARY FICTION | C6: 0.12 | D6: 100000 | E6: 27.95 | F6: =E6*0.12 -> 3.3539999999999996 | G6: =J6*1.25 -> 82819.85026171073 | H6: =G6*F6 -> 277777.77777777775 | I6: =0.05*K6 -> 41666.666666666664 | J6: =D6/C6/0.45/E6 -> 66255.880209368581 | K6: =E6*J6*0.45 -> 833333.33333333326 | L6: =C6*K6 -> 100000 | M6: =IF((C6*K6)-D6<=0,0,(C6*K6)-D6) -> 0 | N6: =K6*0.2 -> 166666.66666666666 | O6: =K6-D6-H6-I6-M6-N6 -> 247222.22222222216 | P6: =O6/K6 -> 0.29666666666666663
A7: Hardcover | B7: LITERARY FICTION | C7: 0.12 | D7: 75000 | E7: 21.95 | F7: =E7*0.12 -> 2.6339999999999999 | G7: =J7*1.25 -> 79093.900278410525 | H7: =G7*F7 -> 208333.33333333331 | I7: =0.05*K7 -> 31250 | J7: =D7/C7/0.45/E7 -> 63275.120222728423 | K7: =E7*J7*0.45 -> 625000 | L7: =C7*K7 -> 75000 | M7: =IF((C7*K7)-D7<=0,0,(C7*K7)-D7) -> 0 | N7: =K7*0.2 -> 125000 | O7: =K7-D7-H7-I7-M7-N7 -> 185416.66666666669 | P7: =O7/K7 -> 0.29666666666666669
A8: Hardcover | B8: LITERARY FICTION | C8: 0.12 | D8: 50000 | E8: 27.95 | F8: =E8*0.12 -> 3.3539999999999996 | G8: =J8*1.25 -> 41409.925130855365 | H8: =G8*F8 -> 138888.88888888888 | I8: =0.05*K8 -> 20833.333333333332 | J8: =D8/C8/0.45/E8 -> 33127.94010468429 | K8: =E8*J8*0.45 -> 416666.66666666663 | L8: =C8*K8 -> 50000 | M8: =IF((C8*K8)-D8<=0,0,(C8*K8)-D8) -> 0 | N8: =K8*0.2 -> 83333.333333333328 | O8: =K8-D8-H8-I8-M8-N8 -> 123611.11111111108 | P8: =O8/K8 -> 0.29666666666666663
A9: Hardcover | B9: LITERARY FICTION | C9: 0.12 | D9: 25000 | E9: 27.95 | F9: =E9*0.12 -> 3.3539999999999996 | G9: =J9*1.25 -> 20704.962565427682 | H9: =G9*F9 -> 69444.444444444438 | I9: =0.05*K9 -> 10416.666666666666 | J9: =D9/C9/0.45/E9 -> 16563.970052342145 | K9: =E9*J9*0.45 -> 208333.33333333331 | L9: =C9*K9 -> 25000 | M9: =IF((C9*K9)-D9<=0,0,(C9*K9)-D9) -> 0 | N9: =K9*0.2 -> 41666.666666666664 | O9: =K9-D9-H9-I9-M9-N9 -> 61805.55555555554 | P9: =O9/K9 -> 0.29666666666666663
A10: Hardcover | B10: LITERARY FICTION | C10: 0.12 | D10: 25000 | E10: 27.95 | F10: =E10*0.12 -> 3.3539999999999996 | G10: =J10*1.25 -> 20704.962565427682 | H10: =G10*F10 -> 69444.444444444438 | I10: =0.05*K10 -> 10416.666666666666 | J10: =D10/C10/0.45/E10 -> 16563.970052342145 | K10: =E10*J10*0.45 -> 208333.33333333331 | L10: =C10*K10 -> 25000 | M10: =IF((C10*K10)-D10<=0,0,(C10*K10)-D10) -> 0 | N10: =K10*0.2 -> 41666.666666666664 | O10: =K10-D10-H10-I10-M10-N10 -> 61805.55555555554 | P10: =O10/K10 -> 0.29666666666666663
A11: Hardcover | B11: LITERARY FICTION | C11: 0.12 | D11: 25000 | E11: 27.95 | F11: =E11*0.12 -> 3.3539999999999996 | G11: =J11*1.25 -> 20704.962565427682 | H11: =G11*F11 -> 69444.444444444438 | I11: =0.05*K11 -> 10416.666666666666 | J11: =D11/C11/0.45/E11 -> 16563.970052342145 | K11: =E11*J11*0.45 -> 208333.33333333331 | L11: =C11*K11 -> 25000 | M11: =IF((C11*K11)-D11<=0,0,(C11*K11)-D11) -> 0 | N11: =K11*0.2 -> 41666.666666666664 | O11: =K11-D11-H11-I11-M11-N11 -> 61805.55555555554 | P11: =O11/K11 -> 0.29666666666666663
A12: Hardcover | B12: LITERARY FICTION | C12: 0.12 | D12: 25000 | E12: 29.95 | F12: =E12*0.12 -> 3.5939999999999999 | G12: =J12*1.25 -> 19322.32733568293 | H12: =G12*F12 -> 69444.444444444453 | I12: =0.05*K12 -> 10416.666666666668 | J12: =D12/C12/0.45/E12 -> 15457.861868546344 | K12: =E12*J12*0.45 -> 208333.33333333334 | L12: =C12*K12 -> 25000 | M12: =IF((C12*K12)-D12<=0,0,(C12*K12)-D12) -> 0 | N12: =K12*0.2 -> 41666.666666666672 | O12: =K12-D12-H12-I12-M12-N12 -> 61805.555555555547 | P12: =O12/K12 -> 0.29666666666666663
A13: Hardcover | B13: LITERARY FICTION | C13: 0.12 | D13: 10000 | E13: 27.95 | F13: =E13*0.12 -> 3.3539999999999996 | G13: =J13*1.25 -> 8281.9850261710744 | H13: =G13*F13 -> 27777.777777777781 | I13: =0.05*K13 -> 4166.666666666667 | J13: =D13/C13/0.45/E13 -> 6625.5880209368588 | K13: =E13*J13*0.45 -> 83333.333333333343 | L13: =C13*K13 -> 10000 | M13: =IF((C13*K13)-D13<=0,0,(C13*K13)-D13) -> 0 | N13: =K13*0.2 -> 16666.666666666668 | O13: =K13-D13-H13-I13-M13-N13 -> 24722.22222222223 | P13: =O13/K13 -> 0.29666666666666675
A14: Hardcover | B14: LITERARY FICTION | C14: 0.12 | D14: 10000 | E14: 27.95 | F14: =E14*0.12 -> 3.3539999999999996 | G14: =J14*1.25 -> 8281.9850261710744 | H14: =G14*F14 -> 27777.777777777781 | I14: =0.05*K14 -> 4166.666666666667 | J14: =D14/C14/0.45/E14 -> 6625.5880209368588 | K14: =E14*J14*0.45 -> 83333.333333333343 | L14: =C14*K14 -> 10000 | M14: =IF((C14*K14)-D14<=0,0,(C14*K14)-D14) -> 0 | N14: =K14*0.2 -> 16666.666666666668 | O14: =K14-D14-H14-I14-M14-N14 -> 24722.22222222223 | P14: =O14/K14 -> 0.29666666666666675
A15: Hardcover | B15: LITERARY FICTION | C15: 0.12 | D15: 10000 | E15: 27.95 | F15: =E15*0.12 -> 3.3539999999999996 | G15: =J15*1.25 -> 8281.9850261710744 | H15: =G15*F15 -> 27777.777777777781 | I15: =0.05*K15 -> 4166.666666666667 | J15: =D15/C15/0.45/E15 -> 6625.5880209368588 | K15: =E15*J15*0.45 -> 83333.333333333343 | L15: =C15*K15 -> 10000 | M15: =IF((C15*K15)-D15<=0,0,(C15*K15)-D15) -> 0 | N15: =K15*0.2 -> 16666.666666666668 | O15: =K15-D15-H15-I15-M15-N15 -> 24722.22222222223 | P15: =O15/K15 -> 0.29666666666666675
A16: Hardcover | B16: LITERARY FICTION | C16: 0.12 | D16: 5000 | E16: 29.95 | F16: =E16*0.12 -> 3.5939999999999999 | G16: =J16*1.25 -> 3864.4654671365861 | H16: =G16*F16 -> 13888.888888888891 | I16: =0.05*K16 -> 2083.3333333333335 | J16: =D16/C16/0.45/E16 -> 3091.572373709269 | K16: =E16*J16*0.45 -> 41666.666666666672 | L16: =C16*K16 -> 5000 | M16: =IF((C16*K16)-D16<=0,0,(C16*K16)-D16) -> 0 | N16: =K16*0.2 -> 8333.3333333333339 | O16: =K16-D16-H16-I16-M16-N16 -> 12361.111111111115 | P16: =O16/K16 -> 0.29666666666666675
A17: Hardcover | B17: LITERARY FICTION | C17: 0.12 | D17: 5000 | E17: 29.95 | F17: =E17*0.12 -> 3.5939999999999999 | G17: =J17*1.25 -> 3864.4654671365861 | H17: =G17*F17 -> 13888.888888888891 | I17: =0.05*K17 -> 2083.3333333333335 | J17: =D17/C17/0.45/E17 -> 3091.572373709269 | K17: =E17*J17*0.45 -> 41666.666666666672 | L17: =C17*K17 -> 5000 | M17: =IF((C17*K17)-D17<=0,0,(C17*K17)-D17) -> 0 | N17: =K17*0.2 -> 8333.3333333333339 | O17: =K17-D17-H17-I17-M17-N17 -> 12361.111111111115 | P17: =O17/K17 -> 0.29666666666666675
A18: Hardcover | B18: LITERARY FICTION | C18: 0.12 | D18: 5000 | E18: 27.95 | F18: =E18*0.12 -> 3.3539999999999996 | G18: =J18*1.25 -> 4140.9925130855372 | H18: =G18*F18 -> 13888.888888888891 | I18: =0.05*K18 -> 2083.3333333333335 | J18: =D18/C18/0.45/E18 -> 3312.7940104684294 | K18: =E18*J18*0.45 -> 41666.666666666672 | L18: =C18*K18 -> 5000 | M18: =IF((C18*K18)-D18<=0,0,(C18*K18)-D18) -> 0 | N18: =K18*0.2 -> 8333.3333333333339 | O18: =K18-D18-H18-I18-M18-N18 -> 12361.111111111115 | P18: =O18/K18 -> 0.29666666666666675
A19: Trade Paper Original | B19: LITERARY FICTION | C19: 0.12 | D19: 25000 | E19: 16.95 | F19: =E19*0.12 -> 2.0339999999999998 | G19: =J19*1.25 -> 34141.811427947119 | H19: =G19*F19 -> 69444.444444444438 | I19: =0.05*K19 -> 10416.666666666668 | J19: =D19/C19/0.45/E19 -> 27313.449142357698 | K19: =E19*J19*0.45 -> 208333.33333333334 | L19: =C19*K19 -> 25000 | M19: =IF((C19*K19)-D19<=0,0,(C19*K19)-D19) -> 0 | N19: =K19*0.2 -> 41666.666666666672 | O19: =K19-D19-H19-I19-M19-N19 -> 61805.555555555562 | P19: =O19/K19 -> 0.29666666666666669
A20: Trade Paper Original | B20: LITERARY FICTION | C20: 0.12 | D20: 25000 | E20: 16.95 | F20: =E20*0.12 -> 2.0339999999999998 | G20: =J20*1.25 -> 34141.811427947119 | H20: =G20*F20 -> 69444.444444444438 | I20: =0.05*K20 -> 10416.666666666668 | J20: =D20/C20/0.45/E20 -> 27313.449142357698 | K20: =E20*J20*0.45 -> 208333.33333333334 | L20: =C20*K20 -> 25000 | M20: =IF((C20*K20)-D20<=0,0,(C20*K20)-D20) -> 0 | N20: =K20*0.2 -> 41666.666666666672 | O20: =K20-D20-H20-I20-M20-N20 -> 61805.555555555562 | P20: =O20/K20 -> 0.29666666666666669
A21: Trade Paper Original | B21: LITERARY FICTION | C21: 0.12 | D21: 10000 | E21: 16.95 | F21: =E21*0.12 -> 2.0339999999999998 | G21: =J21*1.25 -> 13656.724571178849 | H21: =G21*F21 -> 27777.777777777777 | I21: =0.05*K21 -> 4166.666666666667 | J21: =D21/C21/0.45/E21 -> 10925.37965694308 | K21: =E21*J21*0.45 -> 83333.333333333343 | L21: =C21*K21 -> 10000 | M21: =IF((C21*K21)-D21<=0,0,(C21*K21)-D21) -> 0 | N21: =K21*0.2 -> 16666.666666666668 | O21: =K21-D21-H21-I21-M21-N21 -> 24722.22222222223 | P21: =O21/K21 -> 0.29666666666666675
A22: Trade Paper Original | B22: LITERARY FICTION | C22: 0.12 | D22: 10000 | E22: 16.95 | F22: =E22*0.12 -> 2.0339999999999998 | G22: =J22*1.25 -> 13656.724571178849 | H22: =G22*F22 -> 27777.777777777777 | I22: =0.05*K22 -> 4166.666666666667 | J22: =D22/C22/0.45/E22 -> 10925.37965694308 | K22: =E22*J22*0.45 -> 83333.333333333343 | L22: =C22*K22 -> 10000 | M22: =IF((C22*K22)-D22<=0,0,(C22*K22)-D22) -> 0 | N22: =K22*0.2 -> 16666.666666666668 | O22: =K22-D22-H22-I22-M22-N22 -> 24722.22222222223 | P22: =O22/K22 -> 0.29666666666666675
A23: Trade Paper Original | B23: LITERARY FICTION | C23: 0.12 | D23: 5000 | E23: 16.95 | F23: =E23*0.12 -> 2.0339999999999998 | G23: =J23*1.25 -> 6828.3622855894246 | H23: =G23*F23 -> 13888.888888888889 | I23: =0.05*K23 -> 2083.3333333333335 | J23: =D23/C23/0.45/E23 -> 5462.6898284715398 | K23: =E23*J23*0.45 -> 41666.666666666672 | L23: =C23*K23 -> 5000 | M23: =IF((C23*K23)-D23<=0,0,(C23*K23)-D23) -> 0 | N23: =K23*0.2 -> 8333.3333333333339 | O23: =K23-D23-H23-I23-M23-N23 -> 12361.111111111115 | P23: =O23/K23 -> 0.29666666666666675
A24: Trade Paper Original | B24: LITERARY FICTION | C24: 0.12 | D24: 5000 | E24: 16.95 | F24: =E24*0.12 -> 2.0339999999999998 | G24: =J24*1.25 -> 6828.3622855894246 | H24: =G24*F24 -> 13888.888888888889 | I24: =0.05*K24 -> 2083.3333333333335 | J24: =D24/C24/0.45/E24 -> 5462.6898284715398 | K24: =E24*J24*0.45 -> 41666.666666666672 | L24: =C24*K24 -> 5000 | M24: =IF((C24*K24)-D24<=0,0,(C24*K24)-D24) -> 0 | N24: =K24*0.2 -> 8333.3333333333339 | O24: =K24-D24-H24-I24-M24-N24 -> 12361.111111111115 | P24: =O24/K24 -> 0.29666666666666675
A25: Trade Paper Original | B25: LITERARY FICTION | C25: 0.12 | D25: 5000 | E25: 16.95 | F25: =E25*0.12 -> 2.0339999999999998 | G25: =J25*1.25 -> 6828.3622855894246 | H25: =G25*F25 -> 13888.888888888889 | I25: =0.05*K25 -> 2083.3333333333335 | J25: =D25/C25/0.45/E25 -> 5462.6898284715398 | K25: =E25*J25*0.45 -> 41666.666666666672 | L25: =C25*K25 -> 5000 | M25: =IF((C25*K25)-D25<=0,0,(C25*K25)-D25) -> 0 | N25: =K25*0.2 -> 8333.3333333333339 | O25: =K25-D25-H25-I25-M25-N25 -> 12361.111111111115 | P25: =O25/K25 -> 0.29666666666666675
A26: Trade Paper Original | B26: LITERARY FICTION | C26: 0.12 | D26: 5000 | E26: 16.95 | F26: =E26*0.12 -> 2.0339999999999998 | G26: =J26*1.25 -> 6828.3622855894246 | H26: =G26*F26 -> 13888.888888888889 | I26: =0.05*K26 -> 2083.3333333333335 | J26: =D26/C26/0.45/E26 -> 5462.6898284715398 | K26: =E26*J26*0.45 -> 41666.666666666672 | L26: =C26*K26 -> 5000 | M26: =IF((C26*K26)-D26<=0,0,(C26*K26)-D26) -> 0 | N26: =K26*0.2 -> 8333.3333333333339 | O26: =K26-D26-H26-I26-M26-N26 -> 12361.111111111115 | P26: =O26/K26 -> 0.29666666666666675
A27: Trade Paper Original | B27: LITERARY FICTION | C27: 0.12 | D27: 5000 | E27: 16.95 | F27: =E27*0.12 -> 2.0339999999999998 | G27: =J27*1.25 -> 6828.3622855894246 | H27: =G27*F27 -> 13888.888888888889 | I27: =0.05*K27 -> 2083.3333333333335 | J27: =D27/C27/0.45/E27 -> 5462.6898284715398 | K27: =E27*J27*0.45 -> 41666.666666666672 | L27: =C27*K27 -> 5000 | M27: =IF((C27*K27)-D27<=0,0,(C27*K27)-D27) -> 0 | N27: =K27*0.2 -> 8333.3333333333339 | O27: =K27-D27-H27-I27-M27-N27 -> 12361.111111111115 | P27: =O27/K27 -> 0.29666666666666675
A28: Trade Paper Original | B28: LITERARY FICTION | C28: 0.12 | D28: 5000 | E28: 16.95 | F28: =E28*0.12 -> 2.0339999999999998 | G28: =J28*1.25 -> 6828.3622855894246 | H28: =G28*F28 -> 13888.888888888889 | I28: =0.05*K28 -> 2083.3333333333335 | J28: =D28/C28/0.45/E28 -> 5462.6898284715398 | K28: =E28*J28*0.45 -> 41666.666666666672 | L28: =C28*K28 -> 5000 | M28: =IF((C28*K28)-D28<=0,0,(C28*K28)-D28) -> 0 | N28: =K28*0.2 -> 8333.3333333333339 | O28: =K28-D28-H28-I28-M28-N28 -> 12361.111111111115 | P28: =O28/K28 -> 0.29666666666666675
A29: Trade Paper Original | B29: LITERARY FICTION | C29: 0.12 | D29: 5000 | E29: 16.95 | F29: =E29*0.12 -> 2.0339999999999998 | G29: =J29*1.25 -> 6828.3622855894246 | H29: =G29*F29 -> 13888.888888888889 | I29: =0.05*K29 -> 2083.3333333333335 | J29: =D29/C29/0.45/E29 -> 5462.6898284715398 | K29: =E29*J29*0.45 -> 41666.666666666672 | L29: =C29*K29 -> 5000 | M29: =IF((C29*K29)-D29<=0,0,(C29*K29)-D29) -> 0 | N29: =K29*0.2 -> 8333.3333333333339 | O29: =K29-D29-H29-I29-M29-N29 -> 12361.111111111115 | P29: =O29/K29 -> 0.29666666666666675
A30: Trade Paper Original | B30: LITERARY FICTION | C30: 0.12 | D30: 5000 | E30: 16.95 | F30: =E30*0.12 -> 2.0339999999999998 | G30: =J30*1.25 -> 6828.3622855894246 | H30: =G30*F30 -> 13888.888888888889 | I30: =0.05*K30 -> 2083.3333333333335 | J30: =D30/C30/0.45/E30 -> 5462.6898284715398 | K30: =E30*J30*0.45 -> 41666.666666666672 | L30: =C30*K30 -> 5000 | M30: =IF((C30*K30)-D30<=0,0,(C30*K30)-D30) -> 0 | N30: =K30*0.2 -> 8333.3333333333339 | O30: =K30-D30-H30-I30-M30-N30 -> 12361.111111111115 | P30: =O30/K30 -> 0.29666666666666675
A31: Trade Paper Original | B31: LITERARY FICTION | C31: 0.12 | D31: 5000 | E31: 16.95 | F31: =E31*0.12 -> 2.0339999999999998 | G31: =J31*1.25 -> 6828.3622855894246 | H31: =G31*F31 -> 13888.888888888889 | I31: =0.05*K31 -> 2083.3333333333335 | J31: =D31/C31/0.45/E31 -> 5462.6898284715398 | K31: =E31*J31*0.45 -> 41666.666666666672 | L31: =C31*K31 -> 5000 | M31: =IF((C31*K31)-D31<=0,0,(C31*K31)-D31) -> 0 | N31: =K31*0.2 -> 8333.3333333333339 | O31: =K31-D31-H31-I31-M31-N31 -> 12361.111111111115 | P31: =O31/K31 -> 0.29666666666666675
A32: Trade Paper Original | B32: LITERARY FICTION | C32: 0.12 | D32: 5000 | E32: 16.95 | F32: =E32*0.12 -> 2.0339999999999998 | G32: =J32*1.25 -> 6828.3622855894246 | H32: =G32*F32 -> 13888.888888888889 | I32: =0.05*K32 -> 2083.3333333333335 | J32: =D32/C32/0.45/E32 -> 5462.6898284715398 | K32: =E32*J32*0.45 -> 41666.666666666672 | L32: =C32*K32 -> 5000 | M32: =IF((C32*K32)-D32<=0,0,(C32*K32)-D32) -> 0 | N32: =K32*0.2 -> 8333.3333333333339 | O32: =K32-D32-H32-I32-M32-N32 -> 12361.111111111115 | P32: =O32/K32 -> 0.29666666666666675
A33: Trade Paper Original | B33: LITERARY FICTION | C33: 0.12 | D33: 5000 | E33: 16.95 | F33: =E33*0.12 -> 2.0339999999999998 | G33: =J33*1.25 -> 6828.3622855894246 | H33: =G33*F33 -> 13888.888888888889 | I33: =0.05*K33 -> 2083.3333333333335 | J33: =D33/C33/0.45/E33 -> 5462.6898284715398 | K33: =E33*J33*0.45 -> 41666.666666666672 | L33: =C33*K33 -> 5000 | M33: =IF((C33*K33)-D33<=0,0,(C33*K33)-D33) -> 0 | N33: =K33*0.2 -> 8333.3333333333339 | O33: =K33-D33-H33-I33-M33-N33 -> 12361.111111111115 | P33: =O33/K33 -> 0.29666666666666675
A34: PBR: Trade Paper | B34: LITERARY FICTION | C34: 0.12 | D34: 50000 | E34: 14.95 | F34: =E34*0.12 -> 1.7939999999999998 | G34: =J34*1.25 -> 77418.555679425248 | H34: =G34*F34 -> 138888.88888888888 | I34: =0.05*K34 -> 20833.333333333336 | J34: =D34/C34/0.45/E34 -> 61934.844543540203 | K34: =E34*J34*0.45 -> 416666.66666666669 | L34: =C34*K34 -> 50000 | M34: =IF((C34*K34)-D34<=0,0,(C34*K34)-D34) -> 0 | N34: =K34*0.2 -> 83333.333333333343 | O34: =K34-D34-H34-I34-M34-N34 -> 123611.11111111112 | P34: =O34/K34 -> 0.29666666666666669
A35: PBR: Trade Paper | B35: LITERARY FICTION | C35: 0.12 | D35: 25000 | E35: 14.95 | F35: =E35*0.12 -> 1.7939999999999998 | G35: =J35*1.25 -> 38709.277839712624 | H35: =G35*F35 -> 69444.444444444438 | I35: =0.05*K35 -> 10416.666666666668 | J35: =D35/C35/0.45/E35 -> 30967.422271770101 | K35: =E35*J35*0.45 -> 208333.33333333334 | L35: =C35*K35 -> 25000 | M35: =IF((C35*K35)-D35<=0,0,(C35*K35)-D35) -> 0 | N35: =K35*0.2 -> 41666.666666666672 | O35: =K35-D35-H35-I35-M35-N35 -> 61805.555555555562 | P35: =O35/K35 -> 0.29666666666666669
A36: PBR: Trade Paper | B36: LITERARY FICTION | C36: 0.12 | D36: 10000 | E36: 15.95 | F36: =E36*0.12 -> 1.9139999999999999 | G36: =J36*1.25 -> 14512.945547428308 | H36: =G36*F36 -> 27777.777777777781 | I36: =0.05*K36 -> 4166.666666666667 | J36: =D36/C36/0.45/E36 -> 11610.356437942646 | K36: =E36*J36*0.45 -> 83333.333333333343 | L36: =C36*K36 -> 10000 | M36: =IF((C36*K36)-D36<=0,0,(C36*K36)-D36) -> 0 | N36: =K36*0.2 -> 16666.666666666668 | O36: =K36-D36-H36-I36-M36-N36 -> 24722.22222222223 | P36: =O36/K36 -> 0.29666666666666675
A37: PBR: Trade Paper | B37: LITERARY FICTION | C37: 0.12 | D37: 10000 | E37: 15.95 | F37: =E37*0.12 -> 1.9139999999999999 | G37: =J37*1.25 -> 14512.945547428308 | H37: =G37*F37 -> 27777.777777777781 | I37: =0.05*K37 -> 4166.666666666667 | J37: =D37/C37/0.45/E37 -> 11610.356437942646 | K37: =E37*J37*0.45 -> 83333.333333333343 | L37: =C37*K37 -> 10000 | M37: =IF((C37*K37)-D37<=0,0,(C37*K37)-D37) -> 0 | N37: =K37*0.2 -> 16666.666666666668 | O37: =K37-D37-H37-I37-M37-N37 -> 24722.22222222223 | P37: =O37/K37 -> 0.29666666666666675
A38: PBR: Trade Paper | B38: LITERARY FICTION | C38: 0.12 | D38: 10000 | E38: 14.95 | F38: =E38*0.12 -> 1.7939999999999998 | G38: =J38*1.25 -> 15483.711135885051 | H38: =G38*F38 -> 27777.777777777777 | I38: =0.05*K38 -> 4166.666666666667 | J38: =D38/C38/0.45/E38 -> 12386.968908708041 | K38: =E38*J38*0.45 -> 83333.333333333343 | L38: =C38*K38 -> 10000 | M38: =IF((C38*K38)-D38<=0,0,(C38*K38)-D38) -> 0 | N38: =K38*0.2 -> 16666.666666666668 | O38: =K38-D38-H38-I38-M38-N38 -> 24722.22222222223 | P38: =O38/K38 -> 0.29666666666666675
A39: PBR: Trade Paper | B39: LITERARY FICTION | C39: 0.12 | D39: 10000 | E39: 14.95 | F39: =E39*0.12 -> 1.7939999999999998 | G39: =J39*1.25 -> 15483.711135885051 | H39: =G39*F39 -> 27777.777777777777 | I39: =0.05*K39 -> 4166.666666666667 | J39: =D39/C39/0.45/E39 -> 12386.968908708041 | K39: =E39*J39*0.45 -> 83333.333333333343 | L39: =C39*K39 -> 10000 | M39: =IF((C39*K39)-D39<=0,0,(C39*K39)-D39) -> 0 | N39: =K39*0.2 -> 16666.666666666668 | O39: =K39-D39-H39-I39-M39-N39 -> 24722.22222222223 | P39: =O39/K39 -> 0.29666666666666675
A40: PBR: Trade Paper | B40: LITERARY FICTION | C40: 0.12 | D40: 10000 | E40: 14.95 | F40: =E40*0.12 -> 1.7939999999999998 | G40: =J40*1.25 -> 15483.711135885051 | H40: =G40*F40 -> 27777.777777777777 | I40: =0.05*K40 -> 4166.666666666667 | J40: =D40/C40/0.45/E40 -> 12386.968908708041 | K40: =E40*J40*0.45 -> 83333.333333333343 | L40: =C40*K40 -> 10000 | M40: =IF((C40*K40)-D40<=0,0,(C40*K40)-D40) -> 0 | N40: =K40*0.2 -> 16666.666666666668 | O40: =K40-D40-H40-I40-M40-N40 -> 24722.22222222223 | P40: =O40/K40 -> 0.29666666666666675
A41: PBR: Trade Paper | B41: LITERARY FICTION | C41: 0.12 | D41: 10000 | E41: 14.95 | F41: =E41*0.12 -> 1.7939999999999998 | G41: =J41*1.25 -> 15483.711135885051 | H41: =G41*F41 -> 27777.777777777777 | I41: =0.05*K41 -> 4166.666666666667 | J41: =D41/C41/0.45/E41 -> 12386.968908708041 | K41: =E41*J41*0.45 -> 83333.333333333343 | L41: =C41*K41 -> 10000 | M41: =IF((C41*K41)-D41<=0,0,(C41*K41)-D41) -> 0 | N41: =K41*0.2 -> 16666.666666666668 | O41: =K41-D41-H41-I41-M41-N41 -> 24722.22222222223 | P41: =O41/K41 -> 0.29666666666666675
A42: PBR: Trade Paper | B42: LITERARY FICTION | C42: 0.12 | D42: 10000 | E42: 14.95 | F42: =E42*0.12 -> 1.7939999999999998 | G42: =J42*1.25 -> 15483.711135885051 | H42: =G42*F42 -> 27777.777777777777 | I42: =0.05*K42 -> 4166.666666666667 | J42: =D42/C42/0.45/E42 -> 12386.968908708041 | K42: =E42*J42*0.45 -> 83333.333333333343 | L42: =C42*K42 -> 10000 | M42: =IF((C42*K42)-D42<=0,0,(C42*K42)-D42) -> 0 | N42: =K42*0.2 -> 16666.666666666668 | O42: =K42-D42-H42-I42-M42-N42 -> 24722.22222222223 | P42: =O42/K42 -> 0.29666666666666675
A43: PBR: Trade Paper | B43: LITERARY FICTION | C43: 0.12 | D43: 10000 | E43: 14.95 | F43: =E43*0.12 -> 1.7939999999999998 | G43: =J43*1.25 -> 15483.711135885051 | H43: =G43*F43 -> 27777.777777777777 | I43: =0.05*K43 -> 4166.666666666667 | J43: =D43/C43/0.45/E43 -> 12386.968908708041 | K43: =E43*J43*0.45 -> 83333.333333333343 | L43: =C43*K43 -> 10000 | M43: =IF((C43*K43)-D43<=0,0,(C43*K43)-D43) -> 0 | N43: =K43*0.2 -> 16666.666666666668 | O43: =K43-D43-H43-I43-M43-N43 -> 24722.22222222223 | P43: =O43/K43 -> 0.29666666666666675
A44: PBR: Trade Paper | B44: LITERARY FICTION | C44: 0.12 | D44: 10000 | E44: 14.95 | F44: =E44*0.12 -> 1.7939999999999998 | G44: =J44*1.25 -> 15483.711135885051 | H44: =G44*F44 -> 27777.777777777777 | I44: =0.05*K44 -> 4166.666666666667 | J44: =D44/C44/0.45/E44 -> 12386.968908708041 | K44: =E44*J44*0.45 -> 83333.333333333343 | L44: =C44*K44 -> 10000 | M44: =IF((C44*K44)-D44<=0,0,(C44*K44)-D44) -> 0 | N44: =K44*0.2 -> 16666.666666666668 | O44: =K44-D44-H44-I44-M44-N44 -> 24722.22222222223 | P44: =O44/K44 -> 0.29666666666666675
A45: Hardcover | B45: HORROR | C45: 0.12 | D45: 250000 | E45: 29.95 | F45: =E45*0.12 -> 3.5939999999999999 | G45: =J45*1.25 -> 193223.2733568293 | H45: =G45*F45 -> 694444.4444444445 | I45: =0.05*K45 -> 104166.66666666669 | J45: =D45/C45/0.45/E45 -> 154578.61868546344 | K45: =E45*J45*0.45 -> 2083333.3333333335 | L45: =C45*K45 -> 250000 | M45: =IF((C45*K45)-D45<=0,0,(C45*K45)-D45) -> 0 | N45: =K45*0.2 -> 416666.66666666674 | O45: =K45-D45-H45-I45-M45-N45 -> 618055.5555555555 | P45: =O45/K45 -> 0.29666666666666663
A46: Hardcover | B46: HORROR | C46: 0.12 | D46: 100000 | E46: 29.95 | F46: =E46*0.12 -> 3.5939999999999999 | G46: =J46*1.25 -> 77289.309342731722 | H46: =G46*F46 -> 277777.77777777781 | I46: =0.05*K46 -> 41666.666666666672 | J46: =D46/C46/0.45/E46 -> 61831.447474185377 | K46: =E46*J46*0.45 -> 833333.33333333337 | L46: =C46*K46 -> 100000 | M46: =IF((C46*K46)-D46<=0,0,(C46*K46)-D46) -> 0 | N46: =K46*0.2 -> 166666.66666666669 | O46: =K46-D46-H46-I46-M46-N46 -> 247222.22222222219 | P46: =O46/K46 -> 0.29666666666666663
A47: Hardcover | B47: HORROR | C47: 0.12 | D47: 75000 | E47: 29.95 | F47: =E47*0.12 -> 3.5939999999999999 | G47: =J47*1.25 -> 57966.982007048784 | H47: =G47*F47 -> 208333.33333333331 | I47: =0.05*K47 -> 31250 | J47: =D47/C47/0.45/E47 -> 46373.585605639026 | K47: =E47*J47*0.45 -> 625000 | L47: =C47*K47 -> 75000 | M47: =IF((C47*K47)-D47<=0,0,(C47*K47)-D47) -> 0 | N47: =K47*0.2 -> 125000 | O47: =K47-D47-H47-I47-M47-N47 -> 185416.66666666669 | P47: =O47/K47 -> 0.29666666666666669
A48: Hardcover | B48: HORROR | C48: 0.12 | D48: 50000 | E48: 29.95 | F48: =E48*0.12 -> 3.5939999999999999 | G48: =J48*1.25 -> 38644.654671365861 | H48: =G48*F48 -> 138888.88888888891 | I48: =0.05*K48 -> 20833.333333333336 | J48: =D48/C48/0.45/E48 -> 30915.723737092689 | K48: =E48*J48*0.45 -> 416666.66666666669 | L48: =C48*K48 -> 50000 | M48: =IF((C48*K48)-D48<=0,0,(C48*K48)-D48) -> 0 | N48: =K48*0.2 -> 83333.333333333343 | O48: =K48-D48-H48-I48-M48-N48 -> 123611.11111111109 | P48: =O48/K48 -> 0.29666666666666663
A49: Hardcover | B49: HORROR | C49: 0.12 | D49: 25000 | E49: 27.95 | F49: =E49*0.12 -> 3.3539999999999996 | G49: =J49*1.25 -> 20704.962565427682 | H49: =G49*F49 -> 69444.444444444438 | I49: =0.05*K49 -> 10416.666666666666 | J49: =D49/C49/0.45/E49 -> 16563.970052342145 | K49: =E49*J49*0.45 -> 208333.33333333331 | L49: =C49*K49 -> 25000 | M49: =IF((C49*K49)-D49<=0,0,(C49*K49)-D49) -> 0 | N49: =K49*0.2 -> 41666.666666666664 | O49: =K49-D49-H49-I49-M49-N49 -> 61805.55555555554 | P49: =O49/K49 -> 0.29666666666666663
A50: Hardcover | B50: HORROR | C50: 0.12 | D50: 25000 | E50: 24.95 | F50: =E50*0.12 -> 2.9939999999999998 | G50: =J50*1.25 -> 23194.537222593335 | H50: =G50*F50 -> 69444.444444444438 | I50: =0.05*K50 -> 10416.666666666668 | J50: =D50/C50/0.45/E50 -> 18555.629778074668 | K50: =E50*J50*0.45 -> 208333.33333333334 | L50: =C50*K50 -> 25000 | M50: =IF((C50*K50)-D50<=0,0,(C50*K50)-D50) -> 0 | N50: =K50*0.2 -> 41666.666666666672 | O50: =K50-D50-H50-I50-M50-N50 -> 61805.555555555562 | P50: =O50/K50 -> 0.29666666666666669
A51: Hardcover | B51: HORROR | C51: 0.12 | D51: 25000 | E51: 24.95 | F51: =E51*0.12 -> 2.9939999999999998 | G51: =J51*1.25 -> 23194.537222593335 | H51: =G51*F51 -> 69444.444444444438 | I51: =0.05*K51 -> 10416.666666666668 | J51: =D51/C51/0.45/E51 -> 18555.629778074668 | K51: =E51*J51*0.45 -> 208333.33333333334 | L51: =C51*K51 -> 25000 | M51: =IF((C51*K51)-D51<=0,0,(C51*K51)-D51) -> 0 | N51: =K51*0.2 -> 41666.666666666672 | O51: =K51-D51-H51-I51-M51-N51 -> 61805.555555555562 | P51: =O51/K51 -> 0.29666666666666669
A52: Hardcover | B52: HORROR | C52: 0.12 | D52: 25000 | E52: 24.95 | F52: =E52*0.12 -> 2.9939999999999998 | G52: =J52*1.25 -> 23194.537222593335 | H52: =G52*F52 -> 69444.444444444438 | I52: =0.05*K52 -> 10416.666666666668 | J52: =D52/C52/0.45/E52 -> 18555.629778074668 | K52: =E52*J52*0.45 -> 208333.33333333334 | L52: =C52*K52 -> 25000 | M52: =IF((C52*K52)-D52<=0,0,(C52*K52)-D52) -> 0 | N52: =K52*0.2 -> 41666.666666666672 | O52: =K52-D52-H52-I52-M52-N52 -> 61805.555555555562 | P52: =O52/K52 -> 0.29666666666666669
A53: Hardcover | B53: HORROR | C53: 0.12 | D53: 10000 | E53: 21.95 | F53: =E53*0.12 -> 2.6339999999999999 | G53: =J53*1.25 -> 10545.853370454737 | H53: =G53*F53 -> 27777.777777777777 | I53: =0.05*K53 -> 4166.666666666667 | J53: =D53/C53/0.45/E53 -> 8436.6826963637905 | K53: =E53*J53*0.45 -> 83333.333333333343 | L53: =C53*K53 -> 10000 | M53: =IF((C53*K53)-D53<=0,0,(C53*K53)-D53) -> 0 | N53: =K53*0.2 -> 16666.666666666668 | O53: =K53-D53-H53-I53-M53-N53 -> 24722.22222222223 | P53: =O53/K53 -> 0.29666666666666675
A54: Hardcover | B54: HORROR | C54: 0.12 | D54: 10000 | E54: 27.95 | F54: =E54*0.12 -> 3.3539999999999996 | G54: =J54*1.25 -> 8281.9850261710744 | H54: =G54*F54 -> 27777.777777777781 | I54: =0.05*K54 -> 4166.666666666667 | J54: =D54/C54/0.45/E54 -> 6625.5880209368588 | K54: =E54*J54*0.45 -> 83333.333333333343 | L54: =C54*K54 -> 10000 | M54: =IF((C54*K54)-D54<=0,0,(C54*K54)-D54) -> 0 | N54: =K54*0.2 -> 16666.666666666668 | O54: =K54-D54-H54-I54-M54-N54 -> 24722.22222222223 | P54: =O54/K54 -> 0.29666666666666675
A55: Hardcover | B55: HORROR | C55: 0.12 | D55: 10000 | E55: 21.95 | F55: =E55*0.12 -> 2.6339999999999999 | G55: =J55*1.25 -> 10545.853370454737 | H55: =G55*F55 -> 27777.777777777777 | I55: =0.05*K55 -> 4166.666666666667 | J55: =D55/C55/0.45/E55 -> 8436.6826963637905 | K55: =E55*J55*0.45 -> 83333.333333333343 | L55: =C55*K55 -> 10000 | M55: =IF((C55*K55)-D55<=0,0,(C55*K55)-D55) -> 0 | N55: =K55*0.2 -> 16666.666666666668 | O55: =K55-D55-H55-I55-M55-N55 -> 24722.22222222223 | P55: =O55/K55 -> 0.29666666666666675
A56: Hardcover | B56: HORROR | C56: 0.12 | D56: 5000 | E56: 27.95 | F56: =E56*0.12 -> 3.3539999999999996 | G56: =J56*1.25 -> 4140.9925130855372 | H56: =G56*F56 -> 13888.888888888891 | I56: =0.05*K56 -> 2083.3333333333335 | J56: =D56/C56/0.45/E56 -> 3312.7940104684294 | K56: =E56*J56*0.45 -> 41666.666666666672 | L56: =C56*K56 -> 5000 | M56: =IF((C56*K56)-D56<=0,0,(C56*K56)-D56) -> 0 | N56: =K56*0.2 -> 8333.3333333333339 | O56: =K56-D56-H56-I56-M56-N56 -> 12361.111111111115 | P56: =O56/K56 -> 0.29666666666666675
A57: Trade Paper Original | B57: HORROR | C57: 0.12 | D57: 10000 | E57: 16.95 | F57: =E57*0.12 -> 2.0339999999999998 | G57: =J57*1.25 -> 13656.724571178849 | H57: =G57*F57 -> 27777.777777777777 | I57: =0.05*K57 -> 4166.666666666667 | J57: =D57/C57/0.45/E57 -> 10925.37965694308 | K57: =E57*J57*0.45 -> 83333.333333333343 | L57: =C57*K57 -> 10000 | M57: =IF((C57*K57)-D57<=0,0,(C57*K57)-D57) -> 0 | N57: =K57*0.2 -> 16666.666666666668 | O57: =K57-D57-H57-I57-M57-N57 -> 24722.22222222223 | P57: =O57/K57 -> 0.29666666666666675
A58: PBR: Mass Market | B58: HORROR | C58: 0.12 | D58: 75000 | E58: 7.95 | F58: =E58*0.12 -> 0.95399999999999996 | G58: =J58*1.25 -> 218378.75611460512 | H58: =G58*F58 -> 208333.33333333328 | I58: =0.05*K58 -> 31250 | J58: =D58/C58/0.45/E58 -> 174703.0048916841 | K58: =E58*J58*0.45 -> 625000 | L58: =C58*K58 -> 75000 | M58: =IF((C58*K58)-D58<=0,0,(C58*K58)-D58) -> 0 | N58: =K58*0.2 -> 125000 | O58: =K58-D58-H58-I58-M58-N58 -> 185416.66666666674 | P58: =O58/K58 -> 0.2966666666666668
A59: PBR: Mass Market | B59: HORROR | C59: 0.12 | D59: 50000 | E59: 7.95 | F59: =E59*0.12 -> 0.95399999999999996 | G59: =J59*1.25 -> 145585.83740973676 | H59: =G59*F59 -> 138888.88888888888 | I59: =0.05*K59 -> 20833.333333333336 | J59: =D59/C59/0.45/E59 -> 116468.66992778942 | K59: =E59*J59*0.45 -> 416666.66666666669 | L59: =C59*K59 -> 50000 | M59: =IF((C59*K59)-D59<=0,0,(C59*K59)-D59) -> 0 | N59: =K59*0.2 -> 83333.333333333343 | O59: =K59-D59-H59-I59-M59-N59 -> 123611.11111111112 | P59: =O59/K59 -> 0.29666666666666669
A60: PBR: Mass Market | B60: HORROR | C60: 0.12 | D60: 25000 | E60: 7.95 | F60: =E60*0.12 -> 0.95399999999999996 | G60: =J60*1.25 -> 72792.918704868382 | H60: =G60*F60 -> 69444.444444444438 | I60: =0.05*K60 -> 10416.666666666668 | J60: =D60/C60/0.45/E60 -> 58234.334963894711 | K60: =E60*J60*0.45 -> 208333.33333333334 | L60: =C60*K60 -> 25000 | M60: =IF((C60*K60)-D60<=0,0,(C60*K60)-D60) -> 0 | N60: =K60*0.2 -> 41666.666666666672 | O60: =K60-D60-H60-I60-M60-N60 -> 61805.555555555562 | P60: =O60/K60 -> 0.29666666666666669
A61: PBR: Mass Market | B61: HORROR | C61: 0.12 | D61: 25000 | E61: 7.95 | F61: =E61*0.12 -> 0.95399999999999996 | G61: =J61*1.25 -> 72792.918704868382 | H61: =G61*F61 -> 69444.444444444438 | I61: =0.05*K61 -> 10416.666666666668 | J61: =D61/C61/0.45/E61 -> 58234.334963894711 | K61: =E61*J61*0.45 -> 208333.33333333334 | L61: =C61*K61 -> 25000 | M61: =IF((C61*K61)-D61<=0,0,(C61*K61)-D61) -> 0 | N61: =K61*0.2 -> 41666.666666666672 | O61: =K61-D61-H61-I61-M61-N61 -> 61805.555555555562 | P61: =O61/K61 -> 0.29666666666666669
A62: PBR: Mass Market | B62: HORROR | C62: 0.12 | D62: 25000 | E62: 7.95 | F62: =E62*0.12 -> 0.95399999999999996 | G62: =J62*1.25 -> 72792.918704868382 | H62: =G62*F62 -> 69444.444444444438 | I62: =0.05*K62 -> 10416.666666666668 | J62: =D62/C62/0.45/E62 -> 58234.334963894711 | K62: =E62*J62*0.45 -> 208333.33333333334 | L62: =C62*K62 -> 25000 | M62: =IF((C62*K62)-D62<=0,0,(C62*K62)-D62) -> 0 | N62: =K62*0.2 -> 41666.666666666672 | O62: =K62-D62-H62-I62-M62-N62 -> 61805.555555555562 | P62: =O62/K62 -> 0.29666666666666669
A63: PBR: Trade Paper | B63: HORROR | C63: 0.12 | D63: 50000 | E63: 15.95 | F63: =E63*0.12 -> 1.9139999999999999 | G63: =J63*1.25 -> 72564.72773714154 | H63: =G63*F63 -> 138888.88888888891 | I63: =0.05*K63 -> 20833.333333333336 | J63: =D63/C63/0.45/E63 -> 58051.782189713231 | K63: =E63*J63*0.45 -> 416666.66666666669 | L63: =C63*K63 -> 50000 | M63: =IF((C63*K63)-D63<=0,0,(C63*K63)-D63) -> 0 | N63: =K63*0.2 -> 83333.333333333343 | O63: =K63-D63-H63-I63-M63-N63 -> 123611.11111111109 | P63: =O63/K63 -> 0.29666666666666663
A64: PBR: Trade Paper | B64: HORROR | C64: 0.12 | D64: 50000 | E64: 14.95 | F64: =E64*0.12 -> 1.7939999999999998 | G64: =J64*1.25 -> 77418.555679425248 | H64: =G64*F64 -> 138888.88888888888 | I64: =0.05*K64 -> 20833.333333333336 | J64: =D64/C64/0.45/E64 -> 61934.844543540203 | K64: =E64*J64*0.45 -> 416666.66666666669 | L64: =C64*K64 -> 50000 | M64: =IF((C64*K64)-D64<=0,0,(C64*K64)-D64) -> 0 | N64: =K64*0.2 -> 83333.333333333343 | O64: =K64-D64-H64-I64-M64-N64 -> 123611.11111111112 | P64: =O64/K64 -> 0.29666666666666669
A65: PBR: Trade Paper | B65: HORROR | C65: 0.12 | D65: 25000 | E65: 15.95 | F65: =E65*0.12 -> 1.9139999999999999 | G65: =J65*1.25 -> 36282.36386857077 | H65: =G65*F65 -> 69444.444444444453 | I65: =0.05*K65 -> 10416.666666666668 | J65: =D65/C65/0.45/E65 -> 29025.891094856615 | K65: =E65*J65*0.45 -> 208333.33333333334 | L65: =C65*K65 -> 25000 | M65: =IF((C65*K65)-D65<=0,0,(C65*K65)-D65) -> 0 | N65: =K65*0.2 -> 41666.666666666672 | O65: =K65-D65-H65-I65-M65-N65 -> 61805.555555555547 | P65: =O65/K65 -> 0.29666666666666663
A66: PBR: Trade Paper | B66: HORROR | C66: 0.12 | D66: 25000 | E66: 14.95 | F66: =E66*0.12 -> 1.7939999999999998 | G66: =J66*1.25 -> 38709.277839712624 | H66: =G66*F66 -> 69444.444444444438 | I66: =0.05*K66 -> 10416.666666666668 | J66: =D66/C66/0.45/E66 -> 30967.422271770101 | K66: =E66*J66*0.45 -> 208333.33333333334 | L66: =C66*K66 -> 25000 | M66: =IF((C66*K66)-D66<=0,0,(C66*K66)-D66) -> 0 | N66: =K66*0.2 -> 41666.666666666672 | O66: =K66-D66-H66-I66-M66-N66 -> 61805.555555555562 | P66: =O66/K66 -> 0.29666666666666669
A67: PBR: Trade Paper | B67: HORROR | C67: 0.12 | D67: 10000 | E67: 15.95 | F67: =E67*0.12 -> 1.9139999999999999 | G67: =J67*1.25 -> 14512.945547428308 | H67: =G67*F67 -> 27777.777777777781 | I67: =0.05*K67 -> 4166.666666666667 | J67: =D67/C67/0.45/E67 -> 11610.356437942646 | K67: =E67*J67*0.45 -> 83333.333333333343 | L67: =C67*K67 -> 10000 | M67: =IF((C67*K67)-D67<=0,0,(C67*K67)-D67) -> 0 | N67: =K67*0.2 -> 16666.666666666668 | O67: =K67-D67-H67-I67-M67-N67 -> 24722.22222222223 | P67: =O67/K67 -> 0.29666666666666675
A68: PBR: Trade Paper | B68: HORROR | C68: 0.12 | D68: 10000 | E68: 15.95 | F68: =E68*0.12 -> 1.9139999999999999 | G68: =J68*1.25 -> 14512.945547428308 | H68: =G68*F68 -> 27777.777777777781 | I68: =0.05*K68 -> 4166.666666666667 | J68: =D68/C68/0.45/E68 -> 11610.356437942646 | K68: =E68*J68*0.45 -> 83333.333333333343 | L68: =C68*K68 -> 10000 | M68: =IF((C68*K68)-D68<=0,0,(C68*K68)-D68) -> 0 | N68: =K68*0.2 -> 16666.666666666668 | O68: =K68-D68-H68-I68-M68-N68 -> 24722.22222222223 | P68: =O68/K68 -> 0.29666666666666675
A69: PBR: Trade Paper | B69: HORROR | C69: 0.12 | D69: 10000 | E69: 14.95 | F69: =E69*0.12 -> 1.7939999999999998 | G69: =J69*1.25 -> 15483.711135885051 | H69: =G69*F69 -> 27777.777777777777 | I69: =0.05*K69 -> 4166.666666666667 | J69: =D69/C69/0.45/E69 -> 12386.968908708041 | K69: =E69*J69*0.45 -> 83333.333333333343 | L69: =C69*K69 -> 10000 | M69: =IF((C69*K69)-D69<=0,0,(C69*K69)-D69) -> 0 | N69: =K69*0.2 -> 16666.666666666668 | O69: =K69-D69-H69-I69-M69-N69 -> 24722.22222222223 | P69: =O69/K69 -> 0.29666666666666675
A70: Hardcover | B70: MYSTERY/SUSPENSE | C70: 0.12 | D70: 1000000 | E70: 29.95 | F70: =E70*0.12 -> 3.5939999999999999 | G70: =J70*1.25 -> 772893.09342731722 | H70: =G70*F70 -> 2777777.777777778 | I70: =0.05*K70 -> 416666.66666666674 | J70: =D70/C70/0.45/E70 -> 618314.47474185377 | K70: =E70*J70*0.45 -> 8333333.333333334 | L70: =C70*K70 -> 1000000 | M70: =IF((C70*K70)-D70<=0,0,(C70*K70)-D70) -> 0 | N70: =K70*0.2 -> 1666666.666666667 | O70: =K70-D70-H70-I70-M70-N70 -> 2472222.222222222 | P70: =O70/K70 -> 0.29666666666666663
A71: Hardcover | B71: MYSTERY/SUSPENSE | C71: 0.12 | D71: 250000 | E71: 27.95 | F71: =E71*0.12 -> 3.3539999999999996 | G71: =J71*1.25 -> 207049.62565427681 | H71: =G71*F71 -> 694444.44444444438 | I71: =0.05*K71 -> 104166.66666666669 | J71: =D71/C71/0.45/E71 -> 165639.70052342146 | K71: =E71*J71*0.45 -> 2083333.3333333335 | L71: =C71*K71 -> 250000 | M71: =IF((C71*K71)-D71<=0,0,(C71*K71)-D71) -> 0 | N71: =K71*0.2 -> 416666.66666666674 | O71: =K71-D71-H71-I71-M71-N71 -> 618055.5555555555 | P71: =O71/K71 -> 0.29666666666666663
A72: Hardcover | B72: MYSTERY/SUSPENSE | C72: 0.12 | D72: 250000 | E72: 24.95 | F72: =E72*0.12 -> 2.9939999999999998 | G72: =J72*1.25 -> 231945.37222593336 | H72: =G72*F72 -> 694444.44444444438 | I72: =0.05*K72 -> 104166.66666666669 | J72: =D72/C72/0.45/E72 -> 185556.29778074668 | K72: =E72*J72*0.45 -> 2083333.3333333335 | L72: =C72*K72 -> 250000 | M72: =IF((C72*K72)-D72<=0,0,(C72*K72)-D72) -> 0 | N72: =K72*0.2 -> 416666.66666666674 | O72: =K72-D72-H72-I72-M72-N72 -> 618055.5555555555 | P72: =O72/K72 -> 0.29666666666666663
A73: Hardcover | B73: MYSTERY/SUSPENSE | C73: 0.12 | D73: 100000 | E73: 29.95 | F73: =E73*0.12 -> 3.5939999999999999 | G73: =J73*1.25 -> 77289.309342731722 | H73: =G73*F73 -> 277777.77777777781 | I73: =0.05*K73 -> 41666.666666666672 | J73: =D73/C73/0.45/E73 -> 61831.447474185377 | K73: =E73*J73*0.45 -> 833333.33333333337 | L73: =C73*K73 -> 100000 | M73: =IF((C73*K73)-D73<=0,0,(C73*K73)-D73) -> 0 | N73: =K73*0.2 -> 166666.66666666669 | O73: =K73-D73-H73-I73-M73-N73 -> 247222.22222222219 | P73: =O73/K73 -> 0.29666666666666663
A74: Hardcover | B74: MYSTERY/SUSPENSE | C74: 0.12 | D74: 100000 | E74: 27.95 | F74: =E74*0.12 -> 3.3539999999999996 | G74: =J74*1.25 -> 82819.85026171073 | H74: =G74*F74 -> 277777.77777777775 | I74: =0.05*K74 -> 41666.666666666664 | J74: =D74/C74/0.45/E74 -> 66255.880209368581 | K74: =E74*J74*0.45 -> 833333.33333333326 | L74: =C74*K74 -> 100000 | M74: =IF((C74*K74)-D74<=0,0,(C74*K74)-D74) -> 0 | N74: =K74*0.2 -> 166666.66666666666 | O74: =K74-D74-H74-I74-M74-N74 -> 247222.22222222216 | P74: =O74/K74 -> 0.29666666666666663
A75: Hardcover | B75: MYSTERY/SUSPENSE | C75: 0.12 | D75: 100000 | E75: 24.95 | F75: =E75*0.12 -> 2.9939999999999998 | G75: =J75*1.25 -> 92778.148890373341 | H75: =G75*F75 -> 277777.77777777775 | I75: =0.05*K75 -> 41666.666666666672 | J75: =D75/C75/0.45/E75 -> 74222.519112298673 | K75: =E75*J75*0.45 -> 833333.33333333337 | L75: =C75*K75 -> 100000 | M75: =IF((C75*K75)-D75<=0,0,(C75*K75)-D75) -> 0 | N75: =K75*0.2 -> 166666.66666666669 | O75: =K75-D75-H75-I75-M75-N75 -> 247222.22222222225 | P75: =O75/K75 -> 0.29666666666666669
A76: Hardcover | B76: MYSTERY/SUSPENSE | C76: 0.12 | D76: 75000 | E76: 24.95 | F76: =E76*0.12 -> 2.9939999999999998 | G76: =J76*1.25 -> 69583.611667780002 | H76: =G76*F76 -> 208333.33333333331 | I76: =0.05*K76 -> 31250 | J76: =D76/C76/0.45/E76 -> 55666.889334223997 | K76: =E76*J76*0.45 -> 625000 | L76: =C76*K76 -> 75000 | M76: =IF((C76*K76)-D76<=0,0,(C76*K76)-D76) -> 0 | N76: =K76*0.2 -> 125000 | O76: =K76-D76-H76-I76-M76-N76 -> 185416.66666666669 | P76: =O76/K76 -> 0.29666666666666669
A77: Hardcover | B77: MYSTERY/SUSPENSE | C77: 0.12 | D77: 50000 | E77: 21.95 | F77: =E77*0.12 -> 2.6339999999999999 | G77: =J77*1.25 -> 52729.266852273686 | H77: =G77*F77 -> 138888.88888888888 | I77: =0.05*K77 -> 20833.333333333332 | J77: =D77/C77/0.45/E77 -> 42183.413481818949 | K77: =E77*J77*0.45 -> 416666.66666666663 | L77: =C77*K77 -> 50000 | M77: =IF((C77*K77)-D77<=0,0,(C77*K77)-D77) -> 0 | N77: =K77*0.2 -> 83333.333333333328 | O77: =K77-D77-H77-I77-M77-N77 -> 123611.11111111108 | P77: =O77/K77 -> 0.29666666666666663
A78: Hardcover | B78: MYSTERY/SUSPENSE | C78: 0.12 | D78: 50000 | E78: 27.95 | F78: =E78*0.12 -> 3.3539999999999996 | G78: =J78*1.25 -> 41409.925130855365 | H78: =G78*F78 -> 138888.88888888888 | I78: =0.05*K78 -> 20833.333333333332 | J78: =D78/C78/0.45/E78 -> 33127.94010468429 | K78: =E78*J78*0.45 -> 416666.66666666663 | L78: =C78*K78 -> 50000 | M78: =IF((C78*K78)-D78<=0,0,(C78*K78)-D78) -> 0 | N78: =K78*0.2 -> 83333.333333333328 | O78: =K78-D78-H78-I78-M78-N78 -> 123611.11111111108 | P78: =O78/K78 -> 0.29666666666666663
A79: Hardcover | B79: MYSTERY/SUSPENSE | C79: 0.12 | D79: 25000 | E79: 24.95 | F79: =E79*0.12 -> 2.9939999999999998 | G79: =J79*1.25 -> 23194.537222593335 | H79: =G79*F79 -> 69444.444444444438 | I79: =0.05*K79 -> 10416.666666666668 | J79: =D79/C79/0.45/E79 -> 18555.629778074668 | K79: =E79*J79*0.45 -> 208333.33333333334 | L79: =C79*K79 -> 25000 | M79: =IF((C79*K79)-D79<=0,0,(C79*K79)-D79) -> 0 | N79: =K79*0.2 -> 41666.666666666672 | O79: =K79-D79-H79-I79-M79-N79 -> 61805.555555555562 | P79: =O79/K79 -> 0.29666666666666669
A80: Hardcover | B80: MYSTERY/SUSPENSE | C80: 0.12 | D80: 25000 | E80: 24.95 | F80: =E80*0.12 -> 2.9939999999999998 | G80: =J80*1.25 -> 23194.537222593335 | H80: =G80*F80 -> 69444.444444444438 | I80: =0.05*K80 -> 10416.666666666668 | J80: =D80/C80/0.45/E80 -> 18555.629778074668 | K80: =E80*J80*0.45 -> 208333.33333333334 | L80: =C80*K80 -> 25000 | M80: =IF((C80*K80)-D80<=0,0,(C80*K80)-D80) -> 0 | N80: =K80*0.2 -> 41666.666666666672 | O80: =K80-D80-H80-I80-M80-N80 -> 61805.555555555562 | P80: =O80/K80 -> 0.29666666666666669
A81: Hardcover | B81: MYSTERY/SUSPENSE | C81: 0.12 | D81: 25000 | E81: 29.95 | F81: =E81*0.12 -> 3.5939999999999999 | G81: =J81*1.25 -> 19322.32733568293 | H81: =G81*F81 -> 69444.444444444453 | I81: =0.05*K81 -> 10416.666666666668 | J81: =D81/C81/0.45/E81 -> 15457.861868546344 | K81: =E81*J81*0.45 -> 208333.33333333334 | L81: =C81*K81 -> 25000 | M81: =IF((C81*K81)-D81<=0,0,(C81*K81)-D81) -> 0 | N81: =K81*0.2 -> 41666.666666666672 | O81: =K81-D81-H81-I81-M81-N81 -> 61805.555555555547 | P81: =O81/K81 -> 0.29666666666666663
A82: Hardcover | B82: MYSTERY/SUSPENSE | C82: 0.12 | D82: 10000 | E82: 29.95 | F82: =E82*0.12 -> 3.5939999999999999 | G82: =J82*1.25 -> 7728.9309342731722 | H82: =G82*F82 -> 27777.777777777781 | I82: =0.05*K82 -> 4166.666666666667 | J82: =D82/C82/0.45/E82 -> 6183.1447474185379 | K82: =E82*J82*0.45 -> 83333.333333333343 | L82: =C82*K82 -> 10000 | M82: =IF((C82*K82)-D82<=0,0,(C82*K82)-D82) -> 0 | N82: =K82*0.2 -> 16666.666666666668 | O82: =K82-D82-H82-I82-M82-N82 -> 24722.22222222223 | P82: =O82/K82 -> 0.29666666666666675
A83: Hardcover | B83: MYSTERY/SUSPENSE | C83: 0.12 | D83: 10000 | E83: 27.95 | F83: =E83*0.12 -> 3.3539999999999996 | G83: =J83*1.25 -> 8281.9850261710744 | H83: =G83*F83 -> 27777.777777777781 | I83: =0.05*K83 -> 4166.666666666667 | J83: =D83/C83/0.45/E83 -> 6625.5880209368588 | K83: =E83*J83*0.45 -> 83333.333333333343 | L83: =C83*K83 -> 10000 | M83: =IF((C83*K83)-D83<=0,0,(C83*K83)-D83) -> 0 | N83: =K83*0.2 -> 16666.666666666668 | O83: =K83-D83-H83-I83-M83-N83 -> 24722.22222222223 | P83: =O83/K83 -> 0.29666666666666675
A84: Hardcover | B84: MYSTERY/SUSPENSE | C84: 0.12 | D84: 10000 | E84: 24.95 | F84: =E84*0.12 -> 2.9939999999999998 | G84: =J84*1.25 -> 9277.8148890373341 | H84: =G84*F84 -> 27777.777777777777 | I84: =0.05*K84 -> 4166.666666666667 | J84: =D84/C84/0.45/E84 -> 7422.2519112298678 | K84: =E84*J84*0.45 -> 83333.333333333343 | L84: =C84*K84 -> 10000 | M84: =IF((C84*K84)-D84<=0,0,(C84*K84)-D84) -> 0 | N84: =K84*0.2 -> 16666.666666666668 | O84: =K84-D84-H84-I84-M84-N84 -> 24722.22222222223 | P84: =O84/K84 -> 0.29666666666666675
A85: Hardcover | B85: MYSTERY/SUSPENSE | C85: 0.12 | D85: 10000 | E85: 24.95 | F85: =E85*0.12 -> 2.9939999999999998 | G85: =J85*1.25 -> 9277.8148890373341 | H85: =G85*F85 -> 27777.777777777777 | I85: =0.05*K85 -> 4166.666666666667 | J85: =D85/C85/0.45/E85 -> 7422.2519112298678 | K85: =E85*J85*0.45 -> 83333.333333333343 | L85: =C85*K85 -> 10000 | M85: =IF((C85*K85)-D85<=0,0,(C85*K85)-D85) -> 0 | N85: =K85*0.2 -> 16666.666666666668 | O85: =K85-D85-H85-I85-M85-N85 -> 24722.22222222223 | P85: =O85/K85 -> 0.29666666666666675
A86: Hardcover | B86: MYSTERY/SUSPENSE | C86: 0.12 | D86: 10000 | E86: 24.95 | F86: =E86*0.12 -> 2.9939999999999998 | G86: =J86*1.25 -> 9277.8148890373341 | H86: =G86*F86 -> 27777.777777777777 | I86: =0.05*K86 -> 4166.666666666667 | J86: =D86/C86/0.45/E86 -> 7422.2519112298678 | K86: =E86*J86*0.45 -> 83333.333333333343 | L86: =C86*K86 -> 10000 | M86: =IF((C86*K86)-D86<=0,0,(C86*K86)-D86) -> 0 | N86: =K86*0.2 -> 16666.666666666668 | O86: =K86-D86-H86-I86-M86-N86 -> 24722.22222222223 | P86: =O86/K86 -> 0.29666666666666675
A87: Hardcover | B87: MYSTERY/SUSPENSE | C87: 0.12 | D87: 10000 | E87: 21.95 | F87: =E87*0.12 -> 2.6339999999999999 | G87: =J87*1.25 -> 10545.853370454737 | H87: =G87*F87 -> 27777.777777777777 | I87: =0.05*K87 -> 4166.666666666667 | J87: =D87/C87/0.45/E87 -> 8436.6826963637905 | K87: =E87*J87*0.45 -> 83333.333333333343 | L87: =C87*K87 -> 10000 | M87: =IF((C87*K87)-D87<=0,0,(C87*K87)-D87) -> 0 | N87: =K87*0.2 -> 16666.666666666668 | O87: =K87-D87-H87-I87-M87-N87 -> 24722.22222222223 | P87: =O87/K87 -> 0.29666666666666675
A88: Hardcover | B88: MYSTERY/SUSPENSE | C88: 0.12 | D88: 5000 | E88: 24.95 | F88: =E88*0.12 -> 2.9939999999999998 | G88: =J88*1.25 -> 4638.907444518667 | H88: =G88*F88 -> 13888.888888888889 | I88: =0.05*K88 -> 2083.3333333333335 | J88: =D88/C88/0.45/E88 -> 3711.1259556149339 | K88: =E88*J88*0.45 -> 41666.666666666672 | L88: =C88*K88 -> 5000 | M88: =IF((C88*K88)-D88<=0,0,(C88*K88)-D88) -> 0 | N88: =K88*0.2 -> 8333.3333333333339 | O88: =K88-D88-H88-I88-M88-N88 -> 12361.111111111115 | P88: =O88/K88 -> 0.29666666666666675
A89: Hardcover | B89: MYSTERY/SUSPENSE | C89: 0.12 | D89: 5000 | E89: 24.95 | F89: =E89*0.12 -> 2.9939999999999998 | G89: =J89*1.25 -> 4638.907444518667 | H89: =G89*F89 -> 13888.888888888889 | I89: =0.05*K89 -> 2083.3333333333335 | J89: =D89/C89/0.45/E89 -> 3711.1259556149339 | K89: =E89*J89*0.45 -> 41666.666666666672 | L89: =C89*K89 -> 5000 | M89: =IF((C89*K89)-D89<=0,0,(C89*K89)-D89) -> 0 | N89: =K89*0.2 -> 8333.3333333333339 | O89: =K89-D89-H89-I89-M89-N89 -> 12361.111111111115 | P89: =O89/K89 -> 0.29666666666666675
A90: Hardcover | B90: MYSTERY/SUSPENSE | C90: 0.12 | D90: 5000 | E90: 21.95 | F90: =E90*0.12 -> 2.6339999999999999 | G90: =J90*1.25 -> 5272.9266852273686 | H90: =G90*F90 -> 13888.888888888889 | I90: =0.05*K90 -> 2083.3333333333335 | J90: =D90/C90/0.45/E90 -> 4218.3413481818952 | K90: =E90*J90*0.45 -> 41666.666666666672 | L90: =C90*K90 -> 5000 | M90: =IF((C90*K90)-D90<=0,0,(C90*K90)-D90) -> 0 | N90: =K90*0.2 -> 8333.3333333333339 | O90: =K90-D90-H90-I90-M90-N90 -> 12361.111111111115 | P90: =O90/K90 -> 0.29666666666666675
A91: Trade Paper Original | B91: MYSTERY/SUSPENSE | C91: 0.12 | D91: 25000 | E91: 16.95 | F91: =E91*0.12 -> 2.0339999999999998 | G91: =J91*1.25 -> 34141.811427947119 | H91: =G91*F91 -> 69444.444444444438 | I91: =0.05*K91 -> 10416.666666666668 | J91: =D91/C91/0.45/E91 -> 27313.449142357698 | K91: =E91*J91*0.45 -> 208333.33333333334 | L91: =C91*K91 -> 25000 | M91: =IF((C91*K91)-D91<=0,0,(C91*K91)-D91) -> 0 | N91: =K91*0.2 -> 41666.666666666672 | O91: =K91-D91-H91-I91-M91-N91 -> 61805.555555555562 | P91: =O91/K91 -> 0.29666666666666669
A92: Trade Paper Original | B92: MYSTERY/SUSPENSE | C92: 0.12 | D92: 10000 | E92: 16.95 | F92: =E92*0.12 -> 2.0339999999999998 | G92: =J92*1.25 -> 13656.724571178849 | H92: =G92*F92 -> 27777.777777777777 | I92: =0.05*K92 -> 4166.666666666667 | J92: =D92/C92/0.45/E92 -> 10925.37965694308 | K92: =E92*J92*0.45 -> 83333.333333333343 | L92: =C92*K92 -> 10000 | M92: =IF((C92*K92)-D92<=0,0,(C92*K92)-D92) -> 0 | N92: =K92*0.2 -> 16666.666666666668 | O92: =K92-D92-H92-I92-M92-N92 -> 24722.22222222223 | P92: =O92/K92 -> 0.29666666666666675
A93: Trade Paper Original | B93: MYSTERY/SUSPENSE | C93: 0.12 | D93: 5000 | E93: 16.95 | F93: =E93*0.12 -> 2.0339999999999998 | G93: =J93*1.25 -> 6828.3622855894246 | H93: =G93*F93 -> 13888.888888888889 | I93: =0.05*K93 -> 2083.3333333333335 | J93: =D93/C93/0.45/E93 -> 5462.6898284715398 | K93: =E93*J93*0.45 -> 41666.666666666672 | L93: =C93*K93 -> 5000 | M93: =IF((C93*K93)-D93<=0,0,(C93*K93)-D93) -> 0 | N93: =K93*0.2 -> 8333.3333333333339 | O93: =K93-D93-H93-I93-M93-N93 -> 12361.111111111115 | P93: =O93/K93 -> 0.29666666666666675
A94: PBR: Mass Market | B94: MYSTERY/SUSPENSE | C94: 0.12 | D94: 100000 | E94: 7.95 | F94: =E94*0.12 -> 0.95399999999999996 | G94: =J94*1.25 -> 291171.67481947353 | H94: =G94*F94 -> 277777.77777777775 | I94: =0.05*K94 -> 41666.666666666672 | J94: =D94/C94/0.45/E94 -> 232937.33985557884 | K94: =E94*J94*0.45 -> 833333.33333333337 | L94: =C94*K94 -> 100000 | M94: =IF((C94*K94)-D94<=0,0,(C94*K94)-D94) -> 0 | N94: =K94*0.2 -> 166666.66666666669 | O94: =K94-D94-H94-I94-M94-N94 -> 247222.22222222225 | P94: =O94/K94 -> 0.29666666666666669
A95: PBR: Mass Market | B95: MYSTERY/SUSPENSE | C95: 0.12 | D95: 100000 | E95: 7.95 | F95: =E95*0.12 -> 0.95399999999999996 | G95: =J95*1.25 -> 291171.67481947353 | H95: =G95*F95 -> 277777.77777777775 | I95: =0.05*K95 -> 41666.666666666672 | J95: =D95/C95/0.45/E95 -> 232937.33985557884 | K95: =E95*J95*0.45 -> 833333.33333333337 | L95: =C95*K95 -> 100000 | M95: =IF((C95*K95)-D95<=0,0,(C95*K95)-D95) -> 0 | N95: =K95*0.2 -> 166666.66666666669 | O95: =K95-D95-H95-I95-M95-N95 -> 247222.22222222225 | P95: =O95/K95 -> 0.29666666666666669
A96: PBR: Mass Market | B96: MYSTERY/SUSPENSE | C96: 0.12 | D96: 100000 | E96: 7.95 | F96: =E96*0.12 -> 0.95399999999999996 | G96: =J96*1.25 -> 291171.67481947353 | H96: =G96*F96 -> 277777.77777777775 | I96: =0.05*K96 -> 41666.666666666672 | J96: =D96/C96/0.45/E96 -> 232937.33985557884 | K96: =E96*J96*0.45 -> 833333.33333333337 | L96: =C96*K96 -> 100000 | M96: =IF((C96*K96)-D96<=0,0,(C96*K96)-D96) -> 0 | N96: =K96*0.2 -> 166666.66666666669 | O96: =K96-D96-H96-I96-M96-N96 -> 247222.22222222225 | P96: =O96/K96 -> 0.29666666666666669
A97: PBR: Mass Market | B97: MYSTERY/SUSPENSE | C97: 0.12 | D97: 100000 | E97: 7.95 | F97: =E97*0.12 -> 0.95399999999999996 | G97: =J97*1.25 -> 291171.67481947353 | H97: =G97*F97 -> 277777.77777777775 | I97: =0.05*K97 -> 41666.666666666672 | J97: =D97/C97/0.45/E97 -> 232937.33985557884 | K97: =E97*J97*0.45 -> 833333.33333333337 | L97: =C97*K97 -> 100000 | M97: =IF((C97*K97)-D97<=0,0,(C97*K97)-D97) -> 0 | N97: =K97*0.2 -> 166666.66666666669 | O97: =K97-D97-H97-I97-M97-N97 -> 247222.22222222225 | P97: =O97/K97 -> 0.29666666666666669
A98: PBR: Mass Market | B98: MYSTERY/SUSPENSE | C98: 0.12 | D98: 100000 | E98: 7.95 | F98: =E98*0.12 -> 0.95399999999999996 | G98: =J98*1.25 -> 291171.67481947353 | H98: =G98*F98 -> 277777.77777777775 | I98: =0.05*K98 -> 41666.666666666672 | J98: =D98/C98/0.45/E98 -> 232937.33985557884 | K98: =E98*J98*0.45 -> 833333.33333333337 | L98: =C98*K98 -> 100000 | M98: =IF((C98*K98)-D98<=0,0,(C98*K98)-D98) -> 0 | N98: =K98*0.2 -> 166666.66666666669 | O98: =K98-D98-H98-I98-M98-N98 -> 247222.22222222225 | P98: =O98/K98 -> 0.29666666666666669
A99: PBR: Mass Market | B99: MYSTERY/SUSPENSE | C99: 0.12 | D99: 25000 | E99: 7.95 | F99: =E99*0.12 -> 0.95399999999999996 | G99: =J99*1.25 -> 72792.918704868382 | H99: =G99*F99 -> 69444.444444444438 | I99: =0.05*K99 -> 10416.666666666668 | J99: =D99/C99/0.45/E99 -> 58234.334963894711 | K99: =E99*J99*0.45 -> 208333.33333333334 | L99: =C99*K99 -> 25000 | M99: =IF((C99*K99)-D99<=0,0,(C99*K99)-D99) -> 0 | N99: =K99*0.2 -> 41666.666666666672 | O99: =K99-D99-H99-I99-M99-N99 -> 61805.555555555562 | P99: =O99/K99 -> 0.29666666666666669
A100: PBR: Mass Market | B100: MYSTERY/SUSPENSE | C100: 0.12 | D100: 25000 | E100: 7.95 | F100: =E100*0.12 -> 0.95399999999999996 | G100: =J100*1.25 -> 72792.918704868382 | H100: =G100*F100 -> 69444.444444444438 | I100: =0.05*K100 -> 10416.666666666668 | J100: =D100/C100/0.45/E100 -> 58234.334963894711 | K100: =E100*J100*0.45 -> 208333.33333333334 | L100: =C100*K100 -> 25000 | M100: =IF((C100*K100)-D100<=0,0,(C100*K100)-D100) -> 0 | N100: =K100*0.2 -> 41666.666666666672 | O100: =K100-D100-H100-I100-M100-N100 -> 61805.555555555562 | P100: =O100/K100 -> 0.29666666666666669
A101: PBR: Mass Market | B101: MYSTERY/SUSPENSE | C101: 0.12 | D101: 25000 | E101: 7.95 | F101: =E101*0.12 -> 0.95399999999999996 | G101: =J101*1.25 -> 72792.918704868382 | H101: =G101*F101 -> 69444.444444444438 | I101: =0.05*K101 -> 10416.666666666668 | J101: =D101/C101/0.45/E101 -> 58234.334963894711 | K101: =E101*J101*0.45 -> 208333.33333333334 | L101: =C101*K101 -> 25000 | M101: =IF((C101*K101)-D101<=0,0,(C101*K101)-D101) -> 0 | N101: =K101*0.2 -> 41666.666666666672 | O101: =K101-D101-H101-I101-M101-N101 -> 61805.555555555562 | P101: =O101/K101 -> 0.29666666666666669
A102: PBR: Mass Market | B102: MYSTERY/SUSPENSE | C102: 0.12 | D102: 25000 | E102: 7.95 | F102: =E102*0.12 -> 0.95399999999999996 | G102: =J102*1.25 -> 72792.918704868382 | H102: =G102*F102 -> 69444.444444444438 | I102: =0.05*K102 -> 10416.666666666668 | J102: =D102/C102/0.45/E102 -> 58234.334963894711 | K102: =E102*J102*0.45 -> 208333.33333333334 | L102: =C102*K102 -> 25000 | M102: =IF((C102*K102)-D102<=0,0,(C102*K102)-D102) -> 0 | N102: =K102*0.2 -> 41666.666666666672 | O102: =K102-D102-H102-I102-M102-N102 -> 61805.555555555562 | P102: =O102/K102 -> 0.29666666666666669
A103: PBR: Trade Paper | B103: MYSTERY/SUSPENSE | C103: 0.12 | D103: 50000 | E103: 15.95 | F103: =E103*0.12 -> 1.9139999999999999 | G103: =J103*1.25 -> 72564.72773714154 | H103: =G103*F103 -> 138888.88888888891 | I103: =0.05*K103 -> 20833.333333333336 | J103: =D103/C103/0.45/E103 -> 58051.782189713231 | K103: =E103*J103*0.45 -> 416666.66666666669 | L103: =C103*K103 -> 50000 | M103: =IF((C103*K103)-D103<=0,0,(C103*K103)-D103) -> 0 | N103: =K103*0.2 -> 83333.333333333343 | O103: =K103-D103-H103-I103-M103-N103 -> 123611.11111111109 | P103: =O103/K103 -> 0.29666666666666663
A104: PBR: Trade Paper | B104: MYSTERY/SUSPENSE | C104: 0.12 | D104: 50000 | E104: 15.95 | F104: =E104*0.12 -> 1.9139999999999999 | G104: =J104*1.25 -> 72564.72773714154 | H104: =G104*F104 -> 138888.88888888891 | I104: =0.05*K104 -> 20833.333333333336 | J104: =D104/C104/0.45/E104 -> 58051.782189713231 | K104: =E104*J104*0.45 -> 416666.66666666669 | L104: =C104*K104 -> 50000 | M104: =IF((C104*K104)-D104<=0,0,(C104*K104)-D104) -> 0 | N104: =K104*0.2 -> 83333.333333333343 | O104: =K104-D104-H104-I104-M104-N104 -> 123611.11111111109 | P104: =O104/K104 -> 0.29666666666666663
A105: PBR: Trade Paper | B105: MYSTERY/SUSPENSE | C105: 0.12 | D105: 50000 | E105: 14.95 | F105: =E105*0.12 -> 1.7939999999999998 | G105: =J105*1.25 -> 77418.555679425248 | H105: =G105*F105 -> 138888.88888888888 | I105: =0.05*K105 -> 20833.333333333336 | J105: =D105/C105/0.45/E105 -> 61934.844543540203 | K105: =E105*J105*0.45 -> 416666.66666666669 | L105: =C105*K105 -> 50000 | M105: =IF((C105*K105)-D105<=0,0,(C105*K105)-D105) -> 0 | N105: =K105*0.2 -> 83333.333333333343 | O105: =K105-D105-H105-I105-M105-N105 -> 123611.11111111112 | P105: =O105/K105 -> 0.29666666666666669
A106: PBR: Trade Paper | B106: MYSTERY/SUSPENSE | C106: 0.12 | D106: 50000 | E106: 14.95 | F106: =E106*0.12 -> 1.7939999999999998 | G106: =J106*1.25 -> 77418.555679425248 | H106: =G106*F106 -> 138888.88888888888 | I106: =0.05*K106 -> 20833.333333333336 | J106: =D106/C106/0.45/E106 -> 61934.844543540203 | K106: =E106*J106*0.45 -> 416666.66666666669 | L106: =C106*K106 -> 50000 | M106: =IF((C106*K106)-D106<=0,0,(C106*K106)-D106) -> 0 | N106: =K106*0.2 -> 83333.333333333343 | O106: =K106-D106-H106-I106-M106-N106 -> 123611.11111111112 | P106: =O106/K106 -> 0.29666666666666669
A107: PBR: Trade Paper | B107: MYSTERY/SUSPENSE | C107: 0.12 | D107: 25000 | E107: 14.95 | F107: =E107*0.12 -> 1.7939999999999998 | G107: =J107*1.25 -> 38709.277839712624 | H107: =G107*F107 -> 69444.444444444438 | I107: =0.05*K107 -> 10416.666666666668 | J107: =D107/C107/0.45/E107 -> 30967.422271770101 | K107: =E107*J107*0.45 -> 208333.33333333334 | L107: =C107*K107 -> 25000 | M107: =IF((C107*K107)-D107<=0,0,(C107*K107)-D107) -> 0 | N107: =K107*0.2 -> 41666.666666666672 | O107: =K107-D107-H107-I107-M107-N107 -> 61805.555555555562 | P107: =O107/K107 -> 0.29666666666666669
A108: PBR: Trade Paper | B108: MYSTERY/SUSPENSE | C108: 0.12 | D108: 10000 | E108: 15.95 | F108: =E108*0.12 -> 1.9139999999999999 | G108: =J108*1.25 -> 14512.945547428308 | H108: =G108*F108 -> 27777.777777777781 | I108: =0.05*K108 -> 4166.666666666667 | J108: =D108/C108/0.45/E108 -> 11610.356437942646 | K108: =E108*J108*0.45 -> 83333.333333333343 | L108: =C108*K108 -> 10000 | M108: =IF((C108*K108)-D108<=0,0,(C108*K108)-D108) -> 0 | N108: =K108*0.2 -> 16666.666666666668 | O108: =K108-D108-H108-I108-M108-N108 -> 24722.22222222223 | P108: =O108/K108 -> 0.29666666666666675
A109: PBR: Trade Paper | B109: MYSTERY/SUSPENSE | C109: 0.12 | D109: 10000 | E109: 15.95 | F109: =E109*0.12 -> 1.9139999999999999 | G109: =J109*1.25 -> 14512.945547428308 | H109: =G109*F109 -> 27777.777777777781 | I109: =0.05*K109 -> 4166.666666666667 | J109: =D109/C109/0.45/E109 -> 11610.356437942646 | K109: =E109*J109*0.45 -> 83333.333333333343 | L109: =C109*K109 -> 10000 | M109: =IF((C109*K109)-D109<=0,0,(C109*K109)-D109) -> 0 | N109: =K109*0.2 -> 16666.666666666668 | O109: =K109-D109-H109-I109-M109-N109 -> 24722.22222222223 | P109: =O109/K109 -> 0.29666666666666675
A110: Hardcover | B110: SF/FANTASY | C110: 0.12 | D110: 500000 | E110: 24.95 | F110: =E110*0.12 -> 2.9939999999999998 | G110: =J110*1.25 -> 463890.74445186672 | H110: =G110*F110 -> 1388888.8888888888 | I110: =0.05*K110 -> 208333.33333333337 | J110: =D110/C110/0.45/E110 -> 371112.59556149336 | K110: =E110*J110*0.45 -> 4166666.666666667 | L110: =C110*K110 -> 500000 | M110: =IF((C110*K110)-D110<=0,0,(C110*K110)-D110) -> 0 | N110: =K110*0.2 -> 833333.33333333349 | O110: =K110-D110-H110-I110-M110-N110 -> 1236111.111111111 | P110: =O110/K110 -> 0.29666666666666663
A111: Hardcover | B111: SF/FANTASY | C111: 0.12 | D111: 250000 | E111: 29.95 | F111: =E111*0.12 -> 3.5939999999999999 | G111: =J111*1.25 -> 193223.2733568293 | H111: =G111*F111 -> 694444.4444444445 | I111: =0.05*K111 -> 104166.66666666669 | J111: =D111/C111/0.45/E111 -> 154578.61868546344 | K111: =E111*J111*0.45 -> 2083333.3333333335 | L111: =C111*K111 -> 250000 | M111: =IF((C111*K111)-D111<=0,0,(C111*K111)-D111) -> 0 | N111: =K111*0.2 -> 416666.66666666674 | O111: =K111-D111-H111-I111-M111-N111 -> 618055.5555555555 | P111: =O111/K111 -> 0.29666666666666663
A112: Hardcover | B112: SF/FANTASY | C112: 0.12 | D112: 100000 | E112: 27.95 | F112: =E112*0.12 -> 3.3539999999999996 | G112: =J112*1.25 -> 82819.85026171073 | H112: =G112*F112 -> 277777.77777777775 | I112: =0.05*K112 -> 41666.666666666664 | J112: =D112/C112/0.45/E112 -> 66255.880209368581 | K112: =E112*J112*0.45 -> 833333.33333333326 | L112: =C112*K112 -> 100000 | M112: =IF((C112*K112)-D112<=0,0,(C112*K112)-D112) -> 0 | N112: =K112*0.2 -> 166666.66666666666 | O112: =K112-D112-H112-I112-M112-N112 -> 247222.22222222216 | P112: =O112/K112 -> 0.29666666666666663
A113: Hardcover | B113: SF/FANTASY | C113: 0.12 | D113: 100000 | E113: 27.95 | F113: =E113*0.12 -> 3.3539999999999996 | G113: =J113*1.25 -> 82819.85026171073 | H113: =G113*F113 -> 277777.77777777775 | I113: =0.05*K113 -> 41666.666666666664 | J113: =D113/C113/0.45/E113 -> 66255.880209368581 | K113: =E113*J113*0.45 -> 833333.33333333326 | L113: =C113*K113 -> 100000 | M113: =IF((C113*K113)-D113<=0,0,(C113*K113)-D113) -> 0 | N113: =K113*0.2 -> 166666.66666666666 | O113: =K113-D113-H113-I113-M113-N113 -> 247222.22222222216 | P113: =O113/K113 -> 0.29666666666666663
A114: Hardcover | B114: SF/FANTASY | C114: 0.12 | D114: 100000 | E114: 21.95 | F114: =E114*0.12 -> 2.6339999999999999 | G114: =J114*1.25 -> 105458.53370454737 | H114: =G114*F114 -> 277777.77777777775 | I114: =0.05*K114 -> 41666.666666666664 | J114: =D114/C114/0.45/E114 -> 84366.826963637897 | K114: =E114*J114*0.45 -> 833333.33333333326 | L114: =C114*K114 -> 100000 | M114: =IF((C114*K114)-D114<=0,0,(C114*K114)-D114) -> 0 | N114: =K114*0.2 -> 166666.66666666666 | O114: =K114-D114-H114-I114-M114-N114 -> 247222.22222222216 | P114: =O114/K114 -> 0.29666666666666663
A115: Hardcover | B115: SF/FANTASY | C115: 0.12 | D115: 75000 | E115: 29.95 | F115: =E115*0.12 -> 3.5939999999999999 | G115: =J115*1.25 -> 57966.982007048784 | H115: =G115*F115 -> 208333.33333333331 | I115: =0.05*K115 -> 31250 | J115: =D115/C115/0.45/E115 -> 46373.585605639026 | K115: =E115*J115*0.45 -> 625000 | L115: =C115*K115 -> 75000 | M115: =IF((C115*K115)-D115<=0,0,(C115*K115)-D115) -> 0 | N115: =K115*0.2 -> 125000 | O115: =K115-D115-H115-I115-M115-N115 -> 185416.66666666669 | P115: =O115/K115 -> 0.29666666666666669
A116: Hardcover | B116: SF/FANTASY | C116: 0.12 | D116: 50000 | E116: 29.95 | F116: =E116*0.12 -> 3.5939999999999999 | G116: =J116*1.25 -> 38644.654671365861 | H116: =G116*F116 -> 138888.88888888891 | I116: =0.05*K116 -> 20833.333333333336 | J116: =D116/C116/0.45/E116 -> 30915.723737092689 | K116: =E116*J116*0.45 -> 416666.66666666669 | L116: =C116*K116 -> 50000 | M116: =IF((C116*K116)-D116<=0,0,(C116*K116)-D116) -> 0 | N116: =K116*0.2 -> 83333.333333333343 | O116: =K116-D116-H116-I116-M116-N116 -> 123611.11111111109 | P116: =O116/K116 -> 0.29666666666666663
A117: Hardcover | B117: SF/FANTASY | C117: 0.12 | D117: 50000 | E117: 24.95 | F117: =E117*0.12 -> 2.9939999999999998 | G117: =J117*1.25 -> 46389.07444518667 | H117: =G117*F117 -> 138888.88888888888 | I117: =0.05*K117 -> 20833.333333333336 | J117: =D117/C117/0.45/E117 -> 37111.259556149336 | K117: =E117*J117*0.45 -> 416666.66666666669 | L117: =C117*K117 -> 50000 | M117: =IF((C117*K117)-D117<=0,0,(C117*K117)-D117) -> 0 | N117: =K117*0.2 -> 83333.333333333343 | O117: =K117-D117-H117-I117-M117-N117 -> 123611.11111111112 | P117: =O117/K117 -> 0.29666666666666669
A118: Hardcover | B118: SF/FANTASY | C118: 0.12 | D118: 25000 | E118: 24.95 | F118: =E118*0.12 -> 2.9939999999999998 | G118: =J118*1.25 -> 23194.537222593335 | H118: =G118*F118 -> 69444.444444444438 | I118: =0.05*K118 -> 10416.666666666668 | J118: =D118/C118/0.45/E118 -> 18555.629778074668 | K118: =E118*J118*0.45 -> 208333.33333333334 | L118: =C118*K118 -> 25000 | M118: =IF((C118*K118)-D118<=0,0,(C118*K118)-D118) -> 0 | N118: =K118*0.2 -> 41666.666666666672 | O118: =K118-D118-H118-I118-M118-N118 -> 61805.555555555562 | P118: =O118/K118 -> 0.29666666666666669
A119: Hardcover | B119: SF/FANTASY | C119: 0.12 | D119: 25000 | E119: 24.95 | F119: =E119*0.12 -> 2.9939999999999998 | G119: =J119*1.25 -> 23194.537222593335 | H119: =G119*F119 -> 69444.444444444438 | I119: =0.05*K119 -> 10416.666666666668 | J119: =D119/C119/0.45/E119 -> 18555.629778074668 | K119: =E119*J119*0.45 -> 208333.33333333334 | L119: =C119*K119 -> 25000 | M119: =IF((C119*K119)-D119<=0,0,(C119*K119)-D119) -> 0 | N119: =K119*0.2 -> 41666.666666666672 | O119: =K119-D119-H119-I119-M119-N119 -> 61805.555555555562 | P119: =O119/K119 -> 0.29666666666666669
A120: Hardcover | B120: SF/FANTASY | C120: 0.12 | D120: 25000 | E120: 24.95 | F120: =E120*0.12 -> 2.9939999999999998 | G120: =J120*1.25 -> 23194.537222593335 | H120: =G120*F120 -> 69444.444444444438 | I120: =0.05*K120 -> 10416.666666666668 | J120: =D120/C120/0.45/E120 -> 18555.629778074668 | K120: =E120*J120*0.45 -> 208333.33333333334 | L120: =C120*K120 -> 25000 | M120: =IF((C120*K120)-D120<=0,0,(C120*K120)-D120) -> 0 | N120: =K120*0.2 -> 41666.666666666672 | O120: =K120-D120-H120-I120-M120-N120 -> 61805.555555555562 | P120: =O120/K120 -> 0.29666666666666669
A121: Hardcover | B121: SF/FANTASY | C121: 0.12 | D121: 25000 | E121: 21.95 | F121: =E121*0.12 -> 2.6339999999999999 | G121: =J121*1.25 -> 26364.633426136843 | H121: =G121*F121 -> 69444.444444444438 | I121: =0.05*K121 -> 10416.666666666666 | J121: =D121/C121/0.45/E121 -> 21091.706740909474 | K121: =E121*J121*0.45 -> 208333.33333333331 | L121: =C121*K121 -> 25000 | M121: =IF((C121*K121)-D121<=0,0,(C121*K121)-D121) -> 0 | N121: =K121*0.2 -> 41666.666666666664 | O121: =K121-D121-H121-I121-M121-N121 -> 61805.55555555554 | P121: =O121/K121 -> 0.29666666666666663
A122: Hardcover | B122: SF/FANTASY | C122: 0.12 | D122: 25000 | E122: 21.95 | F122: =E122*0.12 -> 2.6339999999999999 | G122: =J122*1.25 -> 26364.633426136843 | H122: =G122*F122 -> 69444.444444444438 | I122: =0.05*K122 -> 10416.666666666666 | J122: =D122/C122/0.45/E122 -> 21091.706740909474 | K122: =E122*J122*0.45 -> 208333.33333333331 | L122: =C122*K122 -> 25000 | M122: =IF((C122*K122)-D122<=0,0,(C122*K122)-D122) -> 0 | N122: =K122*0.2 -> 41666.666666666664 | O122: =K122-D122-H122-I122-M122-N122 -> 61805.55555555554 | P122: =O122/K122 -> 0.29666666666666663
A123: Hardcover | B123: SF/FANTASY | C123: 0.12 | D123: 10000 | E123: 21.95 | F123: =E123*0.12 -> 2.6339999999999999 | G123: =J123*1.25 -> 10545.853370454737 | H123: =G123*F123 -> 27777.777777777777 | I123: =0.05*K123 -> 4166.666666666667 | J123: =D123/C123/0.45/E123 -> 8436.6826963637905 | K123: =E123*J123*0.45 -> 83333.333333333343 | L123: =C123*K123 -> 10000 | M123: =IF((C123*K123)-D123<=0,0,(C123*K123)-D123) -> 0 | N123: =K123*0.2 -> 16666.666666666668 | O123: =K123-D123-H123-I123-M123-N123 -> 24722.22222222223 | P123: =O123/K123 -> 0.29666666666666675
A124: Hardcover | B124: SF/FANTASY | C124: 0.12 | D124: 10000 | E124: 21.95 | F124: =E124*0.12 -> 2.6339999999999999 | G124: =J124*1.25 -> 10545.853370454737 | H124: =G124*F124 -> 27777.777777777777 | I124: =0.05*K124 -> 4166.666666666667 | J124: =D124/C124/0.45/E124 -> 8436.6826963637905 | K124: =E124*J124*0.45 -> 83333.333333333343 | L124: =C124*K124 -> 10000 | M124: =IF((C124*K124)-D124<=0,0,(C124*K124)-D124) -> 0 | N124: =K124*0.2 -> 16666.666666666668 | O124: =K124-D124-H124-I124-M124-N124 -> 24722.22222222223 | P124: =O124/K124 -> 0.29666666666666675
A125: Hardcover | B125: SF/FANTASY | C125: 0.12 | D125: 10000 | E125: 21.95 | F125: =E125*0.12 -> 2.6339999999999999 | G125: =J125*1.25 -> 10545.853370454737 | H125: =G125*F125 -> 27777.777777777777 | I125: =0.05*K125 -> 4166.666666666667 | J125: =D125/C125/0.45/E125 -> 8436.6826963637905 | K125: =E125*J125*0.45 -> 83333.333333333343 | L125: =C125*K125 -> 10000 | M125: =IF((C125*K125)-D125<=0,0,(C125*K125)-D125) -> 0 | N125: =K125*0.2 -> 16666.666666666668 | O125: =K125-D125-H125-I125-M125-N125 -> 24722.22222222223 | P125: =O125/K125 -> 0.29666666666666675
A126: Hardcover | B126: SF/FANTASY | C126: 0.12 | D126: 5000 | E126: 21.95 | F126: =E126*0.12 -> 2.6339999999999999 | G126: =J126*1.25 -> 5272.9266852273686 | H126: =G126*F126 -> 13888.888888888889 | I126: =0.05*K126 -> 2083.3333333333335 | J126: =D126/C126/0.45/E126 -> 4218.3413481818952 | K126: =E126*J126*0.45 -> 41666.666666666672 | L126: =C126*K126 -> 5000 | M126: =IF((C126*K126)-D126<=0,0,(C126*K126)-D126) -> 0 | N126: =K126*0.2 -> 8333.3333333333339 | O126: =K126-D126-H126-I126-M126-N126 -> 12361.111111111115 | P126: =O126/K126 -> 0.29666666666666675
A127: Hardcover | B127: SF/FANTASY | C127: 0.12 | D127: 5000 | E127: 21.95 | F127: =E127*0.12 -> 2.6339999999999999 | G127: =J127*1.25 -> 5272.9266852273686 | H127: =G127*F127 -> 13888.888888888889 | I127: =0.05*K127 -> 2083.3333333333335 | J127: =D127/C127/0.45/E127 -> 4218.3413481818952 | K127: =E127*J127*0.45 -> 41666.666666666672 | L127: =C127*K127 -> 5000 | M127: =IF((C127*K127)-D127<=0,0,(C127*K127)-D127) -> 0 | N127: =K127*0.2 -> 8333.3333333333339 | O127: =K127-D127-H127-I127-M127-N127 -> 12361.111111111115 | P127: =O127/K127 -> 0.29666666666666675
A128: Trade Paper Original | B128: SF/FANTASY | C128: 0.12 | D128: 25000 | E128: 16.95 | F128: =E128*0.12 -> 2.0339999999999998 | G128: =J128*1.25 -> 34141.811427947119 | H128: =G128*F128 -> 69444.444444444438 | I128: =0.05*K128 -> 10416.666666666668 | J128: =D128/C128/0.45/E128 -> 27313.449142357698 | K128: =E128*J128*0.45 -> 208333.33333333334 | L128: =C128*K128 -> 25000 | M128: =IF((C128*K128)-D128<=0,0,(C128*K128)-D128) -> 0 | N128: =K128*0.2 -> 41666.666666666672 | O128: =K128-D128-H128-I128-M128-N128 -> 61805.555555555562 | P128: =O128/K128 -> 0.29666666666666669
A129: Trade Paper Original | B129: SF/FANTASY | C129: 0.12 | D129: 10000 | E129: 16.95 | F129: =E129*0.12 -> 2.0339999999999998 | G129: =J129*1.25 -> 13656.724571178849 | H129: =G129*F129 -> 27777.777777777777 | I129: =0.05*K129 -> 4166.666666666667 | J129: =D129/C129/0.45/E129 -> 10925.37965694308 | K129: =E129*J129*0.45 -> 83333.333333333343 | L129: =C129*K129 -> 10000 | M129: =IF((C129*K129)-D129<=0,0,(C129*K129)-D129) -> 0 | N129: =K129*0.2 -> 16666.666666666668 | O129: =K129-D129-H129-I129-M129-N129 -> 24722.22222222223 | P129: =O129/K129 -> 0.29666666666666675
A130: PBR: Mass Market | B130: SF/FANTASY | C130: 0.12 | D130: 100000 | E130: 7.95 | F130: =E130*0.12 -> 0.95399999999999996 | G130: =J130*1.25 -> 291171.67481947353 | H130: =G130*F130 -> 277777.77777777775 | I130: =0.05*K130 -> 41666.666666666672 | J130: =D130/C130/0.45/E130 -> 232937.33985557884 | K130: =E130*J130*0.45 -> 833333.33333333337 | L130: =C130*K130 -> 100000 | M130: =IF((C130*K130)-D130<=0,0,(C130*K130)-D130) -> 0 | N130: =K130*0.2 -> 166666.66666666669 | O130: =K130-D130-H130-I130-M130-N130 -> 247222.22222222225 | P130: =O130/K130 -> 0.29666666666666669
A131: PBR: Mass Market | B131: SF/FANTASY | C131: 0.12 | D131: 75000 | E131: 7.95 | F131: =E131*0.12 -> 0.95399999999999996 | G131: =J131*1.25 -> 218378.75611460512 | H131: =G131*F131 -> 208333.33333333328 | I131: =0.05*K131 -> 31250 | J131: =D131/C131/0.45/E131 -> 174703.0048916841 | K131: =E131*J131*0.45 -> 625000 | L131: =C131*K131 -> 75000 | M131: =IF((C131*K131)-D131<=0,0,(C131*K131)-D131) -> 0 | N131: =K131*0.2 -> 125000 | O131: =K131-D131-H131-I131-M131-N131 -> 185416.66666666674 | P131: =O131/K131 -> 0.2966666666666668
A132: PBR: Mass Market | B132: SF/FANTASY | C132: 0.12 | D132: 50000 | E132: 7.95 | F132: =E132*0.12 -> 0.95399999999999996 | G132: =J132*1.25 -> 145585.83740973676 | H132: =G132*F132 -> 138888.88888888888 | I132: =0.05*K132 -> 20833.333333333336 | J132: =D132/C132/0.45/E132 -> 116468.66992778942 | K132: =E132*J132*0.45 -> 416666.66666666669 | L132: =C132*K132 -> 50000 | M132: =IF((C132*K132)-D132<=0,0,(C132*K132)-D132) -> 0 | N132: =K132*0.2 -> 83333.333333333343 | O132: =K132-D132-H132-I132-M132-N132 -> 123611.11111111112 | P132: =O132/K132 -> 0.29666666666666669
A133: PBR: Mass Market | B133: SF/FANTASY | C133: 0.12 | D133: 25000 | E133: 7.95 | F133: =E133*0.12 -> 0.95399999999999996 | G133: =J133*1.25 -> 72792.918704868382 | H133: =G133*F133 -> 69444.444444444438 | I133: =0.05*K133 -> 10416.666666666668 | J133: =D133/C133/0.45/E133 -> 58234.334963894711 | K133: =E133*J133*0.45 -> 208333.33333333334 | L133: =C133*K133 -> 25000 | M133: =IF((C133*K133)-D133<=0,0,(C133*K133)-D133) -> 0 | N133: =K133*0.2 -> 41666.666666666672 | O133: =K133-D133-H133-I133-M133-N133 -> 61805.555555555562 | P133: =O133/K133 -> 0.29666666666666669
A134: PBR: Mass Market | B134: SF/FANTASY | C134: 0.12 | D134: 25000 | E134: 7.95 | F134: =E134*0.12 -> 0.95399999999999996 | G134: =J134*1.25 -> 72792.918704868382 | H134: =G134*F134 -> 69444.444444444438 | I134: =0.05*K134 -> 10416.666666666668 | J134: =D134/C134/0.45/E134 -> 58234.334963894711 | K134: =E134*J134*0.45 -> 208333.33333333334 | L134: =C134*K134 -> 25000 | M134: =IF((C134*K134)-D134<=0,0,(C134*K134)-D134) -> 0 | N134: =K134*0.2 -> 41666.666666666672 | O134: =K134-D134-H134-I134-M134-N134 -> 61805.555555555562 | P134: =O134/K134 -> 0.29666666666666669
A135: PBR: Trade Paper | B135: SF/FANTASY | C135: 0.12 | D135: 75000 | E135: 15.95 | F135: =E135*0.12 -> 1.9139999999999999 | G135: =J135*1.25 -> 108847.09160571228 | H135: =G135*F135 -> 208333.33333333328 | I135: =0.05*K135 -> 31250 | J135: =D135/C135/0.45/E135 -> 87077.673284569828 | K135: =E135*J135*0.45 -> 625000 | L135: =C135*K135 -> 75000 | M135: =IF((C135*K135)-D135<=0,0,(C135*K135)-D135) -> 0 | N135: =K135*0.2 -> 125000 | O135: =K135-D135-H135-I135-M135-N135 -> 185416.66666666674 | P135: =O135/K135 -> 0.2966666666666668
A136: PBR: Trade Paper | B136: SF/FANTASY | C136: 0.12 | D136: 50000 | E136: 14.95 | F136: =E136*0.12 -> 1.7939999999999998 | G136: =J136*1.25 -> 77418.555679425248 | H136: =G136*F136 -> 138888.88888888888 | I136: =0.05*K136 -> 20833.333333333336 | J136: =D136/C136/0.45/E136 -> 61934.844543540203 | K136: =E136*J136*0.45 -> 416666.66666666669 | L136: =C136*K136 -> 50000 | M136: =IF((C136*K136)-D136<=0,0,(C136*K136)-D136) -> 0 | N136: =K136*0.2 -> 83333.333333333343 | O136: =K136-D136-H136-I136-M136-N136 -> 123611.11111111112 | P136: =O136/K136 -> 0.29666666666666669
A137: PBR: Trade Paper | B137: SF/FANTASY | C137: 0.12 | D137: 25000 | E137: 15.95 | F137: =E137*0.12 -> 1.9139999999999999 | G137: =J137*1.25 -> 36282.36386857077 | H137: =G137*F137 -> 69444.444444444453 | I137: =0.05*K137 -> 10416.666666666668 | J137: =D137/C137/0.45/E137 -> 29025.891094856615 | K137: =E137*J137*0.45 -> 208333.33333333334 | L137: =C137*K137 -> 25000 | M137: =IF((C137*K137)-D137<=0,0,(C137*K137)-D137) -> 0 | N137: =K137*0.2 -> 41666.666666666672 | O137: =K137-D137-H137-I137-M137-N137 -> 61805.555555555547 | P137: =O137/K137 -> 0.29666666666666663
A138: PBR: Trade Paper | B138: SF/FANTASY | C138: 0.12 | D138: 10000 | E138: 15.95 | F138: =E138*0.12 -> 1.9139999999999999 | G138: =J138*1.25 -> 14512.945547428308 | H138: =G138*F138 -> 27777.777777777781 | I138: =0.05*K138 -> 4166.666666666667 | J138: =D138/C138/0.45/E138 -> 11610.356437942646 | K138: =E138*J138*0.45 -> 83333.333333333343 | L138: =C138*K138 -> 10000 | M138: =IF((C138*K138)-D138<=0,0,(C138*K138)-D138) -> 0 | N138: =K138*0.2 -> 16666.666666666668 | O138: =K138-D138-H138-I138-M138-N138 -> 24722.22222222223 | P138: =O138/K138 -> 0.29666666666666675
A139: PBR: Trade Paper | B139: SF/FANTASY | C139: 0.12 | D139: 10000 | E139: 15.95 | F139: =E139*0.12 -> 1.9139999999999999 | G139: =J139*1.25 -> 14512.945547428308 | H139: =G139*F139 -> 27777.777777777781 | I139: =0.05*K139 -> 4166.666666666667 | J139: =D139/C139/0.45/E139 -> 11610.356437942646 | K139: =E139*J139*0.45 -> 83333.333333333343 | L139: =C139*K139 -> 10000 | M139: =IF((C139*K139)-D139<=0,0,(C139*K139)-D139) -> 0 | N139: =K139*0.2 -> 16666.666666666668 | O139: =K139-D139-H139-I139-M139-N139 -> 24722.22222222223 | P139: =O139/K139 -> 0.29666666666666675
A140: Hardcover | B140: THRILLER | C140: 0.12 | D140: 500000 | E140: 29.95 | F140: =E140*0.12 -> 3.5939999999999999 | G140: =J140*1.25 -> 386446.54671365861 | H140: =G140*F140 -> 1388888.888888889 | I140: =0.05*K140 -> 208333.33333333337 | J140: =D140/C140/0.45/E140 -> 309157.23737092689 | K140: =E140*J140*0.45 -> 4166666.666666667 | L140: =C140*K140 -> 500000 | M140: =IF((C140*K140)-D140<=0,0,(C140*K140)-D140) -> 0 | N140: =K140*0.2 -> 833333.33333333349 | O140: =K140-D140-H140-I140-M140-N140 -> 1236111.111111111 | P140: =O140/K140 -> 0.29666666666666663
A141: Hardcover | B141: THRILLER | C141: 0.12 | D141: 500000 | E141: 29.95 | F141: =E141*0.12 -> 3.5939999999999999 | G141: =J141*1.25 -> 386446.54671365861 | H141: =G141*F141 -> 1388888.888888889 | I141: =0.05*K141 -> 208333.33333333337 | J141: =D141/C141/0.45/E141 -> 309157.23737092689 | K141: =E141*J141*0.45 -> 4166666.666666667 | L141: =C141*K141 -> 500000 | M141: =IF((C141*K141)-D141<=0,0,(C141*K141)-D141) -> 0 | N141: =K141*0.2 -> 833333.33333333349 | O141: =K141-D141-H141-I141-M141-N141 -> 1236111.111111111 | P141: =O141/K141 -> 0.29666666666666663
A142: Hardcover | B142: THRILLER | C142: 0.12 | D142: 500000 | E142: 27.95 | F142: =E142*0.12 -> 3.3539999999999996 | G142: =J142*1.25 -> 414099.25130855362 | H142: =G142*F142 -> 1388888.8888888888 | I142: =0.05*K142 -> 208333.33333333337 | J142: =D142/C142/0.45/E142 -> 331279.40104684292 | K142: =E142*J142*0.45 -> 4166666.666666667 | L142: =C142*K142 -> 500000 | M142: =IF((C142*K142)-D142<=0,0,(C142*K142)-D142) -> 0 | N142: =K142*0.2 -> 833333.33333333349 | O142: =K142-D142-H142-I142-M142-N142 -> 1236111.111111111 | P142: =O142/K142 -> 0.29666666666666663
A143: Hardcover | B143: THRILLER | C143: 0.12 | D143: 250000 | E143: 27.95 | F143: =E143*0.12 -> 3.3539999999999996 | G143: =J143*1.25 -> 207049.62565427681 | H143: =G143*F143 -> 694444.44444444438 | I143: =0.05*K143 -> 104166.66666666669 | J143: =D143/C143/0.45/E143 -> 165639.70052342146 | K143: =E143*J143*0.45 -> 2083333.3333333335 | L143: =C143*K143 -> 250000 | M143: =IF((C143*K143)-D143<=0,0,(C143*K143)-D143) -> 0 | N143: =K143*0.2 -> 416666.66666666674 | O143: =K143-D143-H143-I143-M143-N143 -> 618055.5555555555 | P143: =O143/K143 -> 0.29666666666666663
A144: Hardcover | B144: THRILLER | C144: 0.12 | D144: 250000 | E144: 21.95 | F144: =E144*0.12 -> 2.6339999999999999 | G144: =J144*1.25 -> 263646.33426136844 | H144: =G144*F144 -> 694444.44444444438 | I144: =0.05*K144 -> 104166.66666666669 | J144: =D144/C144/0.45/E144 -> 210917.06740909474 | K144: =E144*J144*0.45 -> 2083333.3333333335 | L144: =C144*K144 -> 250000 | M144: =IF((C144*K144)-D144<=0,0,(C144*K144)-D144) -> 0 | N144: =K144*0.2 -> 416666.66666666674 | O144: =K144-D144-H144-I144-M144-N144 -> 618055.5555555555 | P144: =O144/K144 -> 0.29666666666666663
A145: Hardcover | B145: THRILLER | C145: 0.12 | D145: 100000 | E145: 24.95 | F145: =E145*0.12 -> 2.9939999999999998 | G145: =J145*1.25 -> 92778.148890373341 | H145: =G145*F145 -> 277777.77777777775 | I145: =0.05*K145 -> 41666.666666666672 | J145: =D145/C145/0.45/E145 -> 74222.519112298673 | K145: =E145*J145*0.45 -> 833333.33333333337 | L145: =C145*K145 -> 100000 | M145: =IF((C145*K145)-D145<=0,0,(C145*K145)-D145) -> 0 | N145: =K145*0.2 -> 166666.66666666669 | O145: =K145-D145-H145-I145-M145-N145 -> 247222.22222222225 | P145: =O145/K145 -> 0.29666666666666669
A146: Hardcover | B146: THRILLER | C146: 0.12 | D146: 100000 | E146: 21.95 | F146: =E146*0.12 -> 2.6339999999999999 | G146: =J146*1.25 -> 105458.53370454737 | H146: =G146*F146 -> 277777.77777777775 | I146: =0.05*K146 -> 41666.666666666664 | J146: =D146/C146/0.45/E146 -> 84366.826963637897 | K146: =E146*J146*0.45 -> 833333.33333333326 | L146: =C146*K146 -> 100000 | M146: =IF((C146*K146)-D146<=0,0,(C146*K146)-D146) -> 0 | N146: =K146*0.2 -> 166666.66666666666 | O146: =K146-D146-H146-I146-M146-N146 -> 247222.22222222216 | P146: =O146/K146 -> 0.29666666666666663
A147: Hardcover | B147: THRILLER | C147: 0.12 | D147: 100000 | E147: 21.95 | F147: =E147*0.12 -> 2.6339999999999999 | G147: =J147*1.25 -> 105458.53370454737 | H147: =G147*F147 -> 277777.77777777775 | I147: =0.05*K147 -> 41666.666666666664 | J147: =D147/C147/0.45/E147 -> 84366.826963637897 | K147: =E147*J147*0.45 -> 833333.33333333326 | L147: =C147*K147 -> 100000 | M147: =IF((C147*K147)-D147<=0,0,(C147*K147)-D147) -> 0 | N147: =K147*0.2 -> 166666.66666666666 | O147: =K147-D147-H147-I147-M147-N147 -> 247222.22222222216 | P147: =O147/K147 -> 0.29666666666666663
A148: Hardcover | B148: THRILLER | C148: 0.12 | D148: 75000 | E148: 29.95 | F148: =E148*0.12 -> 3.5939999999999999 | G148: =J148*1.25 -> 57966.982007048784 | H148: =G148*F148 -> 208333.33333333331 | I148: =0.05*K148 -> 31250 | J148: =D148/C148/0.45/E148 -> 46373.585605639026 | K148: =E148*J148*0.45 -> 625000 | L148: =C148*K148 -> 75000 | M148: =IF((C148*K148)-D148<=0,0,(C148*K148)-D148) -> 0 | N148: =K148*0.2 -> 125000 | O148: =K148-D148-H148-I148-M148-N148 -> 185416.66666666669 | P148: =O148/K148 -> 0.29666666666666669
A149: Hardcover | B149: THRILLER | C149: 0.12 | D149: 50000 | E149: 29.95 | F149: =E149*0.12 -> 3.5939999999999999 | G149: =J149*1.25 -> 38644.654671365861 | H149: =G149*F149 -> 138888.88888888891 | I149: =0.05*K149 -> 20833.333333333336 | J149: =D149/C149/0.45/E149 -> 30915.723737092689 | K149: =E149*J149*0.45 -> 416666.66666666669 | L149: =C149*K149 -> 50000 | M149: =IF((C149*K149)-D149<=0,0,(C149*K149)-D149) -> 0 | N149: =K149*0.2 -> 83333.333333333343 | O149: =K149-D149-H149-I149-M149-N149 -> 123611.11111111109 | P149: =O149/K149 -> 0.29666666666666663
A150: Hardcover | B150: THRILLER | C150: 0.12 | D150: 50000 | E150: 24.95 | F150: =E150*0.12 -> 2.9939999999999998 | G150: =J150*1.25 -> 46389.07444518667 | H150: =G150*F150 -> 138888.88888888888 | I150: =0.05*K150 -> 20833.333333333336 | J150: =D150/C150/0.45/E150 -> 37111.259556149336 | K150: =E150*J150*0.45 -> 416666.66666666669 | L150: =C150*K150 -> 50000 | M150: =IF((C150*K150)-D150<=0,0,(C150*K150)-D150) -> 0 | N150: =K150*0.2 -> 83333.333333333343 | O150: =K150-D150-H150-I150-M150-N150 -> 123611.11111111112 | P150: =O150/K150 -> 0.29666666666666669
A151: Hardcover | B151: THRILLER | C151: 0.12 | D151: 50000 | E151: 24.95 | F151: =E151*0.12 -> 2.9939999999999998 | G151: =J151*1.25 -> 46389.07444518667 | H151: =G151*F151 -> 138888.88888888888 | I151: =0.05*K151 -> 20833.333333333336 | J151: =D151/C151/0.45/E151 -> 37111.259556149336 | K151: =E151*J151*0.45 -> 416666.66666666669 | L151: =C151*K151 -> 50000 | M151: =IF((C151*K151)-D151<=0,0,(C151*K151)-D151) -> 0 | N151: =K151*0.2 -> 83333.333333333343 | O151: =K151-D151-H151-I151-M151-N151 -> 123611.11111111112 | P151: =O151/K151 -> 0.29666666666666669
A152: Hardcover | B152: THRILLER | C152: 0.12 | D152: 50000 | E152: 24.95 | F152: =E152*0.12 -> 2.9939999999999998 | G152: =J152*1.25 -> 46389.07444518667 | H152: =G152*F152 -> 138888.88888888888 | I152: =0.05*K152 -> 20833.333333333336 | J152: =D152/C152/0.45/E152 -> 37111.259556149336 | K152: =E152*J152*0.45 -> 416666.66666666669 | L152: =C152*K152 -> 50000 | M152: =IF((C152*K152)-D152<=0,0,(C152*K152)-D152) -> 0 | N152: =K152*0.2 -> 83333.333333333343 | O152: =K152-D152-H152-I152-M152-N152 -> 123611.11111111112 | P152: =O152/K152 -> 0.29666666666666669
A153: Hardcover | B153: THRILLER | C153: 0.12 | D153: 25000 | E153: 29.95 | F153: =E153*0.12 -> 3.5939999999999999 | G153: =J153*1.25 -> 19322.32733568293 | H153: =G153*F153 -> 69444.444444444453 | I153: =0.05*K153 -> 10416.666666666668 | J153: =D153/C153/0.45/E153 -> 15457.861868546344 | K153: =E153*J153*0.45 -> 208333.33333333334 | L153: =C153*K153 -> 25000 | M153: =IF((C153*K153)-D153<=0,0,(C153*K153)-D153) -> 0 | N153: =K153*0.2 -> 41666.666666666672 | O153: =K153-D153-H153-I153-M153-N153 -> 61805.555555555547 | P153: =O153/K153 -> 0.29666666666666663
A154: Hardcover | B154: THRILLER | C154: 0.12 | D154: 25000 | E154: 27.95 | F154: =E154*0.12 -> 3.3539999999999996 | G154: =J154*1.25 -> 20704.962565427682 | H154: =G154*F154 -> 69444.444444444438 | I154: =0.05*K154 -> 10416.666666666666 | J154: =D154/C154/0.45/E154 -> 16563.970052342145 | K154: =E154*J154*0.45 -> 208333.33333333331 | L154: =C154*K154 -> 25000 | M154: =IF((C154*K154)-D154<=0,0,(C154*K154)-D154) -> 0 | N154: =K154*0.2 -> 41666.666666666664 | O154: =K154-D154-H154-I154-M154-N154 -> 61805.55555555554 | P154: =O154/K154 -> 0.29666666666666663
A155: Hardcover | B155: THRILLER | C155: 0.12 | D155: 25000 | E155: 27.95 | F155: =E155*0.12 -> 3.3539999999999996 | G155: =J155*1.25 -> 20704.962565427682 | H155: =G155*F155 -> 69444.444444444438 | I155: =0.05*K155 -> 10416.666666666666 | J155: =D155/C155/0.45/E155 -> 16563.970052342145 | K155: =E155*J155*0.45 -> 208333.33333333331 | L155: =C155*K155 -> 25000 | M155: =IF((C155*K155)-D155<=0,0,(C155*K155)-D155) -> 0 | N155: =K155*0.2 -> 41666.666666666664 | O155: =K155-D155-H155-I155-M155-N155 -> 61805.55555555554 | P155: =O155/K155 -> 0.29666666666666663
A156: Hardcover | B156: THRILLER | C156: 0.12 | D156: 10000 | E156: 29.95 | F156: =E156*0.12 -> 3.5939999999999999 | G156: =J156*1.25 -> 7728.9309342731722 | H156: =G156*F156 -> 27777.777777777781 | I156: =0.05*K156 -> 4166.666666666667 | J156: =D156/C156/0.45/E156 -> 6183.1447474185379 | K156: =E156*J156*0.45 -> 83333.333333333343 | L156: =C156*K156 -> 10000 | M156: =IF((C156*K156)-D156<=0,0,(C156*K156)-D156) -> 0 | N156: =K156*0.2 -> 16666.666666666668 | O156: =K156-D156-H156-I156-M156-N156 -> 24722.22222222223 | P156: =O156/K156 -> 0.29666666666666675
A157: Hardcover | B157: THRILLER | C157: 0.12 | D157: 10000 | E157: 29.95 | F157: =E157*0.12 -> 3.5939999999999999 | G157: =J157*1.25 -> 7728.9309342731722 | H157: =G157*F157 -> 27777.777777777781 | I157: =0.05*K157 -> 4166.666666666667 | J157: =D157/C157/0.45/E157 -> 6183.1447474185379 | K157: =E157*J157*0.45 -> 83333.333333333343 | L157: =C157*K157 -> 10000 | M157: =IF((C157*K157)-D157<=0,0,(C157*K157)-D157) -> 0 | N157: =K157*0.2 -> 16666.666666666668 | O157: =K157-D157-H157-I157-M157-N157 -> 24722.22222222223 | P157: =O157/K157 -> 0.29666666666666675
A158: Hardcover | B158: THRILLER | C158: 0.12 | D158: 10000 | E158: 21.95 | F158: =E158*0.12 -> 2.6339999999999999 | G158: =J158*1.25 -> 10545.853370454737 | H158: =G158*F158 -> 27777.777777777777 | I158: =0.05*K158 -> 4166.666666666667 | J158: =D158/C158/0.45/E158 -> 8436.6826963637905 | K158: =E158*J158*0.45 -> 83333.333333333343 | L158: =C158*K158 -> 10000 | M158: =IF((C158*K158)-D158<=0,0,(C158*K158)-D158) -> 0 | N158: =K158*0.2 -> 16666.666666666668 | O158: =K158-D158-H158-I158-M158-N158 -> 24722.22222222223 | P158: =O158/K158 -> 0.29666666666666675
A159: Hardcover | B159: THRILLER | C159: 0.12 | D159: 10000 | E159: 21.95 | F159: =E159*0.12 -> 2.6339999999999999 | G159: =J159*1.25 -> 10545.853370454737 | H159: =G159*F159 -> 27777.777777777777 | I159: =0.05*K159 -> 4166.666666666667 | J159: =D159/C159/0.45/E159 -> 8436.6826963637905 | K159: =E159*J159*0.45 -> 83333.333333333343 | L159: =C159*K159 -> 10000 | M159: =IF((C159*K159)-D159<=0,0,(C159*K159)-D159) -> 0 | N159: =K159*0.2 -> 16666.666666666668 | O159: =K159-D159-H159-I159-M159-N159 -> 24722.22222222223 | P159: =O159/K159 -> 0.29666666666666675
A160: Hardcover | B160: THRILLER | C160: 0.12 | D160: 10000 | E160: 21.95 | F160: =E160*0.12 -> 2.6339999999999999 | G160: =J160*1.25 -> 10545.853370454737 | H160: =G160*F160 -> 27777.777777777777 | I160: =0.05*K160 -> 4166.666666666667 | J160: =D160/C160/0.45/E160 -> 8436.6826963637905 | K160: =E160*J160*0.45 -> 83333.333333333343 | L160: =C160*K160 -> 10000 | M160: =IF((C160*K160)-D160<=0,0,(C160*K160)-D160) -> 0 | N160: =K160*0.2 -> 16666.666666666668 | O160: =K160-D160-H160-I160-M160-N160 -> 24722.22222222223 | P160: =O160/K160 -> 0.29666666666666675
A161: Hardcover | B161: THRILLER | C161: 0.12 | D161: 5000 | E161: 21.95 | F161: =E161*0.12 -> 2.6339999999999999 | G161: =J161*1.25 -> 5272.9266852273686 | H161: =G161*F161 -> 13888.888888888889 | I161: =0.05*K161 -> 2083.3333333333335 | J161: =D161/C161/0.45/E161 -> 4218.3413481818952 | K161: =E161*J161*0.45 -> 41666.666666666672 | L161: =C161*K161 -> 5000 | M161: =IF((C161*K161)-D161<=0,0,(C161*K161)-D161) -> 0 | N161: =K161*0.2 -> 8333.3333333333339 | O161: =K161-D161-H161-I161-M161-N161 -> 12361.111111111115 | P161: =O161/K161 -> 0.29666666666666675
A162: Trade Paper Original | B162: THRILLER | C162: 0.12 | D162: 5000 | E162: 16.95 | F162: =E162*0.12 -> 2.0339999999999998 | G162: =J162*1.25 -> 6828.3622855894246 | H162: =G162*F162 -> 13888.888888888889 | I162: =0.05*K162 -> 2083.3333333333335 | J162: =D162/C162/0.45/E162 -> 5462.6898284715398 | K162: =E162*J162*0.45 -> 41666.666666666672 | L162: =C162*K162 -> 5000 | M162: =IF((C162*K162)-D162<=0,0,(C162*K162)-D162) -> 0 | N162: =K162*0.2 -> 8333.3333333333339 | O162: =K162-D162-H162-I162-M162-N162 -> 12361.111111111115 | P162: =O162/K162 -> 0.29666666666666675
A163: Trade Paper Original | B163: THRILLER | C163: 0.12 | D163: 5000 | E163: 16.95 | F163: =E163*0.12 -> 2.0339999999999998 | G163: =J163*1.25 -> 6828.3622855894246 | H163: =G163*F163 -> 13888.888888888889 | I163: =0.05*K163 -> 2083.3333333333335 | J163: =D163/C163/0.45/E163 -> 5462.6898284715398 | K163: =E163*J163*0.45 -> 41666.666666666672 | L163: =C163*K163 -> 5000 | M163: =IF((C163*K163)-D163<=0,0,(C163*K163)-D163) -> 0 | N163: =K163*0.2 -> 8333.3333333333339 | O163: =K163-D163-H163-I163-M163-N163 -> 12361.111111111115 | P163: =O163/K163 -> 0.29666666666666675
A164: Trade Paper Original | B164: THRILLER | C164: 0.12 | D164: 5000 | E164: 16.95 | F164: =E164*0.12 -> 2.0339999999999998 | G164: =J164*1.25 -> 6828.3622855894246 | H164: =G164*F164 -> 13888.888888888889 | I164: =0.05*K164 -> 2083.3333333333335 | J164: =D164/C164/0.45/E164 -> 5462.6898284715398 | K164: =E164*J164*0.45 -> 41666.666666666672 | L164: =C164*K164 -> 5000 | M164: =IF((C164*K164)-D164<=0,0,(C164*K164)-D164) -> 0 | N164: =K164*0.2 -> 8333.3333333333339 | O164: =K164-D164-H164-I164-M164-N164 -> 12361.111111111115 | P164: =O164/K164 -> 0.29666666666666675
A165: PBR: Mass Market | B165: THRILLER | C165: 0.12 | D165: 100000 | E165: 7.95 | F165: =E165*0.12 -> 0.95399999999999996 | G165: =J165*1.25 -> 291171.67481947353 | H165: =G165*F165 -> 277777.77777777775 | I165: =0.05*K165 -> 41666.666666666672 | J165: =D165/C165/0.45/E165 -> 232937.33985557884 | K165: =E165*J165*0.45 -> 833333.33333333337 | L165: =C165*K165 -> 100000 | M165: =IF((C165*K165)-D165<=0,0,(C165*K165)-D165) -> 0 | N165: =K165*0.2 -> 166666.66666666669 | O165: =K165-D165-H165-I165-M165-N165 -> 247222.22222222225 | P165: =O165/K165 -> 0.29666666666666669
A166: PBR: Mass Market | B166: THRILLER | C166: 0.12 | D166: 100000 | E166: 7.95 | F166: =E166*0.12 -> 0.95399999999999996 | G166: =J166*1.25 -> 291171.67481947353 | H166: =G166*F166 -> 277777.77777777775 | I166: =0.05*K166 -> 41666.666666666672 | J166: =D166/C166/0.45/E166 -> 232937.33985557884 | K166: =E166*J166*0.45 -> 833333.33333333337 | L166: =C166*K166 -> 100000 | M166: =IF((C166*K166)-D166<=0,0,(C166*K166)-D166) -> 0 | N166: =K166*0.2 -> 166666.66666666669 | O166: =K166-D166-H166-I166-M166-N166 -> 247222.22222222225 | P166: =O166/K166 -> 0.29666666666666669
A167: PBR: Mass Market | B167: THRILLER | C167: 0.12 | D167: 75000 | E167: 7.95 | F167: =E167*0.12 -> 0.95399999999999996 | G167: =J167*1.25 -> 218378.75611460512 | H167: =G167*F167 -> 208333.33333333328 | I167: =0.05*K167 -> 31250 | J167: =D167/C167/0.45/E167 -> 174703.0048916841 | K167: =E167*J167*0.45 -> 625000 | L167: =C167*K167 -> 75000 | M167: =IF((C167*K167)-D167<=0,0,(C167*K167)-D167) -> 0 | N167: =K167*0.2 -> 125000 | O167: =K167-D167-H167-I167-M167-N167 -> 185416.66666666674 | P167: =O167/K167 -> 0.2966666666666668
A168: PBR: Mass Market | B168: THRILLER | C168: 0.12 | D168: 75000 | E168: 7.95 | F168: =E168*0.12 -> 0.95399999999999996 | G168: =J168*1.25 -> 218378.75611460512 | H168: =G168*F168 -> 208333.33333333328 | I168: =0.05*K168 -> 31250 | J168: =D168/C168/0.45/E168 -> 174703.0048916841 | K168: =E168*J168*0.45 -> 625000 | L168: =C168*K168 -> 75000 | M168: =IF((C168*K168)-D168<=0,0,(C168*K168)-D168) -> 0 | N168: =K168*0.2 -> 125000 | O168: =K168-D168-H168-I168-M168-N168 -> 185416.66666666674 | P168: =O168/K168 -> 0.2966666666666668
A169: PBR: Mass Market | B169: THRILLER | C169: 0.12 | D169: 50000 | E169: 7.95 | F169: =E169*0.12 -> 0.95399999999999996 | G169: =J169*1.25 -> 145585.83740973676 | H169: =G169*F169 -> 138888.88888888888 | I169: =0.05*K169 -> 20833.333333333336 | J169: =D169/C169/0.45/E169 -> 116468.66992778942 | K169: =E169*J169*0.45 -> 416666.66666666669 | L169: =C169*K169 -> 50000 | M169: =IF((C169*K169)-D169<=0,0,(C169*K169)-D169) -> 0 | N169: =K169*0.2 -> 83333.333333333343 | O169: =K169-D169-H169-I169-M169-N169 -> 123611.11111111112 | P169: =O169/K169 -> 0.29666666666666669
A170: PBR: Mass Market | B170: THRILLER | C170: 0.12 | D170: 50000 | E170: 7.95 | F170: =E170*0.12 -> 0.95399999999999996 | G170: =J170*1.25 -> 145585.83740973676 | H170: =G170*F170 -> 138888.88888888888 | I170: =0.05*K170 -> 20833.333333333336 | J170: =D170/C170/0.45/E170 -> 116468.66992778942 | K170: =E170*J170*0.45 -> 416666.66666666669 | L170: =C170*K170 -> 50000 | M170: =IF((C170*K170)-D170<=0,0,(C170*K170)-D170) -> 0 | N170: =K170*0.2 -> 83333.333333333343 | O170: =K170-D170-H170-I170-M170-N170 -> 123611.11111111112 | P170: =O170/K170 -> 0.29666666666666669
A171: PBR: Mass Market | B171: THRILLER | C171: 0.12 | D171: 25000 | E171: 7.95 | F171: =E171*0.12 -> 0.95399999999999996 | G171: =J171*1.25 -> 72792.918704868382 | H171: =G171*F171 -> 69444.444444444438 | I171: =0.05*K171 -> 10416.666666666668 | J171: =D171/C171/0.45/E171 -> 58234.334963894711 | K171: =E171*J171*0.45 -> 208333.33333333334 | L171: =C171*K171 -> 25000 | M171: =IF((C171*K171)-D171<=0,0,(C171*K171)-D171) -> 0 | N171: =K171*0.2 -> 41666.666666666672 | O171: =K171-D171-H171-I171-M171-N171 -> 61805.555555555562 | P171: =O171/K171 -> 0.29666666666666669
A172: PBR: Mass Market | B172: THRILLER | C172: 0.12 | D172: 25000 | E172: 7.95 | F172: =E172*0.12 -> 0.95399999999999996 | G172: =J172*1.25 -> 72792.918704868382 | H172: =G172*F172 -> 69444.444444444438 | I172: =0.05*K172 -> 10416.666666666668 | J172: =D172/C172/0.45/E172 -> 58234.334963894711 | K172: =E172*J172*0.45 -> 208333.33333333334 | L172: =C172*K172 -> 25000 | M172: =IF((C172*K172)-D172<=0,0,(C172*K172)-D172) -> 0 | N172: =K172*0.2 -> 41666.666666666672 | O172: =K172-D172-H172-I172-M172-N172 -> 61805.555555555562 | P172: =O172/K172 -> 0.29666666666666669
A173: PBR: Mass Market | B173: THRILLER | C173: 0.12 | D173: 25000 | E173: 7.95 | F173: =E173*0.12 -> 0.95399999999999996 | G173: =J173*1.25 -> 72792.918704868382 | H173: =G173*F173 -> 69444.444444444438 | I173: =0.05*K173 -> 10416.666666666668 | J173: =D173/C173/0.45/E173 -> 58234.334963894711 | K173: =E173*J173*0.45 -> 208333.33333333334 | L173: =C173*K173 -> 25000 | M173: =IF((C173*K173)-D173<=0,0,(C173*K173)-D173) -> 0 | N173: =K173*0.2 -> 41666.666666666672 | O173: =K173-D173-H173-I173-M173-N173 -> 61805.555555555562 | P173: =O173/K173 -> 0.29666666666666669
A174: PBR: Mass Market | B174: THRILLER | C174: 0.12 | D174: 25000 | E174: 7.95 | F174: =E174*0.12 -> 0.95399999999999996 | G174: =J174*1.25 -> 72792.918704868382 | H174: =G174*F174 -> 69444.444444444438 | I174: =0.05*K174 -> 10416.666666666668 | J174: =D174/C174/0.45/E174 -> 58234.334963894711 | K174: =E174*J174*0.45 -> 208333.33333333334 | L174: =C174*K174 -> 25000 | M174: =IF((C174*K174)-D174<=0,0,(C174*K174)-D174) -> 0 | N174: =K174*0.2 -> 41666.666666666672 | O174: =K174-D174-H174-I174-M174-N174 -> 61805.555555555562 | P174: =O174/K174 -> 0.29666666666666669
A175: PBR: Trade Paper | B175: THRILLER | C175: 0.12 | D175: 75000 | E175: 15.95 | F175: =E175*0.12 -> 1.9139999999999999 | G175: =J175*1.25 -> 108847.09160571228 | H175: =G175*F175 -> 208333.33333333328 | I175: =0.05*K175 -> 31250 | J175: =D175/C175/0.45/E175 -> 87077.673284569828 | K175: =E175*J175*0.45 -> 625000 | L175: =C175*K175 -> 75000 | M175: =IF((C175*K175)-D175<=0,0,(C175*K175)-D175) -> 0 | N175: =K175*0.2 -> 125000 | O175: =K175-D175-H175-I175-M175-N175 -> 185416.66666666674 | P175: =O175/K175 -> 0.2966666666666668
A176: PBR: Trade Paper | B176: THRILLER | C176: 0.12 | D176: 50000 | E176: 14.95 | F176: =E176*0.12 -> 1.7939999999999998 | G176: =J176*1.25 -> 77418.555679425248 | H176: =G176*F176 -> 138888.88888888888 | I176: =0.05*K176 -> 20833.333333333336 | J176: =D176/C176/0.45/E176 -> 61934.844543540203 | K176: =E176*J176*0.45 -> 416666.66666666669 | L176: =C176*K176 -> 50000 | M176: =IF((C176*K176)-D176<=0,0,(C176*K176)-D176) -> 0 | N176: =K176*0.2 -> 83333.333333333343 | O176: =K176-D176-H176-I176-M176-N176 -> 123611.11111111112 | P176: =O176/K176 -> 0.29666666666666669
A177: PBR: Trade Paper | B177: THRILLER | C177: 0.12 | D177: 10000 | E177: 15.95 | F177: =E177*0.12 -> 1.9139999999999999 | G177: =J177*1.25 -> 14512.945547428308 | H177: =G177*F177 -> 27777.777777777781 | I177: =0.05*K177 -> 4166.666666666667 | J177: =D177/C177/0.45/E177 -> 11610.356437942646 | K177: =E177*J177*0.45 -> 83333.333333333343 | L177: =C177*K177 -> 10000 | M177: =IF((C177*K177)-D177<=0,0,(C177*K177)-D177) -> 0 | N177: =K177*0.2 -> 16666.666666666668 | O177: =K177-D177-H177-I177-M177-N177 -> 24722.22222222223 | P177: =O177/K177 -> 0.29666666666666675
A178: PBR: Trade Paper | B178: THRILLER | C178: 0.12 | D178: 10000 | E178: 15.95 | F178: =E178*0.12 -> 1.9139999999999999 | G178: =J178*1.25 -> 14512.945547428308 | H178: =G178*F178 -> 27777.777777777781 | I178: =0.05*K178 -> 4166.666666666667 | J178: =D178/C178/0.45/E178 -> 11610.356437942646 | K178: =E178*J178*0.45 -> 83333.333333333343 | L178: =C178*K178 -> 10000 | M178: =IF((C178*K178)-D178<=0,0,(C178*K178)-D178) -> 0 | N178: =K178*0.2 -> 16666.666666666668 | O178: =K178-D178-H178-I178-M178-N178 -> 24722.22222222223 | P178: =O178/K178 -> 0.29666666666666675
A179: PBR: Trade Paper | B179: THRILLER | C179: 0.12 | D179: 10000 | E179: 14.95 | F179: =E179*0.12 -> 1.7939999999999998 | G179: =J179*1.25 -> 15483.711135885051 | H179: =G179*F179 -> 27777.777777777777 | I179: =0.05*K179 -> 4166.666666666667 | J179: =D179/C179/0.45/E179 -> 12386.968908708041 | K179: =E179*J179*0.45 -> 83333.333333333343 | L179: =C179*K179 -> 10000 | M179: =IF((C179*K179)-D179<=0,0,(C179*K179)-D179) -> 0 | N179: =K179*0.2 -> 16666.666666666668 | O179: =K179-D179-H179-I179-M179-N179 -> 24722.22222222223 | P179: =O179/K179 -> 0.29666666666666675
A180: Hardcover | B180: WOMEN'S FICTION | C180: 0.12 | D180: 100000 | E180: 29.95 | F180: =E180*0.12 -> 3.5939999999999999 | G180: =J180*1.25 -> 77289.309342731722 | H180: =G180*F180 -> 277777.77777777781 | I180: =0.05*K180 -> 41666.666666666672 | J180: =D180/C180/0.45/E180 -> 61831.447474185377 | K180: =E180*J180*0.45 -> 833333.33333333337 | L180: =C180*K180 -> 100000 | M180: =IF((C180*K180)-D180<=0,0,(C180*K180)-D180) -> 0 | N180: =K180*0.2 -> 166666.66666666669 | O180: =K180-D180-H180-I180-M180-N180 -> 247222.22222222219 | P180: =O180/K180 -> 0.29666666666666663
A181: Hardcover | B181: WOMEN'S FICTION | C181: 0.12 | D181: 75000 | E181: 27.95 | F181: =E181*0.12 -> 3.3539999999999996 | G181: =J181*1.25 -> 62114.88769628304 | H181: =G181*F181 -> 208333.33333333328 | I181: =0.05*K181 -> 31250 | J181: =D181/C181/0.45/E181 -> 49691.910157026432 | K181: =E181*J181*0.45 -> 625000 | L181: =C181*K181 -> 75000 | M181: =IF((C181*K181)-D181<=0,0,(C181*K181)-D181) -> 0 | N181: =K181*0.2 -> 125000 | O181: =K181-D181-H181-I181-M181-N181 -> 185416.66666666674 | P181: =O181/K181 -> 0.2966666666666668
A182: Hardcover | B182: WOMEN'S FICTION | C182: 0.12 | D182: 50000 | E182: 29.95 | F182: =E182*0.12 -> 3.5939999999999999 | G182: =J182*1.25 -> 38644.654671365861 | H182: =G182*F182 -> 138888.88888888891 | I182: =0.05*K182 -> 20833.333333333336 | J182: =D182/C182/0.45/E182 -> 30915.723737092689 | K182: =E182*J182*0.45 -> 416666.66666666669 | L182: =C182*K182 -> 50000 | M182: =IF((C182*K182)-D182<=0,0,(C182*K182)-D182) -> 0 | N182: =K182*0.2 -> 83333.333333333343 | O182: =K182-D182-H182-I182-M182-N182 -> 123611.11111111109 | P182: =O182/K182 -> 0.29666666666666663
A183: Hardcover | B183: WOMEN'S FICTION | C183: 0.12 | D183: 25000 | E183: 29.95 | F183: =E183*0.12 -> 3.5939999999999999 | G183: =J183*1.25 -> 19322.32733568293 | H183: =G183*F183 -> 69444.444444444453 | I183: =0.05*K183 -> 10416.666666666668 | J183: =D183/C183/0.45/E183 -> 15457.861868546344 | K183: =E183*J183*0.45 -> 208333.33333333334 | L183: =C183*K183 -> 25000 | M183: =IF((C183*K183)-D183<=0,0,(C183*K183)-D183) -> 0 | N183: =K183*0.2 -> 41666.666666666672 | O183: =K183-D183-H183-I183-M183-N183 -> 61805.555555555547 | P183: =O183/K183 -> 0.29666666666666663
A184: Hardcover | B184: WOMEN'S FICTION | C184: 0.12 | D184: 25000 | E184: 27.95 | F184: =E184*0.12 -> 3.3539999999999996 | G184: =J184*1.25 -> 20704.962565427682 | H184: =G184*F184 -> 69444.444444444438 | I184: =0.05*K184 -> 10416.666666666666 | J184: =D184/C184/0.45/E184 -> 16563.970052342145 | K184: =E184*J184*0.45 -> 208333.33333333331 | L184: =C184*K184 -> 25000 | M184: =IF((C184*K184)-D184<=0,0,(C184*K184)-D184) -> 0 | N184: =K184*0.2 -> 41666.666666666664 | O184: =K184-D184-H184-I184-M184-N184 -> 61805.55555555554 | P184: =O184/K184 -> 0.29666666666666663
A185: Hardcover | B185: WOMEN'S FICTION | C185: 0.12 | D185: 25000 | E185: 27.95 | F185: =E185*0.12 -> 3.3539999999999996 | G185: =J185*1.25 -> 20704.962565427682 | H185: =G185*F185 -> 69444.444444444438 | I185: =0.05*K185 -> 10416.666666666666 | J185: =D185/C185/0.45/E185 -> 16563.970052342145 | K185: =E185*J185*0.45 -> 208333.33333333331 | L185: =C185*K185 -> 25000 | M185: =IF((C185*K185)-D185<=0,0,(C185*K185)-D185) -> 0 | N185: =K185*0.2 -> 41666.666666666664 | O185: =K185-D185-H185-I185-M185-N185 -> 61805.55555555554 | P185: =O185/K185 -> 0.29666666666666663
A186: Hardcover | B186: WOMEN'S FICTION | C186: 0.12 | D186: 25000 | E186: 24.95 | F186: =E186*0.12 -> 2.9939999999999998 | G186: =J186*1.25 -> 23194.537222593335 | H186: =G186*F186 -> 69444.444444444438 | I186: =0.05*K186 -> 10416.666666666668 | J186: =D186/C186/0.45/E186 -> 18555.629778074668 | K186: =E186*J186*0.45 -> 208333.33333333334 | L186: =C186*K186 -> 25000 | M186: =IF((C186*K186)-D186<=0,0,(C186*K186)-D186) -> 0 | N186: =K186*0.2 -> 41666.666666666672 | O186: =K186-D186-H186-I186-M186-N186 -> 61805.555555555562 | P186: =O186/K186 -> 0.29666666666666669
A187: Hardcover | B187: WOMEN'S FICTION | C187: 0.12 | D187: 25000 | E187: 21.95 | F187: =E187*0.12 -> 2.6339999999999999 | G187: =J187*1.25 -> 26364.633426136843 | H187: =G187*F187 -> 69444.444444444438 | I187: =0.05*K187 -> 10416.666666666666 | J187: =D187/C187/0.45/E187 -> 21091.706740909474 | K187: =E187*J187*0.45 -> 208333.33333333331 | L187: =C187*K187 -> 25000 | M187: =IF((C187*K187)-D187<=0,0,(C187*K187)-D187) -> 0 | N187: =K187*0.2 -> 41666.666666666664 | O187: =K187-D187-H187-I187-M187-N187 -> 61805.55555555554 | P187: =O187/K187 -> 0.29666666666666663
A188: Hardcover | B188: WOMEN'S FICTION | C188: 0.12 | D188: 10000 | E188: 21.95 | F188: =E188*0.12 -> 2.6339999999999999 | G188: =J188*1.25 -> 10545.853370454737 | H188: =G188*F188 -> 27777.777777777777 | I188: =0.05*K188 -> 4166.666666666667 | J188: =D188/C188/0.45/E188 -> 8436.6826963637905 | K188: =E188*J188*0.45 -> 83333.333333333343 | L188: =C188*K188 -> 10000 | M188: =IF((C188*K188)-D188<=0,0,(C188*K188)-D188) -> 0 | N188: =K188*0.2 -> 16666.666666666668 | O188: =K188-D188-H188-I188-M188-N188 -> 24722.22222222223 | P188: =O188/K188 -> 0.29666666666666675
A189: Hardcover | B189: WOMEN'S FICTION | C189: 0.12 | D189: 10000 | E189: 24.95 | F189: =E189*0.12 -> 2.9939999999999998 | G189: =J189*1.25 -> 9277.8148890373341 | H189: =G189*F189 -> 27777.777777777777 | I189: =0.05*K189 -> 4166.666666666667 | J189: =D189/C189/0.45/E189 -> 7422.2519112298678 | K189: =E189*J189*0.45 -> 83333.333333333343 | L189: =C189*K189 -> 10000 | M189: =IF((C189*K189)-D189<=0,0,(C189*K189)-D189) -> 0 | N189: =K189*0.2 -> 16666.666666666668 | O189: =K189-D189-H189-I189-M189-N189 -> 24722.22222222223 | P189: =O189/K189 -> 0.29666666666666675
A190: Hardcover | B190: WOMEN'S FICTION | C190: 0.12 | D190: 10000 | E190: 24.95 | F190: =E190*0.12 -> 2.9939999999999998 | G190: =J190*1.25 -> 9277.8148890373341 | H190: =G190*F190 -> 27777.777777777777 | I190: =0.05*K190 -> 4166.666666666667 | J190: =D190/C190/0.45/E190 -> 7422.2519112298678 | K190: =E190*J190*0.45 -> 83333.333333333343 | L190: =C190*K190 -> 10000 | M190: =IF((C190*K190)-D190<=0,0,(C190*K190)-D190) -> 0 | N190: =K190*0.2 -> 16666.666666666668 | O190: =K190-D190-H190-I190-M190-N190 -> 24722.22222222223 | P190: =O190/K190 -> 0.29666666666666675
A191: Hardcover | B191: WOMEN'S FICTION | C191: 0.12 | D191: 10000 | E191: 21.95 | F191: =E191*0.12 -> 2.6339999999999999 | G191: =J191*1.25 -> 10545.853370454737 | H191: =G191*F191 -> 27777.777777777777 | I191: =0.05*K191 -> 4166.666666666667 | J191: =D191/C191/0.45/E191 -> 8436.6826963637905 | K191: =E191*J191*0.45 -> 83333.333333333343 | L191: =C191*K191 -> 10000 | M191: =IF((C191*K191)-D191<=0,0,(C191*K191)-D191) -> 0 | N191: =K191*0.2 -> 16666.666666666668 | O191: =K191-D191-H191-I191-M191-N191 -> 24722.22222222223 | P191: =O191/K191 -> 0.29666666666666675
A192: Hardcover | B192: WOMEN'S FICTION | C192: 0.12 | D192: 10000 | E192: 21.95 | F192: =E192*0.12 -> 2.6339999999999999 | G192: =J192*1.25 -> 10545.853370454737 | H192: =G192*F192 -> 27777.777777777777 | I192: =0.05*K192 -> 4166.666666666667 | J192: =D192/C192/0.45/E192 -> 8436.6826963637905 | K192: =E192*J192*0.45 -> 83333.333333333343 | L192: =C192*K192 -> 10000 | M192: =IF((C192*K192)-D192<=0,0,(C192*K192)-D192) -> 0 | N192: =K192*0.2 -> 16666.666666666668 | O192: =K192-D192-H192-I192-M192-N192 -> 24722.22222222223 | P192: =O192/K192 -> 0.29666666666666675
A193: Trade Paper Original | B193: WOMEN'S FICTION | C193: 0.12 | D193: 25000 | E193: 16.95 | F193: =E193*0.12 -> 2.0339999999999998 | G193: =J193*1.25 -> 34141.811427947119 | H193: =G193*F193 -> 69444.444444444438 | I193: =0.05*K193 -> 10416.666666666668 | J193: =D193/C193/0.45/E193 -> 27313.449142357698 | K193: =E193*J193*0.45 -> 208333.33333333334 | L193: =C193*K193 -> 25000 | M193: =IF((C193*K193)-D193<=0,0,(C193*K193)-D193) -> 0 | N193: =K193*0.2 -> 41666.666666666672 | O193: =K193-D193-H193-I193-M193-N193 -> 61805.555555555562 | P193: =O193/K193 -> 0.29666666666666669
A194: PBR: Mass Market | B194: WOMEN'S FICTION | C194: 0.12 | D194: 75000 | E194: 7.95 | F194: =E194*0.12 -> 0.95399999999999996 | G194: =J194*1.25 -> 218378.75611460512 | H194: =G194*F194 -> 208333.33333333328 | I194: =0.05*K194 -> 31250 | J194: =D194/C194/0.45/E194 -> 174703.0048916841 | K194: =E194*J194*0.45 -> 625000 | L194: =C194*K194 -> 75000 | M194: =IF((C194*K194)-D194<=0,0,(C194*K194)-D194) -> 0 | N194: =K194*0.2 -> 125000 | O194: =K194-D194-H194-I194-M194-N194 -> 185416.66666666674 | P194: =O194/K194 -> 0.2966666666666668
A195: PBR: Trade Paper | B195: WOMEN'S FICTION | C195: 0.12 | D195: 50000 | E195: 15.95 | F195: =E195*0.12 -> 1.9139999999999999 | G195: =J195*1.25 -> 72564.72773714154 | H195: =G195*F195 -> 138888.88888888891 | I195: =0.05*K195 -> 20833.333333333336 | J195: =D195/C195/0.45/E195 -> 58051.782189713231 | K195: =E195*J195*0.45 -> 416666.66666666669 | L195: =C195*K195 -> 50000 | M195: =IF((C195*K195)-D195<=0,0,(C195*K195)-D195) -> 0 | N195: =K195*0.2 -> 83333.333333333343 | O195: =K195-D195-H195-I195-M195-N195 -> 123611.11111111109 | P195: =O195/K195 -> 0.29666666666666663
A196: PBR: Trade Paper | B196: WOMEN'S FICTION | C196: 0.12 | D196: 25000 | E196: 15.95 | F196: =E196*0.12 -> 1.9139999999999999 | G196: =J196*1.25 -> 36282.36386857077 | H196: =G196*F196 -> 69444.444444444453 | I196: =0.05*K196 -> 10416.666666666668 | J196: =D196/C196/0.45/E196 -> 29025.891094856615 | K196: =E196*J196*0.45 -> 208333.33333333334 | L196: =C196*K196 -> 25000 | M196: =IF((C196*K196)-D196<=0,0,(C196*K196)-D196) -> 0 | N196: =K196*0.2 -> 41666.666666666672 | O196: =K196-D196-H196-I196-M196-N196 -> 61805.555555555547 | P196: =O196/K196 -> 0.29666666666666663
A197: PBR: Trade Paper | B197: WOMEN'S FICTION | C197: 0.12 | D197: 25000 | E197: 14.95 | F197: =E197*0.12 -> 1.7939999999999998 | G197: =J197*1.25 -> 38709.277839712624 | H197: =G197*F197 -> 69444.444444444438 | I197: =0.05*K197 -> 10416.666666666668 | J197: =D197/C197/0.45/E197 -> 30967.422271770101 | K197: =E197*J197*0.45 -> 208333.33333333334 | L197: =C197*K197 -> 25000 | M197: =IF((C197*K197)-D197<=0,0,(C197*K197)-D197) -> 0 | N197: =K197*0.2 -> 41666.666666666672 | O197: =K197-D197-H197-I197-M197-N197 -> 61805.555555555562 | P197: =O197/K197 -> 0.29666666666666669
A198: PBR: Trade Paper | B198: WOMEN'S FICTION | C198: 0.12 | D198: 25000 | E198: 14.95 | F198: =E198*0.12 -> 1.7939999999999998 | G198: =J198*1.25 -> 38709.277839712624 | H198: =G198*F198 -> 69444.444444444438 | I198: =0.05*K198 -> 10416.666666666668 | J198: =D198/C198/0.45/E198 -> 30967.422271770101 | K198: =E198*J198*0.45 -> 208333.33333333334 | L198: =C198*K198 -> 25000 | M198: =IF((C198*K198)-D198<=0,0,(C198*K198)-D198) -> 0 | N198: =K198*0.2 -> 41666.666666666672 | O198: =K198-D198-H198-I198-M198-N198 -> 61805.555555555562 | P198: =O198/K198 -> 0.29666666666666669
A199: PBR: Trade Paper | B199: WOMEN'S FICTION | C199: 0.12 | D199: 10000 | E199: 15.95 | F199: =E199*0.12 -> 1.9139999999999999 | G199: =J199*1.25 -> 14512.945547428308 | H199: =G199*F199 -> 27777.777777777781 | I199: =0.05*K199 -> 4166.666666666667 | J199: =D199/C199/0.45/E199 -> 11610.356437942646 | K199: =E199*J199*0.45 -> 83333.333333333343 | L199: =C199*K199 -> 10000 | M199: =IF((C199*K199)-D199<=0,0,(C199*K199)-D199) -> 0 | N199: =K199*0.2 -> 16666.666666666668 | O199: =K199-D199-H199-I199-M199-N199 -> 24722.22222222223 | P199: =O199/K199 -> 0.29666666666666675
A200: PBR: Trade Paper | B200: WOMEN'S FICTION | C200: 0.12 | D200: 10000 | E200: 14.95 | F200: =E200*0.12 -> 1.7939999999999998 | G200: =J200*1.25 -> 15483.711135885051 | H200: =G200*F200 -> 27777.777777777777 | I200: =0.05*K200 -> 4166.666666666667 | J200: =D200/C200/0.45/E200 -> 12386.968908708041 | K200: =E200*J200*0.45 -> 83333.333333333343 | L200: =C200*K200 -> 10000 | M200: =IF((C200*K200)-D200<=0,0,(C200*K200)-D200) -> 0 | N200: =K200*0.2 -> 16666.666666666668 | O200: =K200-D200-H200-I200-M200-N200 -> 24722.22222222223 | P200: =O200/K200 -> 0.29666666666666675
A201: PBR: Trade Paper | B201: WOMEN'S FICTION | C201: 0.12 | D201: 10000 | E201: 14.95 | F201: =E201*0.12 -> 1.7939999999999998 | G201: =J201*1.25 -> 15483.711135885051 | H201: =G201*F201 -> 27777.777777777777 | I201: =0.05*K201 -> 4166.666666666667 | J201: =D201/C201/0.45/E201 -> 12386.968908708041 | K201: =E201*J201*0.45 -> 83333.333333333343 | L201: =C201*K201 -> 10000 | M201: =IF((C201*K201)-D201<=0,0,(C201*K201)-D201) -> 0 | N201: =K201*0.2 -> 16666.666666666668 | O201: =K201-D201-H201-I201-M201-N201 -> 24722.22222222223 | P201: =O201/K201 -> 0.29666666666666675
A202: PBR: Trade Paper | B202: WOMEN'S FICTION | C202: 0.12 | D202: 10000 | E202: 14.95 | F202: =E202*0.12 -> 1.7939999999999998 | G202: =J202*1.25 -> 15483.711135885051 | H202: =G202*F202 -> 27777.777777777777 | I202: =0.05*K202 -> 4166.666666666667 | J202: =D202/C202/0.45/E202 -> 12386.968908708041 | K202: =E202*J202*0.45 -> 83333.333333333343 | L202: =C202*K202 -> 10000 | M202: =IF((C202*K202)-D202<=0,0,(C202*K202)-D202) -> 0 | N202: =K202*0.2 -> 16666.666666666668 | O202: =K202-D202-H202-I202-M202-N202 -> 24722.22222222223 | P202: =O202/K202 -> 0.29666666666666675
A203: PBR: Trade Paper | B203: WOMEN'S FICTION | C203: 0.12 | D203: 10000 | E203: 14.95 | F203: =E203*0.12 -> 1.7939999999999998 | G203: =J203*1.25 -> 15483.711135885051 | H203: =G203*F203 -> 27777.777777777777 | I203: =0.05*K203 -> 4166.666666666667 | J203: =D203/C203/0.45/E203 -> 12386.968908708041 | K203: =E203*J203*0.45 -> 83333.333333333343 | L203: =C203*K203 -> 10000 | M203: =IF((C203*K203)-D203<=0,0,(C203*K203)-D203) -> 0 | N203: =K203*0.2 -> 16666.666666666668 | O203: =K203-D203-H203-I203-M203-N203 -> 24722.22222222223 | P203: =O203/K203 -> 0.29666666666666675
A204: PBR: Trade Paper | B204: WOMEN'S FICTION | C204: 0.12 | D204: 10000 | E204: 14.95 | F204: =E204*0.12 -> 1.7939999999999998 | G204: =J204*1.25 -> 15483.711135885051 | H204: =G204*F204 -> 27777.777777777777 | I204: =0.05*K204 -> 4166.666666666667 | J204: =D204/C204/0.45/E204 -> 12386.968908708041 | K204: =E204*J204*0.45 -> 83333.333333333343 | L204: =C204*K204 -> 10000 | M204: =IF((C204*K204)-D204<=0,0,(C204*K204)-D204) -> 0 | N204: =K204*0.2 -> 16666.666666666668 | O204: =K204-D204-H204-I204-M204-N204 -> 24722.22222222223 | P204: =O204/K204 -> 0.29666666666666675
A206: TOTALS | D206: =SUM(D5:D204) -> 10900000 | H206: =SUM(H5:H204) -> 30277777.777777679 | I206: =SUM(I5:I204) -> 4541666.6666666707 | J206: =SUM(J5:J204) -> 10876714.108346159 | K206: =SUM(K5:K204) -> 90833333.333333224 | L206: =SUM(L5:L204) -> 10900000 | M206: =SUM(M5:M204) -> 0 | N206: =SUM(N5:N204) -> 18166666.666666683 | O206: =SUM(O5:O204) -> 26947222.222222302 | P206: =O206/K206 -> 0.29666666666666791
A208: FORMULAS | F208: =E208*0.12 | G208: =J208 *1.25 | H208: =G208*F208 | I208: =0.05*K208 | J208: =D208/C208 /0.45/E208 | K208: =E208*J208*0.45 | L208: =C208*K208 | M208: =IF((C208*K208) -D208<=0,0, (C208*K208)-D208) | N208: =K208*0.2 | O208: =K208-D208 -H208-I208 -M208-N208 | P208: =O208 /K208
A210: PP&B = paper, printing, & binding
A211: PBR = paperback reprint of last year's hardcover frontlist